1236	16345615527949694417.wav	تُقدِم بعض الأماكن مشروبات كحولية مجانًا، ولكن يعيق السُكْر الحُكم الصحيح على الأمور ويعلم جميع المقامرين الجيدين أهمية أن يبقى المقامر واعيًا.	تُقدِم بعض الأماكن مشروبات كحولية مجانًا ولكن يعيق السُكر الحُكم الصحيح على الأمور ويعلم جميع المقامرين الجيدين أهمية أن يبقى المقامر واعيًا	ت ُ ق د ِ م | ب ع ض | ا ل أ م ا ك ن | م ش ر و ب ا ت | ك ح و ل ي ة | م ج ا ن ً ا | و ل ك ن | ي ع ي ق | ا ل س ُ ك ر | ا ل ح ُ ك م | ا ل ص ح ي ح | ع ل ى | ا ل أ م و ر | و ي ع ل م | ج م ي ع | ا ل م ق ا م ر ي ن | ا ل ج ي د ي ن | أ ه م ي ة | أ ن | ي ب ق ى | ا ل م ق ا م ر | و ا ع ي ً ا |	225600	FEMALE
328	10780611708812559342.wav	ولد بوبيك في العاصمة الكرواتية "زغرب"، واشتُهِر أثناء لعبه مع بارتيزان بلغراد.	ولد بوبيك في العاصمة الكرواتية زغرب واشتُهِر أثناء لعبه مع بارتيزان بلغراد	و ل د | ب و ب ي ك | ف ي | ا ل ع ا ص م ة | ا ل ك ر و ا ت ي ة | ز غ ر ب | و ا ش ت ُ ه ِ ر | أ ث ن ا ء | ل ع ب ه | م ع | ب ا ر ت ي ز ا ن | ب ل غ ر ا د |	119040	FEMALE
1146	4287900650286767719.wav	لكن أصيب السائق بجروح خطيرة في الرأس.	لكن أصيب السائق بجروح خطيرة في الرأس	ل ك ن | أ ص ي ب | ا ل س ا ئ ق | ب ج ر و ح | خ ط ي ر ة | ف ي | ا ل ر أ س |	103680	FEMALE
1120	2522927385025535801.wav	الرياضات الثلجية على المنحدرات، والتي تشمل التزلج والتزحلق على الجليد، هي من الرياضات الشعبية التي تنطوي على الانزلاق إلى أسفل رقعة من الأرض المغطاة بالثلوج بواسطة الزلاجات أو لوح التزلج المثبتة في قدميك.	الرياضات الثلجية على المنحدرات والتي تشمل التزلج والتزحلق على الجليد هي من الرياضات الشعبية التي تنطوي على الانزلاق إلى أسفل رقعة من الأرض المغطاة بالثلوج بواسطة الزلاجات أو لوح التزلج المثبتة في قدميك	ا ل ر ي ا ض ا ت | ا ل ث ل ج ي ة | ع ل ى | ا ل م ن ح د ر ا ت | و ا ل ت ي | ت ش م ل | ا ل ت ز ل ج | و ا ل ت ز ح ل ق | ع ل ى | ا ل ج ل ي د | ه ي | م ن | ا ل ر ي ا ض ا ت | ا ل ش ع ب ي ة | ا ل ت ي | ت ن ط و ي | ع ل ى | ا ل ا ن ز ل ا ق | إ ل ى | أ س ف ل | ر ق ع ة | م ن | ا ل أ ر ض | ا ل م غ ط ا ة | ب ا ل ث ل و ج | ب و ا س ط ة | ا ل ز ل ا ج ا ت | أ و | ل و ح | ا ل ت ز ل ج | ا ل م ث ب ت ة | ف ي | ق د م ي ك |	212160	FEMALE
743	3385651732835693011.wav	على الرغم من كونها أصغر حجماً، فإنها تذكّر بعض الزائرين القدامى القادمين بهاواي ما قبل قيام الدولة قبل وجود كل الفنادق السياحية الكبيرة وغيرها من التطويرات.	على الرغم من كونها أصغر حجماً فإنها تذكّر بعض الزائرين القدامى القادمين بهاواي ما قبل قيام الدولة قبل وجود كل الفنادق السياحية الكبيرة وغيرها من التطويرات	ع ل ى | ا ل ر غ م | م ن | ك و ن ه ا | أ ص غ ر | ح ج م ا ً | ف إ ن ه ا | ت ذ ك ّ ر | ب ع ض | ا ل ز ا ئ ر ي ن | ا ل ق د ا م ى | ا ل ق ا د م ي ن | ب ه ا و ا ي | م ا | ق ب ل | ق ي ا م | ا ل د و ل ة | ق ب ل | و ج و د | ك ل | ا ل ف ن ا د ق | ا ل س ي ا ح ي ة | ا ل ك ب ي ر ة | و غ ي ر ه ا | م ن | ا ل ت ط و ي ر ا ت |	224640	FEMALE
1157	6765137320823507956.wav	تقع مونتفيديو في المناطق شبه الاستوائية؛ من الشائع أن تتعدى درجات الحرارة 30 درجة مئوية في أشهر الصيف.	تقع مونتفيديو في المناطق شبه الاستوائية من الشائع أن تتعدى درجات الحرارة 30 درجة مئوية في أشهر الصيف	ت ق ع | م و ن ت ف ي د ي و | ف ي | ا ل م ن ا ط ق | ش ب ه | ا ل ا س ت و ا ئ ي ة | م ن | ا ل ش ا ئ ع | أ ن | ت ت ع د ى | د ر ج ا ت | ا ل ح ر ا ر ة | 3 0 | د ر ج ة | م ئ و ي ة | ف ي | أ ش ه ر | ا ل ص ي ف |	182400	FEMALE
329	3767962594339893690.wav	انضم إليهم عام 1945 وبقي حتى عام 1958.	انضم إليهم عام 1945 وبقي حتى عام 1958	ا ن ض م | إ ل ي ه م | ع ا م | 1 9 4 5 | و ب ق ي | ح ت ى | ع ا م | 1 9 5 8 |	101760	FEMALE
450	12105754104254216249.wav	ثم نعود إلى الشمال عبر الغرب، مرة أخرى عبر نهر مارا، بعد هطول الأمطار في شهر أبريل تقريباً.	ثم نعود إلى الشمال عبر الغرب مرة أخرى عبر نهر مارا بعد هطول الأمطار في شهر أبريل تقريباً	ث م | ن ع و د | إ ل ى | ا ل ش م ا ل | ع ب ر | ا ل غ ر ب | م ر ة | أ خ ر ى | ع ب ر | ن ه ر | م ا ر ا | ب ع د | ه ط و ل | ا ل أ م ط ا ر | ف ي | ش ه ر | أ ب ر ي ل | ت ق ر ي ب ا ً |	152640	MALE
92	88499053713543250.wav	صرح لودين أن المسؤولين قد قرروا إلغاء جولة الإعادة لتجنيب الأفغان النفقات والمخاطر الأمنية التي تترتب على انتخابات أخرى.	صرح لودين أن المسؤولين قد قرروا إلغاء جولة الإعادة لتجنيب الأفغان النفقات والمخاطر الأمنية التي تترتب على انتخابات أخرى	ص ر ح | ل و د ي ن | أ ن | ا ل م س ؤ و ل ي ن | ق د | ق ر ر و ا | إ ل غ ا ء | ج و ل ة | ا ل إ ع ا د ة | ل ت ج ن ي ب | ا ل أ ف غ ا ن | ا ل ن ف ق ا ت | و ا ل م خ ا ط ر | ا ل أ م ن ي ة | ا ل ت ي | ت ت ر ت ب | ع ل ى | ا ن ت خ ا ب ا ت | أ خ ر ى |	204480	FEMALE
347	13103928448940616769.wav	كان الناس يضربون ألواح الزجاج بالكراسي، لكن النوافذ كانت غير قابلة للكسر.	كان الناس يضربون ألواح الزجاج بالكراسي لكن النوافذ كانت غير قابلة للكسر	ك ا ن | ا ل ن ا س | ي ض ر ب و ن | أ ل و ا ح | ا ل ز ج ا ج | ب ا ل ك ر ا س ي | ل ك ن | ا ل ن و ا ف ذ | ك ا ن ت | غ ي ر | ق ا ب ل ة | ل ل ك س ر |	130560	FEMALE
1352	16265078617171580530.wav	قد يساعد فهم شيء ما حول كيفية عمل الطائرات وما يحدث أثناء الرحلة البعض في التغلب على الخوف الذي ينبع من المجهول أو من عدم السيطرة.	قد يساعد فهم شيء ما حول كيفية عمل الطائرات وما يحدث أثناء الرحلة البعض في التغلب على الخوف الذي ينبع من المجهول أو من عدم السيطرة	ق د | ي س ا ع د | ف ه م | ش ي ء | م ا | ح و ل | ك ي ف ي ة | ع م ل | ا ل ط ا ئ ر ا ت | و م ا | ي ح د ث | أ ث ن ا ء | ا ل ر ح ل ة | ا ل ب ع ض | ف ي | ا ل ت غ ل ب | ع ل ى | ا ل خ و ف | ا ل ذ ي | ي ن ب ع | م ن | ا ل م ج ه و ل | أ و | م ن | ع د م | ا ل س ي ط ر ة |	234240	FEMALE
1229	12762013283541993885.wav	تصدّر زميله في الفريق فرناندو ألونسو معظم السباق، لكنه أنهاه مباشرةً بعد التوقف للصيانة، ربما بسبب التواء العجلة الأمامية اليمنى بشدة.	تصدّر زميله في الفريق فرناندو ألونسو معظم السباق لكنه أنهاه مباشرةً بعد التوقف للصيانة ربما بسبب التواء العجلة الأمامية اليمنى بشدة	ت ص د ّ ر | ز م ي ل ه | ف ي | ا ل ف ر ي ق | ف ر ن ا ن د و | أ ل و ن س و | م ع ظ م | ا ل س ب ا ق | ل ك ن ه | أ ن ه ا ه | م ب ا ش ر ة ً | ب ع د | ا ل ت و ق ف | ل ل ص ي ا ن ة | ر ب م ا | ب س ب ب | ا ل ت و ا ء | ا ل ع ج ل ة | ا ل أ م ا م ي ة | ا ل ي م ن ى | ب ش د ة |	178560	FEMALE
677	11363978567060610298.wav	ضع في اعتبارك أثناء التخطيط أنه على الرغم من أن جنوب أفريقيا مستقرة، لكن ليست جميع البلدان المجاورة كذلك.	ضع في اعتبارك أثناء التخطيط أنه على الرغم من أن جنوب أفريقيا مستقرة لكن ليست جميع البلدان المجاورة كذلك	ض ع | ف ي | ا ع ت ب ا ر ك | أ ث ن ا ء | ا ل ت خ ط ي ط | أ ن ه | ع ل ى | ا ل ر غ م | م ن | أ ن | ج ن و ب | أ ف ر ي ق ي ا | م س ت ق ر ة | ل ك ن | ل ي س ت | ج م ي ع | ا ل ب ل د ا ن | ا ل م ج ا و ر ة | ك ذ ل ك |	154560	FEMALE
925	5901548099655581457.wav	تنطبق القواعد المتعلقة بالتصوير العادي أيضاً على تسجيل الفيديو، وربما أكثر من ذلك.	تنطبق القواعد المتعلقة بالتصوير العادي أيضاً على تسجيل الفيديو وربما أكثر من ذلك	ت ن ط ب ق | ا ل ق و ا ع د | ا ل م ت ع ل ق ة | ب ا ل ت ص و ي ر | ا ل ع ا د ي | أ ي ض ا ً | ع ل ى | ت س ج ي ل | ا ل ف ي د ي و | و ر ب م ا | أ ك ث ر | م ن | ذ ل ك |	138240	MALE
205	15788812245280172376.wav	تحاول طائرة توين أوتر الهبوط في كوكودا منذ البارحة كرحلة برقم CG4684 على خطوط طيران PNG، لكن العملية قد أوقفت مرة بالفعل.	تحاول طائرة توين أوتر الهبوط في كوكودا منذ البارحة كرحلة برقم cg4684 على خطوط طيران png لكن العملية قد أوقفت مرة بالفعل	ت ح ا و ل | ط ا ئ ر ة | ت و ي ن | أ و ت ر | ا ل ه ب و ط | ف ي | ك و ك و د ا | م ن ذ | ا ل ب ا ر ح ة | ك ر ح ل ة | ب ر ق م | c g 4 6 8 4 | ع ل ى | خ ط و ط | ط ي ر ا ن | p n g | ل ك ن | ا ل ع م ل ي ة | ق د | أ و ق ف ت | م ر ة | ب ا ل ف ع ل |	172800	MALE
661	11714748314290541084.wav	أكبر قطاعات العمل هي الخدمات المهنيّة، والقطاع الحكومي، والماليّة، والتجارة، والسياحة.	أكبر قطاعات العمل هي الخدمات المهنيّة والقطاع الحكومي والماليّة والتجارة والسياحة	أ ك ب ر | ق ط ا ع ا ت | ا ل ع م ل | ه ي | ا ل خ د م ا ت | ا ل م ه ن ي ّ ة | و ا ل ق ط ا ع | ا ل ح ك و م ي | و ا ل م ا ل ي ّ ة | و ا ل ت ج ا ر ة | و ا ل س ي ا ح ة |	117120	FEMALE
1470	14082893862775760184.wav	من الأمثلة الحديثة الأكثر جدارةً بالملاحظة هي حملة شمال الأطلسي في الحرب العالمية الثانية. حيث حاول الأمريكيون نقل الأفراد والمواد عبر المحيط الأطلسي في سبيل مساعدة بريطانيا.	من الأمثلة الحديثة الأكثر جدارةً بالملاحظة هي حملة شمال الأطلسي في الحرب العالمية الثانية حيث حاول الأمريكيون نقل الأفراد والمواد عبر المحيط الأطلسي في سبيل مساعدة بريطانيا	م ن | ا ل أ م ث ل ة | ا ل ح د ي ث ة | ا ل أ ك ث ر | ج د ا ر ة ً | ب ا ل م ل ا ح ظ ة | ه ي | ح م ل ة | ش م ا ل | ا ل أ ط ل س ي | ف ي | ا ل ح ر ب | ا ل ع ا ل م ي ة | ا ل ث ا ن ي ة | ح ي ث | ح ا و ل | ا ل أ م ر ي ك ي و ن | ن ق ل | ا ل أ ف ر ا د | و ا ل م و ا د | ع ب ر | ا ل م ح ي ط | ا ل أ ط ل س ي | ف ي | س ب ي ل | م س ا ع د ة | ب ر ي ط ا ن ي ا |	230400	FEMALE
1373	10135074524920009316.wav	وستتولى تركيا أيضاً حراسة مقاتلي داعش الذين تم أسرهم، وقال البيان إن الدول الأوروبية رفضت إعادتهم.	وستتولى تركيا أيضاً حراسة مقاتلي داعش الذين تم أسرهم وقال البيان إن الدول الأوروبية رفضت إعادتهم	و س ت ت و ل ى | ت ر ك ي ا | أ ي ض ا ً | ح ر ا س ة | م ق ا ت ل ي | د ا ع ش | ا ل ذ ي ن | ت م | أ س ر ه م | و ق ا ل | ا ل ب ي ا ن | إ ن | ا ل د و ل | ا ل أ و ر و ب ي ة | ر ف ض ت | إ ع ا د ت ه م |	157440	MALE
183	8811948255558289565.wav	أفاد متحدثٌ باسم الحكومة: "من المهم الآن سواءً من منظور الصّحة العامّة أو من منظور العدالة الجنائية أن يتمّ سنّ التّشريع في أسرع وقتٍ ممكنٍ".	أفاد متحدثٌ باسم الحكومة من المهم الآن سواءً من منظور الصّحة العامّة أو من منظور العدالة الجنائية أن يتمّ سنّ التّشريع في أسرع وقتٍ ممكنٍ	أ ف ا د | م ت ح د ث ٌ | ب ا س م | ا ل ح ك و م ة | م ن | ا ل م ه م | ا ل آ ن | س و ا ء ً | م ن | م ن ظ و ر | ا ل ص ّ ح ة | ا ل ع ا م ّ ة | أ و | م ن | م ن ظ و ر | ا ل ع د ا ل ة | ا ل ج ن ا ئ ي ة | أ ن | ي ت م ّ | س ن ّ | ا ل ت ّ ش ر ي ع | ف ي | أ س ر ع | و ق ت ٍ | م م ك ن ٍ |	165120	FEMALE
856	6637729732306190408.wav	يحتوي كل قطار على عربات الدرجة الأولى والدرجة الثالثة؛ تكون عربات الدرجة الأولى دائماً في نهاية القطار الأقرب لمدينة كيب تاون.	يحتوي كل قطار على عربات الدرجة الأولى والدرجة الثالثة تكون عربات الدرجة الأولى دائماً في نهاية القطار الأقرب لمدينة كيب تاون	ي ح ت و ي | ك ل | ق ط ا ر | ع ل ى | ع ر ب ا ت | ا ل د ر ج ة | ا ل أ و ل ى | و ا ل د ر ج ة | ا ل ث ا ل ث ة | ت ك و ن | ع ر ب ا ت | ا ل د ر ج ة | ا ل أ و ل ى | د ا ئ م ا ً | ف ي | ن ه ا ي ة | ا ل ق ط ا ر | ا ل أ ق ر ب | ل م د ي ن ة | ك ي ب | ت ا و ن |	204480	FEMALE
835	982595094007009630.wav	في كثيرٍ من البلدان التي يوجد فيها مثل هذا القانون، تتولّى الفنادق المحلية مهمّة التسجيل (تأكد من الاستفسار عن ذلك).	في كثيرٍ من البلدان التي يوجد فيها مثل هذا القانون، تتولّى الفنادق المحلية مهمّة التسجيل تأكد من الاستفسار عن ذلك	ف ي | ك ث ي ر ٍ | م ن | ا ل ب ل د ا ن | ا ل ت ي | ي و ج د | ف ي ه ا | م ث ل | ه ذ ا | ا ل ق ا ن و ن ، | ت ت و ل ّ ى | ا ل ف ن ا د ق | ا ل م ح ل ي ة | م ه م ّ ة | ا ل ت س ج ي ل | ت أ ك د | م ن | ا ل ا س ت ف س ا ر | ع ن | ذ ل ك |	146880	MALE
86	4084940290894980688.wav	اقترح بيتمان أن الأحوال لن تتحسن حتى وقتٍ ما في الأسبوع القادم.	اقترح بيتمان أن الأحوال لن تتحسن حتى وقتٍ ما في الأسبوع القادم	ا ق ت ر ح | ب ي ت م ا ن | أ ن | ا ل أ ح و ا ل | ل ن | ت ت ح س ن | ح ت ى | و ق ت ٍ | م ا | ف ي | ا ل أ س ب و ع | ا ل ق ا د م |	79680	MALE
401	17581162858168328590.wav	الآن بالنسبة لليابان. كانت اليابان دولةً جزريةً، تماماً مثل بريطانيا.	الآن بالنسبة لليابان كانت اليابان دولةً جزريةً تماماً مثل بريطانيا	ا ل آ ن | ب ا ل ن س ب ة | ل ل ي ا ب ا ن | ك ا ن ت | ا ل ي ا ب ا ن | د و ل ة ً | ج ز ر ي ة ً | ت م ا م ا ً | م ث ل | ب ر ي ط ا ن ي ا |	117120	MALE
359	7958073622759271669.wav	يقومون بذلك عن طريق انبعاث جسيم ضوئي صغير يعرف ب "الفوتون".	يقومون بذلك عن طريق انبعاث جسيم ضوئي صغير يعرف ب الفوتون	ي ق و م و ن | ب ذ ل ك | ع ن | ط ر ي ق | ا ن ب ع ا ث | ج س ي م | ض و ئ ي | ص غ ي ر | ي ع ر ف | ب | ا ل ف و ت و ن |	119040	FEMALE
753	4765823457665779479.wav	باختصار، سيارتك وسيلة رائعة للقيام برحلة برية، ولكن نادراً ما تكون في حد ذاتها وسيلة "للتخييم".	باختصار سيارتك وسيلة رائعة للقيام برحلة برية ولكن نادراً ما تكون في حد ذاتها وسيلة للتخييم	ب ا خ ت ص ا ر | س ي ا ر ت ك | و س ي ل ة | ر ا ئ ع ة | ل ل ق ي ا م | ب ر ح ل ة | ب ر ي ة | و ل ك ن | ن ا د ر ا ً | م ا | ت ك و ن | ف ي | ح د | ذ ا ت ه ا | و س ي ل ة | ل ل ت خ ي ي م |	138240	FEMALE
750	431270468247594719.wav	لركوب سيارتك الخاصة والانطلاق بها في رحلة طويلة جاذبية ذاتية تكمن في بساطة الأمر.	لركوب سيارتك الخاصة والانطلاق بها في رحلة طويلة جاذبية ذاتية تكمن في بساطة الأمر	ل ر ك و ب | س ي ا ر ت ك | ا ل خ ا ص ة | و ا ل ا ن ط ل ا ق | ب ه ا | ف ي | ر ح ل ة | ط و ي ل ة | ج ا ذ ب ي ة | ذ ا ت ي ة | ت ك م ن | ف ي | ب س ا ط ة | ا ل أ م ر |	112320	FEMALE
969	16216304142468532182.wav	على مر القرون، بنى الناس الشرفات بعناية على المناظر الطبيعية الوعرة شديدة الانحدار لتصل بينها وبين المنحدرات المُطلّة على البحر.	على مر القرون بنى الناس الشرفات بعناية على المناظر الطبيعية الوعرة شديدة الانحدار لتصل بينها وبين المنحدرات المُطلّة على البحر	ع ل ى | م ر | ا ل ق ر و ن | ب ن ى | ا ل ن ا س | ا ل ش ر ف ا ت | ب ع ن ا ي ة | ع ل ى | ا ل م ن ا ظ ر | ا ل ط ب ي ع ي ة | ا ل و ع ر ة | ش د ي د ة | ا ل ا ن ح د ا ر | ل ت ص ل | ب ي ن ه ا | و ب ي ن | ا ل م ن ح د ر ا ت | ا ل م ُ ط ل ّ ة | ع ل ى | ا ل ب ح ر |	144000	FEMALE
1488	13194745242358146394.wav	أصيب إدغار فيغويلا بجروحٍ في ذراعه وفكه بينما كان كريستوفر شنايدر بحاجة إلى جراحةٍ ترميميةٍ لوجهه.	أصيب إدغار فيغويلا بجروحٍ في ذراعه وفكه بينما كان كريستوفر شنايدر بحاجة إلى جراحةٍ ترميميةٍ لوجهه	أ ص ي ب | إ د غ ا ر | ف ي غ و ي ل ا | ب ج ر و ح ٍ | ف ي | ذ ر ا ع ه | و ف ك ه | ب ي ن م ا | ك ا ن | ك ر ي س ت و ف ر | ش ن ا ي د ر | ب ح ا ج ة | إ ل ى | ج ر ا ح ة ٍ | ت ر م ي م ي ة ٍ | ل و ج ه ه |	161280	FEMALE
949	16611238976625119099.wav	تأكد أن كل شئ سيكون واضحًا بمجرد أن تصل إلى المرسى. ستقابل المسافرين الآخرين الذين يطلبون التوصيل المجاني بالقوارب وسيخبرونك بما لديهم من معلومات.	تأكد أن كل شئ سيكون واضحًا بمجرد أن تصل إلى المرسى ستقابل المسافرين الآخرين الذين يطلبون التوصيل المجاني بالقوارب وسيخبرونك بما لديهم من معلومات	ت أ ك د | أ ن | ك ل | ش ئ | س ي ك و ن | و ا ض ح ً ا | ب م ج ر د | أ ن | ت ص ل | إ ل ى | ا ل م ر س ى | س ت ق ا ب ل | ا ل م س ا ف ر ي ن | ا ل آ خ ر ي ن | ا ل ذ ي ن | ي ط ل ب و ن | ا ل ت و ص ي ل | ا ل م ج ا ن ي | ب ا ل ق و ا ر ب | و س ي خ ب ر و ن ك | ب م ا | ل د ي ه م | م ن | م ع ل و م ا ت |	201600	FEMALE
633	14496727753987865396.wav	على سبيل المثال، إذا رأيت شخصاً يكسر نافذة سيارة، فمن المحتمل أن تفترض أنه كان يحاول سرقة سيارة شخص غريب.	على سبيل المثال إذا رأيت شخصاً يكسر نافذة سيارة فمن المحتمل أن تفترض أنه كان يحاول سرقة سيارة شخص غريب	ع ل ى | س ب ي ل | ا ل م ث ا ل | إ ذ ا | ر أ ي ت | ش خ ص ا ً | ي ك س ر | ن ا ف ذ ة | س ي ا ر ة | ف م ن | ا ل م ح ت م ل | أ ن | ت ف ت ر ض | أ ن ه | ك ا ن | ي ح ا و ل | س ر ق ة | س ي ا ر ة | ش خ ص | غ ر ي ب |	165120	MALE
290	2900057246955847807.wav	مما أظهرته خريطة الزلازل الدولية للمسح الجيولوجي بالولايات المتحدة، عدم وجود زلازل في "أيسلندا" في الأسبوع الماضي.	مما أظهرته خريطة الزلازل الدولية للمسح الجيولوجي بالولايات المتحدة عدم وجود زلازل في أيسلندا في الأسبوع الماضي	م م ا | أ ظ ه ر ت ه | خ ر ي ط ة | ا ل ز ل ا ز ل | ا ل د و ل ي ة | ل ل م س ح | ا ل ج ي و ل و ج ي | ب ا ل و ل ا ي ا ت | ا ل م ت ح د ة | ع د م | و ج و د | ز ل ا ز ل | ف ي | أ ي س ل ن د ا | ف ي | ا ل أ س ب و ع | ا ل م ا ض ي |	155520	FEMALE
602	3200197115751958122.wav	لا يزال للنيتروجين كغاز نفس خصائص النيتروجين السائل. تكون الحالة السائلة أكثر كثافة ولكن الجزيئات تبقى كما هي.	لا يزال للنيتروجين كغاز نفس خصائص النيتروجين السائل تكون الحالة السائلة أكثر كثافة ولكن الجزيئات تبقى كما هي	ل ا | ي ز ا ل | ل ل ن ي ت ر و ج ي ن | ك غ ا ز | ن ف س | خ ص ا ئ ص | ا ل ن ي ت ر و ج ي ن | ا ل س ا ئ ل | ت ك و ن | ا ل ح ا ل ة | ا ل س ا ئ ل ة | أ ك ث ر | ك ث ا ف ة | و ل ك ن | ا ل ج ز ي ئ ا ت | ت ب ق ى | ك م ا | ه ي |	144000	MALE
832	15501185078722722547.wav	في قطارات النوم الليلية، يمكن أن يتم جمع جوازات السفر بواسطة المحصل حتى لا ينقطع نومك.	في قطارات النوم الليلية يمكن أن يتم جمع جوازات السفر بواسطة المحصل حتى لا ينقطع نومك	ف ي | ق ط ا ر ا ت | ا ل ن و م | ا ل ل ي ل ي ة | ي م ك ن | أ ن | ي ت م | ج م ع | ج و ا ز ا ت | ا ل س ف ر | ب و ا س ط ة | ا ل م ح ص ل | ح ت ى | ل ا | ي ن ق ط ع | ن و م ك |	114240	FEMALE
115	2251727652377558164.wav	هذه هي عملية الاستحواذ الأكبر بتاريخ إيباي.	هذه هي عملية الاستحواذ الأكبر بتاريخ إيباي	ه ذ ه | ه ي | ع م ل ي ة | ا ل ا س ت ح و ا ذ | ا ل أ ك ب ر | ب ت ا ر ي خ | إ ي ب ا ي |	71040	FEMALE
119	17711502818718849034.wav	صرحت كونامي، ناشرة اللعبة، اليوم في إحدى الصحف اليابانية بأن الشركة لن تطلق لعبة "االأيام الستة" في الفلوجة.	صرحت كونامي ناشرة اللعبة اليوم في إحدى الصحف اليابانية بأن الشركة لن تطلق لعبة االأيام الستة في الفلوجة	ص ر ح ت | ك و ن ا م ي | ن ا ش ر ة | ا ل ل ع ب ة | ا ل ي و م | ف ي | إ ح د ى | ا ل ص ح ف | ا ل ي ا ب ا ن ي ة | ب أ ن | ا ل ش ر ك ة | ل ن | ت ط ل ق | ل ع ب ة | ا ا ل أ ي ا م | ا ل س ت ة | ف ي | ا ل ف ل و ج ة |	167040	FEMALE
343	773771403967225089.wav	لقد مررنا بأزمة مالية استمرّت لمدة عام، وبلغت لحظاتها الأكثر حدّة في الشهرين الماضيين، وأعتقد أنّ الأسواق المالية قد بدأت الآن تتعافى."	لقد مررنا بأزمة مالية استمرّت لمدة عام وبلغت لحظاتها الأكثر حدّة في الشهرين الماضيين وأعتقد أنّ الأسواق المالية قد بدأت الآن تتعافى	ل ق د | م ر ر ن ا | ب أ ز م ة | م ا ل ي ة | ا س ت م ر ّ ت | ل م د ة | ع ا م | و ب ل غ ت | ل ح ظ ا ت ه ا | ا ل أ ك ث ر | ح د ّ ة | ف ي | ا ل ش ه ر ي ن | ا ل م ا ض ي ي ن | و أ ع ت ق د | أ ن ّ | ا ل أ س و ا ق | ا ل م ا ل ي ة | ق د | ب د أ ت | ا ل آ ن | ت ت ع ا ف ى |	228480	FEMALE
