592	5719209295376608048.wav	ربما يوماً ما، سيقف أحفاد أحفادك على قمة عالم فضائي ويتساءلون عن أسلافهم القدامى؟	ربما يوماً ما سيقف أحفاد أحفادك على قمة عالم فضائي ويتساءلون عن أسلافهم القدامى	ر ب م ا | ي و م ا ً | م ا | س ي ق ف | أ ح ف ا د | أ ح ف ا د ك | ع ل ى | ق م ة | ع ا ل م | ف ض ا ئ ي | و ي ت س ا ء ل و ن | ع ن | أ س ل ا ف ه م | ا ل ق د ا م ى |	170880	FEMALE
364	17798801047328794511.wav	يجب استبدال مصباح الإضاءة إذاً. يجب توخّي الحذر أثناء استبدال مصباح الإضاءة.	يجب استبدال مصباح الإضاءة إذاً يجب توخّي الحذر أثناء استبدال مصباح الإضاءة	ي ج ب | ا س ت ب د ا ل | م ص ب ا ح | ا ل إ ض ا ء ة | إ ذ ا ً | ي ج ب | ت و خ ّ ي | ا ل ح ذ ر | أ ث ن ا ء | ا س ت ب د ا ل | م ص ب ا ح | ا ل إ ض ا ء ة |	104640	FEMALE
476	15177596475549835241.wav	وبحسب ما ذكر في الرواية، فإن دافعه كان الوصول إلى الشّهرة بأيّ ثمن. وقد أعلن سكان أفسس الغاضبون رفضهم تسجيل اسم هيروستراتس مطلقًا.	وبحسب ما ذكر في الرواية فإن دافعه كان الوصول إلى الشّهرة بأيّ ثمن وقد أعلن سكان أفسس الغاضبون رفضهم تسجيل اسم هيروستراتس مطلقًا	و ب ح س ب | م ا | ذ ك ر | ف ي | ا ل ر و ا ي ة | ف إ ن | د ا ف ع ه | ك ا ن | ا ل و ص و ل | إ ل ى | ا ل ش ّ ه ر ة | ب أ ي ّ | ث م ن | و ق د | أ ع ل ن | س ك ا ن | أ ف س س | ا ل غ ا ض ب و ن | ر ف ض ه م | ت س ج ي ل | ا س م | ه ي ر و س ت ر ا ت س | م ط ل ق ً ا |	174720	FEMALE
481	17653790957569810658.wav	في الأكورديون، للحصول على صوت أعلى إضافي، يمكنك استخدام المنفاخ بمزيد من الضغط أو السرعة.	في الأكورديون للحصول على صوت أعلى إضافي يمكنك استخدام المنفاخ بمزيد من الضغط أو السرعة	ف ي | ا ل أ ك و ر د ي و ن | ل ل ح ص و ل | ع ل ى | ص و ت | أ ع ل ى | إ ض ا ف ي | ي م ك ن ك | ا س ت خ د ا م | ا ل م ن ف ا خ | ب م ز ي د | م ن | ا ل ض غ ط | أ و | ا ل س ر ع ة |	166080	FEMALE
1143	17706255778176927251.wav	هذه ممارسة شائعة في أماكن أخرى في المملكة المتحدة ولكن العدالة الاسكتلندية تعمل بشكل مختلف واعتبرت المحاكم أن نشر الصور يحتمل أن يكون متحيزاً.	هذه ممارسة شائعة في أماكن أخرى في المملكة المتحدة ولكن العدالة الاسكتلندية تعمل بشكل مختلف واعتبرت المحاكم أن نشر الصور يحتمل أن يكون متحيزاً	ه ذ ه | م م ا ر س ة | ش ا ئ ع ة | ف ي | أ م ا ك ن | أ خ ر ى | ف ي | ا ل م م ل ك ة | ا ل م ت ح د ة | و ل ك ن | ا ل ع د ا ل ة | ا ل ا س ك ت ل ن د ي ة | ت ع م ل | ب ش ك ل | م خ ت ل ف | و ا ع ت ب ر ت | ا ل م ح ا ك م | أ ن | ن ش ر | ا ل ص و ر | ي ح ت م ل | أ ن | ي ك و ن | م ت ح ي ز ا ً |	176640	MALE
242	3642464108809195656.wav	قامت المركبة المدارية القمرية غير المأهولة "تشاندرايان-1" بإطلاق مسبار مون إمباكت (MIP)، الذي اخترق سطح القمر بسرعة 1.5 كيلومتر في الثانية (3000 ميل في الساعة)، وتمكن من الهبوط على مقربة من قطب القمر الجنوبي.	قامت المركبة المدارية القمرية غير المأهولة تشاندرايان-1 بإطلاق مسبار مون إمباكت mip، الذي اخترق سطح القمر بسرعة 1.5 كيلومتر في الثانية 3000 ميل في الساعة، وتمكن من الهبوط على مقربة من قطب القمر الجنوبي	ق ا م ت | ا ل م ر ك ب ة | ا ل م د ا ر ي ة | ا ل ق م ر ي ة | غ ي ر | ا ل م أ ه و ل ة | ت ش ا ن د ر ا ي ا ن - 1 | ب إ ط ل ا ق | م س ب ا ر | م و ن | إ م ب ا ك ت | m i p ، | ا ل ذ ي | ا خ ت ر ق | س ط ح | ا ل ق م ر | ب س ر ع ة | 1 . 5 | ك ي ل و م ت ر | ف ي | ا ل ث ا ن ي ة | 3 0 0 0 | م ي ل | ف ي | ا ل س ا ع ة ، | و ت م ك ن | م ن | ا ل ه ب و ط | ع ل ى | م ق ر ب ة | م ن | ق ط ب | ا ل ق م ر | ا ل ج ن و ب ي |	312960	MALE
565	12193259599299231440.wav	فقط آثار الكارثة، ولم يكن الاكتئاب والخوف شرطًا في جلسات نشاط بدني منتظمة أسبوعياً.	فقط آثار الكارثة ولم يكن الاكتئاب والخوف شرطًا في جلسات نشاط بدني منتظمة أسبوعياً	ف ق ط | آ ث ا ر | ا ل ك ا ر ث ة | و ل م | ي ك ن | ا ل ا ك ت ئ ا ب | و ا ل خ و ف | ش ر ط ً ا | ف ي | ج ل س ا ت | ن ش ا ط | ب د ن ي | م ن ت ظ م ة | أ س ب و ع ي ا ً |	121920	FEMALE
1040	2619772284999179149.wav	جميع مداخل الكهف، التي سُمّيت "الأخوات السبعة"، يبلغ قطرها على الأقل من 100 إلى 250 متراً (من 328 إلى 820 قدماً).	جميع مداخل الكهف، التي سُمّيت الأخوات السبعة"، يبلغ قطرها على الأقل من 100 إلى 250 متراً من 328 إلى 820 قدماً	ج م ي ع | م د ا خ ل | ا ل ك ه ف ، | ا ل ت ي | س ُ م ّ ي ت | ا ل أ خ و ا ت | ا ل س ب ع ة " ، | ي ب ل غ | ق ط ر ه ا | ع ل ى | ا ل أ ق ل | م ن | 1 0 0 | إ ل ى | 2 5 0 | م ت ر ا ً | م ن | 3 2 8 | إ ل ى | 8 2 0 | ق د م ا ً |	182400	FEMALE
636	16355232135580101253.wav	في هذا الرنين، تتسبب المجالات المغناطيسيّة والموجات الراديويّة في حث الذرّات على إرسال إشارات لاسلكية دقيقة.	في هذا الرنين تتسبب المجالات المغناطيسيّة والموجات الراديويّة في حث الذرّات على إرسال إشارات لاسلكية دقيقة	ف ي | ه ذ ا | ا ل ر ن ي ن | ت ت س ب ب | ا ل م ج ا ل ا ت | ا ل م غ ن ا ط ي س ي ّ ة | و ا ل م و ج ا ت | ا ل ر ا د ي و ي ّ ة | ف ي | ح ث | ا ل ذ ر ّ ا ت | ع ل ى | إ ر س ا ل | إ ش ا ر ا ت | ل ا س ل ك ي ة | د ق ي ق ة |	192000	MALE
640	16168819236733044155.wav	يحفّز الاتصال غير المتزامن لتخصيص الوقت للتأمل والتفاعل تجاه الآخرين.	يحفّز الاتصال غير المتزامن لتخصيص الوقت للتأمل والتفاعل تجاه الآخرين	ي ح ف ّ ز | ا ل ا ت ص ا ل | غ ي ر | ا ل م ت ز ا م ن | ل ت خ ص ي ص | ا ل و ق ت | ل ل ت أ م ل | و ا ل ت ف ا ع ل | ت ج ا ه | ا ل آ خ ر ي ن |	124800	FEMALE
870	6155435723383697137.wav	لا تنم على فرشٍ أو لبادةٍ على الأرض في الأماكن التي لست على دراية فيها بالحيوانات المحلية.	لا تنم على فرشٍ أو لبادةٍ على الأرض في الأماكن التي لست على دراية فيها بالحيوانات المحلية	ل ا | ت ن م | ع ل ى | ف ر ش ٍ | أ و | ل ب ا د ة ٍ | ع ل ى | ا ل أ ر ض | ف ي | ا ل أ م ا ك ن | ا ل ت ي | ل س ت | ع ل ى | د ر ا ي ة | ف ي ه ا | ب ا ل ح ي و ا ن ا ت | ا ل م ح ل ي ة |	153600	MALE
1263	17440281081490433963.wav	إن المدن المستقلة ذاتياً هي بمثابة أسلاف الأمم. إن الثقافة الحضارية تعني ضمناً نقل المعرفة عبر عدة أجيال، بصمة ثقافية متبقية ونشر المعرفة بشكل عادل.	إن المدن المستقلة ذاتياً هي بمثابة أسلاف الأمم إن الثقافة الحضارية تعني ضمناً نقل المعرفة عبر عدة أجيال بصمة ثقافية متبقية ونشر المعرفة بشكل عادل	إ ن | ا ل م د ن | ا ل م س ت ق ل ة | ذ ا ت ي ا ً | ه ي | ب م ث ا ب ة | أ س ل ا ف | ا ل أ م م | إ ن | ا ل ث ق ا ف ة | ا ل ح ض ا ر ي ة | ت ع ن ي | ض م ن ا ً | ن ق ل | ا ل م ع ر ف ة | ع ب ر | ع د ة | أ ج ي ا ل | ب ص م ة | ث ق ا ف ي ة | م ت ب ق ي ة | و ن ش ر | ا ل م ع ر ف ة | ب ش ك ل | ع ا د ل |	254400	MALE
832	8186407691083146504.wav	في قطارات النوم الليلية، يمكن أن يتم جمع جوازات السفر بواسطة المحصل حتى لا ينقطع نومك.	في قطارات النوم الليلية يمكن أن يتم جمع جوازات السفر بواسطة المحصل حتى لا ينقطع نومك	ف ي | ق ط ا ر ا ت | ا ل ن و م | ا ل ل ي ل ي ة | ي م ك ن | أ ن | ي ت م | ج م ع | ج و ا ز ا ت | ا ل س ف ر | ب و ا س ط ة | ا ل م ح ص ل | ح ت ى | ل ا | ي ن ق ط ع | ن و م ك |	126720	FEMALE
951	1423816391354834275.wav	حاول أن تتحدث مع أكبر عدد ممكن من الأشخاص، فمع مرور الوقت سيعرفك الجميع، ويعطوك نصائح حول القوارب التي تبحث عن شخص.	حاول أن تتحدث مع أكبر عدد ممكن من الأشخاص فمع مرور الوقت سيعرفك الجميع ويعطوك نصائح حول القوارب التي تبحث عن شخص	ح ا و ل | أ ن | ت ت ح د ث | م ع | أ ك ب ر | ع د د | م م ك ن | م ن | ا ل أ ش خ ا ص | ف م ع | م ر و ر | ا ل و ق ت | س ي ع ر ف ك | ا ل ج م ي ع | و ي ع ط و ك | ن ص ا ئ ح | ح و ل | ا ل ق و ا ر ب | ا ل ت ي | ت ب ح ث | ع ن | ش خ ص |	184320	MALE
1387	8286438329180500507.wav	بالنسبة لبعض المهرجانات، فإن الغالبية العظمى من الحاضرين في المهرجانات الموسيقية يقررون التخييم في الموقع معتبرين ذلك جزءًا مهمًا من التجربة.	بالنسبة لبعض المهرجانات فإن الغالبية العظمى من الحاضرين في المهرجانات الموسيقية يقررون التخييم في الموقع معتبرين ذلك جزءًا مهمًا من التجربة	ب ا ل ن س ب ة | ل ب ع ض | ا ل م ه ر ج ا ن ا ت | ف إ ن | ا ل غ ا ل ب ي ة | ا ل ع ظ م ى | م ن | ا ل ح ا ض ر ي ن | ف ي | ا ل م ه ر ج ا ن ا ت | ا ل م و س ي ق ي ة | ي ق ر ر و ن | ا ل ت خ ي ي م | ف ي | ا ل م و ق ع | م ع ت ب ر ي ن | ذ ل ك | ج ز ء ً ا | م ه م ً ا | م ن | ا ل ت ج ر ب ة |	219840	MALE
13	4000985692524723850.wav	خسر مؤخرًا أمام راونيتش في بطولة بريسبان المفتوحة.	خسر مؤخرًا أمام راونيتش في بطولة بريسبان المفتوحة	خ س ر | م ؤ خ ر ً ا | أ م ا م | ر ا و ن ي ت ش | ف ي | ب ط و ل ة | ب ر ي س ب ا ن | ا ل م ف ت و ح ة |	94080	FEMALE
1105	2661120626665880632.wav	تم إنشاء الهرم الأكبر لتكريم الفرعون خوفو، وتم بناء العديد من الأهرامات والمقابر والمعابد الأصغر لتكريم زوجات خوفو وأفراد أسرته.	تم إنشاء الهرم الأكبر لتكريم الفرعون خوفو وتم بناء العديد من الأهرامات والمقابر والمعابد الأصغر لتكريم زوجات خوفو وأفراد أسرته	ت م | إ ن ش ا ء | ا ل ه ر م | ا ل أ ك ب ر | ل ت ك ر ي م | ا ل ف ر ع و ن | خ و ف و | و ت م | ب ن ا ء | ا ل ع د ي د | م ن | ا ل أ ه ر ا م ا ت | و ا ل م ق ا ب ر | و ا ل م ع ا ب د | ا ل أ ص غ ر | ل ت ك ر ي م | ز و ج ا ت | خ و ف و | و أ ف ر ا د | أ س ر ت ه |	175680	FEMALE
924	1371590626162468874.wav	يتم الوصول إلى هذه الخدمات في الأغلب عن طريق رقم هاتف مجاني يمكن الاتصال به من معظم الهواتف مجاناً.	يتم الوصول إلى هذه الخدمات في الأغلب عن طريق رقم هاتف مجاني يمكن الاتصال به من معظم الهواتف مجاناً	ي ت م | ا ل و ص و ل | إ ل ى | ه ذ ه | ا ل خ د م ا ت | ف ي | ا ل أ غ ل ب | ع ن | ط ر ي ق | ر ق م | ه ا ت ف | م ج ا ن ي | ي م ك ن | ا ل ا ت ص ا ل | ب ه | م ن | م ع ظ م | ا ل ه و ا ت ف | م ج ا ن ا ً |	157440	FEMALE
1405	7894611500230121672.wav	ولكن إنشاء شبكة طرق بامتداد البلاد ليس ذا جدوى اقتصادية لحفنة من السيارات، لذا يتم تطوير طرق جديدة لتقليل تكلفة ملكية سيارة.	ولكن إنشاء شبكة طرق بامتداد البلاد ليس ذا جدوى اقتصادية لحفنة من السيارات لذا يتم تطوير طرق جديدة لتقليل تكلفة ملكية سيارة	و ل ك ن | إ ن ش ا ء | ش ب ك ة | ط ر ق | ب ا م ت د ا د | ا ل ب ل ا د | ل ي س | ذ ا | ج د و ى | ا ق ت ص ا د ي ة | ل ح ف ن ة | م ن | ا ل س ي ا ر ا ت | ل ذ ا | ي ت م | ت ط و ي ر | ط ر ق | ج د ي د ة | ل ت ق ل ي ل | ت ك ل ف ة | م ل ك ي ة | س ي ا ر ة |	171840	FEMALE
1431	10762825809365166113.wav	يسمح لنا ظهور التقنيات الجديدة برؤية واستكشاف تركيبات وعمليات الدماغ بشكل لم نعهده من قبل.	يسمح لنا ظهور التقنيات الجديدة برؤية واستكشاف تركيبات وعمليات الدماغ بشكل لم نعهده من قبل	ي س م ح | ل ن ا | ظ ه و ر | ا ل ت ق ن ي ا ت | ا ل ج د ي د ة | ب ر ؤ ي ة | و ا س ت ك ش ا ف | ت ر ك ي ب ا ت | و ع م ل ي ا ت | ا ل د م ا غ | ب ش ك ل | ل م | ن ع ه د ه | م ن | ق ب ل |	168960	FEMALE
776	16513745058376157542.wav	مع أنه، نظرياً، يمكن إقامتهم سنوياً (طالما كانوا في بلدان مختلفة)، إلا أن هذا لا يحدث عملياً.	مع أنه، نظرياً، يمكن إقامتهم سنوياً طالما كانوا في بلدان مختلفة، إلا أن هذا لا يحدث عملياً	م ع | أ ن ه ، | ن ظ ر ي ا ً ، | ي م ك ن | إ ق ا م ت ه م | س ن و ي ا ً | ط ا ل م ا | ك ا ن و ا | ف ي | ب ل د ا ن | م خ ت ل ف ة ، | إ ل ا | أ ن | ه ذ ا | ل ا | ي ح د ث | ع م ل ي ا ً |	142080	FEMALE
861	6796011360600259478.wav	تعد الحقائب المهملة هدفاً للسرقة، كما يمكن أن تلفت إنتباه السلطات القلقة من القنابل.	تعد الحقائب المهملة هدفاً للسرقة كما يمكن أن تلفت إنتباه السلطات القلقة من القنابل	ت ع د | ا ل ح ق ا ئ ب | ا ل م ه م ل ة | ه د ف ا ً | ل ل س ر ق ة | ك م ا | ي م ك ن | أ ن | ت ل ف ت | إ ن ت ب ا ه | ا ل س ل ط ا ت | ا ل ق ل ق ة | م ن | ا ل ق ن ا ب ل |	123840	FEMALE
252	6024739117602744384.wav	بلغ عدد القتلى 15 على الأقل، وهو رقم من المتوقع أن يستمر بالارتفاع.	بلغ عدد القتلى 15 على الأقل وهو رقم من المتوقع أن يستمر بالارتفاع	ب ل غ | ع د د | ا ل ق ت ل ى | 1 5 | ع ل ى | ا ل أ ق ل | و ه و | ر ق م | م ن | ا ل م ت و ق ع | أ ن | ي س ت م ر | ب ا ل ا ر ت ف ا ع |	117120	FEMALE
63	13759769389699549103.wav	تعد البرازيل هي أكبر دولة كاثوليكية رومانية على وجه الأرض، وقد عارضت الكنيسة الكاثوليكية الرومانية باستمرار السماح بزواج المثليين في البلاد.	تعد البرازيل هي أكبر دولة كاثوليكية رومانية على وجه الأرض وقد عارضت الكنيسة الكاثوليكية الرومانية باستمرار السماح بزواج المثليين في البلاد	ت ع د | ا ل ب ر ا ز ي ل | ه ي | أ ك ب ر | د و ل ة | ك ا ث و ل ي ك ي ة | ر و م ا ن ي ة | ع ل ى | و ج ه | ا ل أ ر ض | و ق د | ع ا ر ض ت | ا ل ك ن ي س ة | ا ل ك ا ث و ل ي ك ي ة | ا ل ر و م ا ن ي ة | ب ا س ت م ر ا ر | ا ل س م ا ح | ب ز و ا ج | ا ل م ث ل ي ي ن | ف ي | ا ل ب ل ا د |	182400	FEMALE
168	1383342561284594650.wav	وضع الهجوم توتراً ضخماً علي العلاقات بين الهند وباكستان.	وضع الهجوم توتراً ضخماً علي العلاقات بين الهند وباكستان	و ض ع | ا ل ه ج و م | ت و ت ر ا ً | ض خ م ا ً | ع ل ي | ا ل ع ل ا ق ا ت | ب ي ن | ا ل ه ن د | و ب ا ك س ت ا ن |	74880	FEMALE
658	15190609542298229087.wav	يمكن أن تؤدي الأيام الطويلة جدًا في الصيف إلى مشاكل في الحصول على قسط كافٍ من النوم والمشكلات الصحية المرتبطة.	يمكن أن تؤدي الأيام الطويلة جدًا في الصيف إلى مشاكل في الحصول على قسط كافٍ من النوم والمشكلات الصحية المرتبطة	ي م ك ن | أ ن | ت ؤ د ي | ا ل أ ي ا م | ا ل ط و ي ل ة | ج د ً ا | ف ي | ا ل ص ي ف | إ ل ى | م ش ا ك ل | ف ي | ا ل ح ص و ل | ع ل ى | ق س ط | ك ا ف ٍ | م ن | ا ل ن و م | و ا ل م ش ك ل ا ت | ا ل ص ح ي ة | ا ل م ر ت ب ط ة |	146880	FEMALE
1113	5586427127170337598.wav	بعد تحقق المسؤولين من هوية الناخب، يضع الناخب الظرف في صندوق الاقتراع، ويوقع على قائمة المصوتين.	بعد تحقق المسؤولين من هوية الناخب يضع الناخب الظرف في صندوق الاقتراع ويوقع على قائمة المصوتين	ب ع د | ت ح ق ق | ا ل م س ؤ و ل ي ن | م ن | ه و ي ة | ا ل ن ا خ ب | ي ض ع | ا ل ن ا خ ب | ا ل ظ ر ف | ف ي | ص ن د و ق | ا ل ا ق ت ر ا ع | و ي و ق ع | ع ل ى | ق ا ئ م ة | ا ل م ص و ت ي ن |	136320	FEMALE
524	16223879214502841400.wav	وهو أمر منهك للغاية أشبه باستيقاظك كل عشرين أو ثلاثين دقيقة لمشاهدة التلفاز.	وهو أمر منهك للغاية أشبه باستيقاظك كل عشرين أو ثلاثين دقيقة لمشاهدة التلفاز	و ه و | أ م ر | م ن ه ك | ل ل غ ا ي ة | أ ش ب ه | ب ا س ت ي ق ا ظ ك | ك ل | ع ش ر ي ن | أ و | ث ل ا ث ي ن | د ق ي ق ة | ل م ش ا ه د ة | ا ل ت ل ف ا ز |	103680	FEMALE
1476	10860946157841355475.wav	هذا يقابله النرويج، والسويد ونيوزيلندا، ولكنه فريد تماماً (على سبيل المثال في هولندا، الرقم من واحد إلى أربعين).	هذا يقابله النرويج، والسويد ونيوزيلندا، ولكنه فريد تماماً على سبيل المثال في هولندا، الرقم من واحد إلى أربعين	ه ذ ا | ي ق ا ب ل ه | ا ل ن ر و ي ج ، | و ا ل س و ي د | و ن ي و ز ي ل ن د ا ، | و ل ك ن ه | ف ر ي د | ت م ا م ا ً | ع ل ى | س ب ي ل | ا ل م ث ا ل | ف ي | ه و ل ن د ا ، | ا ل ر ق م | م ن | و ا ح د | إ ل ى | أ ر ب ع ي ن |	159360	FEMALE
908	5240215411359686553.wav	توفر عادة عرض نطاق ترددي أعلى وجودة خدمة أفضل، من الصعب التجسس عليها فهي مشفرة.	توفر عادة عرض نطاق ترددي أعلى وجودة خدمة أفضل من الصعب التجسس عليها فهي مشفرة	ت و ف ر | ع ا د ة | ع ر ض | ن ط ا ق | ت ر د د ي | أ ع ل ى | و ج و د ة | خ د م ة | أ ف ض ل | م ن | ا ل ص ع ب | ا ل ت ج س س | ع ل ي ه ا | ف ه ي | م ش ف ر ة |	124800	FEMALE
1427	2797490611331578210.wav	التسمم الداخلي قد لا تظهر عوارضه فوراً. التشخيص الفوري لا يمكن بناؤه عند ظهور أعراض كالتقيؤ والتي هي عامة بشكل كافٍ.	التسمم الداخلي قد لا تظهر عوارضه فوراً التشخيص الفوري لا يمكن بناؤه عند ظهور أعراض كالتقيؤ والتي هي عامة بشكل كافٍ	ا ل ت س م م | ا ل د ا خ ل ي | ق د | ل ا | ت ظ ه ر | ع و ا ر ض ه | ف و ر ا ً | ا ل ت ش خ ي ص | ا ل ف و ر ي | ل ا | ي م ك ن | ب ن ا ؤ ه | ع ن د | ظ ه و ر | أ ع ر ا ض | ك ا ل ت ق ي ؤ | و ا ل ت ي | ه ي | ع ا م ة | ب ش ك ل | ك ا ف ٍ |	148800	MALE
383	4120555473782400090.wav	ومع ذلك، ففي سنة 991 وُوجهت إيذلريد من قبل أسطول الفايكينغ الأكبر منذ قرن الغوثروم الغابر.	ومع ذلك ففي سنة 991 وُوجهت إيذلريد من قبل أسطول الفايكينغ الأكبر منذ قرن الغوثروم الغابر	و م ع | ذ ل ك | ف ف ي | س ن ة | 9 9 1 | و ُ و ج ه ت | إ ي ذ ل ر ي د | م ن | ق ب ل | أ س ط و ل | ا ل ف ا ي ك ي ن غ | ا ل أ ك ب ر | م ن ذ | ق ر ن | ا ل غ و ث ر و م | ا ل غ ا ب ر |	195840	MALE
1011	2971482613005677330.wav	أنواع النبيذ الفرنسي متعددة، ولكن النبيذ النيوزيلندي والأسترالي قد يحظيا بانتشار أوسع.	أنواع النبيذ الفرنسي متعددة ولكن النبيذ النيوزيلندي والأسترالي قد يحظيا بانتشار أوسع	أ ن و ا ع | ا ل ن ب ي ذ | ا ل ف ر ن س ي | م ت ع د د ة | و ل ك ن | ا ل ن ب ي ذ | ا ل ن ي و ز ي ل ن د ي | و ا ل أ س ت ر ا ل ي | ق د | ي ح ظ ي ا | ب ا ن ت ش ا ر | أ و س ع |	116160	FEMALE
323	6858704238968873249.wav	من الممكن أن يكون الناتج المحلي الإجمالي للصين أكبر من الولايات المتحدة في غضون عقدين.	من الممكن أن يكون الناتج المحلي الإجمالي للصين أكبر من الولايات المتحدة في غضون عقدين	م ن | ا ل م م ك ن | أ ن | ي ك و ن | ا ل ن ا ت ج | ا ل م ح ل ي | ا ل إ ج م ا ل ي | ل ل ص ي ن | أ ك ب ر | م ن | ا ل و ل ا ي ا ت | ا ل م ت ح د ة | ف ي | غ ض و ن | ع ق د ي ن |	115200	FEMALE
569	17564481286478837103.wav	للهياكل المختلفة قدرات مختلفة، وهي حساسة لأطوال موجات مختلفة ولها درجات مختلفة من الحدة، كما أنها تتطلب معالجة مختلفة لفهم المدخلات والأرقام المختلفة للعمل على النحو الأمثل.	للهياكل المختلفة قدرات مختلفة وهي حساسة لأطوال موجات مختلفة ولها درجات مختلفة من الحدة كما أنها تتطلب معالجة مختلفة لفهم المدخلات والأرقام المختلفة للعمل على النحو الأمثل	ل ل ه ي ا ك ل | ا ل م خ ت ل ف ة | ق د ر ا ت | م خ ت ل ف ة | و ه ي | ح س ا س ة | ل أ ط و ا ل | م و ج ا ت | م خ ت ل ف ة | و ل ه ا | د ر ج ا ت | م خ ت ل ف ة | م ن | ا ل ح د ة | ك م ا | أ ن ه ا | ت ت ط ل ب | م ع ا ل ج ة | م خ ت ل ف ة | ل ف ه م | ا ل م د خ ل ا ت | و ا ل أ ر ق ا م | ا ل م خ ت ل ف ة | ل ل ع م ل | ع ل ى | ا ل ن ح و | ا ل أ م ث ل |	271680	FEMALE
343	1729387593489297885.wav	لقد مررنا بأزمة مالية استمرّت لمدة عام، وبلغت لحظاتها الأكثر حدّة في الشهرين الماضيين، وأعتقد أنّ الأسواق المالية قد بدأت الآن تتعافى."	لقد مررنا بأزمة مالية استمرّت لمدة عام وبلغت لحظاتها الأكثر حدّة في الشهرين الماضيين وأعتقد أنّ الأسواق المالية قد بدأت الآن تتعافى	ل ق د | م ر ر ن ا | ب أ ز م ة | م ا ل ي ة | ا س ت م ر ّ ت | ل م د ة | ع ا م | و ب ل غ ت | ل ح ظ ا ت ه ا | ا ل أ ك ث ر | ح د ّ ة | ف ي | ا ل ش ه ر ي ن | ا ل م ا ض ي ي ن | و أ ع ت ق د | أ ن ّ | ا ل أ س و ا ق | ا ل م ا ل ي ة | ق د | ب د أ ت | ا ل آ ن | ت ت ع ا ف ى |	171840	MALE
