1298	16017334931377002109.wav	يمكن أن يكون السفر بالطائرة تجربة مرعبة للأشخاص من جميع الأعمار والخلفيات، خاصةً إذا لم يسافروا من قبل أو تعرضوا لحادثٍ مؤلمٍ.	يمكن أن يكون السفر بالطائرة تجربة مرعبة للأشخاص من جميع الأعمار والخلفيات خاصةً إذا لم يسافروا من قبل أو تعرضوا لحادثٍ مؤلمٍ	ي م ك ن | أ ن | ي ك و ن | ا ل س ف ر | ب ا ل ط ا ئ ر ة | ت ج ر ب ة | م ر ع ب ة | ل ل أ ش خ ا ص | م ن | ج م ي ع | ا ل أ ع م ا ر | و ا ل خ ل ف ي ا ت | خ ا ص ة ً | إ ذ ا | ل م | ي س ا ف ر و ا | م ن | ق ب ل | أ و | ت ع ر ض و ا | ل ح ا د ث ٍ | م ؤ ل م ٍ |	178560	FEMALE
463	4300597694679595229.wav	تم عمل ذلك للتأكد من أن الصورة تغطي الشاشة بأكملها. هذا يُسمى بالتجزئة العالية.	تم عمل ذلك للتأكد من أن الصورة تغطي الشاشة بأكملها هذا يُسمى بالتجزئة العالية	ت م | ع م ل | ذ ل ك | ل ل ت أ ك د | م ن | أ ن | ا ل ص و ر ة | ت غ ط ي | ا ل ش ا ش ة | ب أ ك م ل ه ا | ه ذ ا | ي ُ س م ى | ب ا ل ت ج ز ئ ة | ا ل ع ا ل ي ة |	112320	FEMALE
1027	4558339208319859764.wav	يجب على الرعاية البديلة توفير كل الضروريّات التي افتقدوها في البيوت التي خرجوا منها سابقاً.	يجب على الرعاية البديلة توفير كل الضروريّات التي افتقدوها في البيوت التي خرجوا منها سابقاً	ي ج ب | ع ل ى | ا ل ر ع ا ي ة | ا ل ب د ي ل ة | ت و ف ي ر | ك ل | ا ل ض ر و ر ي ّ ا ت | ا ل ت ي | ا ف ت ق د و ه ا | ف ي | ا ل ب ي و ت | ا ل ت ي | خ ر ج و ا | م ن ه ا | س ا ب ق ا ً |	119040	FEMALE
1093	18313368993057721279.wav	سر نجاحهم هو مفهوم المكانة، وظيفة خاصة لكل قطة تمنعها من التنافس مع الآخرين.	سر نجاحهم هو مفهوم المكانة وظيفة خاصة لكل قطة تمنعها من التنافس مع الآخرين	س ر | ن ج ا ح ه م | ه و | م ف ه و م | ا ل م ك ا ن ة | و ظ ي ف ة | خ ا ص ة | ل ك ل | ق ط ة | ت م ن ع ه ا | م ن | ا ل ت ن ا ف س | م ع | ا ل آ خ ر ي ن |	190080	FEMALE
140	14462724801047631416.wav	بلغ الإعصار المداري جونو - الذي سمي على اسم كيس أوراق النخيل بلغة جزر المالديف - في ذروته رياحاً متواصلة بسرعة 240 كيلومتراً في الساعة (149 ميلاً في الساعة).	بلغ الإعصار المداري جونو - الذي سمي على اسم كيس أوراق النخيل بلغة جزر المالديف - في ذروته رياحاً متواصلة بسرعة 240 كيلومتراً في الساعة 149 ميلاً في الساعة	ب ل غ | ا ل إ ع ص ا ر | ا ل م د ا ر ي | ج و ن و | - | ا ل ذ ي | س م ي | ع ل ى | ا س م | ك ي س | أ و ر ا ق | ا ل ن خ ي ل | ب ل غ ة | ج ز ر | ا ل م ا ل د ي ف | - | ف ي | ذ ر و ت ه | ر ي ا ح ا ً | م ت و ا ص ل ة | ب س ر ع ة | 2 4 0 | ك ي ل و م ت ر ا ً | ف ي | ا ل س ا ع ة | 1 4 9 | م ي ل ا ً | ف ي | ا ل س ا ع ة |	203520	FEMALE
1444	2829910162051644261.wav	وقع من ضمن الخسائر نيكولاس ألدين صاحب الخمسة وعشرين عاماً وذاكاري كوديباك صاحب الواحد وعشرين عاماً. كان كوديباك السائق.	وقع من ضمن الخسائر نيكولاس ألدين صاحب الخمسة وعشرين عاماً وذاكاري كوديباك صاحب الواحد وعشرين عاماً كان كوديباك السائق	و ق ع | م ن | ض م ن | ا ل خ س ا ئ ر | ن ي ك و ل ا س | أ ل د ي ن | ص ا ح ب | ا ل خ م س ة | و ع ش ر ي ن | ع ا م ا ً | و ذ ا ك ا ر ي | ك و د ي ب ا ك | ص ا ح ب | ا ل و ا ح د | و ع ش ر ي ن | ع ا م ا ً | ك ا ن | ك و د ي ب ا ك | ا ل س ا ئ ق |	180480	FEMALE
356	10945682059747680039.wav	نظراً لانحناء الجزء السفلي من الشفرة قليلاً، حيث تميل إلى ناحية أو الأخرى، فإن الحافة الملامسة للجليد منحنية هي الأخرى.	نظراً لانحناء الجزء السفلي من الشفرة قليلاً حيث تميل إلى ناحية أو الأخرى فإن الحافة الملامسة للجليد منحنية هي الأخرى	ن ظ ر ا ً | ل ا ن ح ن ا ء | ا ل ج ز ء | ا ل س ف ل ي | م ن | ا ل ش ف ر ة | ق ل ي ل ا ً | ح ي ث | ت م ي ل | إ ل ى | ن ا ح ي ة | أ و | ا ل أ خ ر ى | ف إ ن | ا ل ح ا ف ة | ا ل م ل ا م س ة | ل ل ج ل ي د | م ن ح ن ي ة | ه ي | ا ل أ خ ر ى |	249600	FEMALE
252	8633831588618701981.wav	بلغ عدد القتلى 15 على الأقل، وهو رقم من المتوقع أن يستمر بالارتفاع.	بلغ عدد القتلى 15 على الأقل وهو رقم من المتوقع أن يستمر بالارتفاع	ب ل غ | ع د د | ا ل ق ت ل ى | 1 5 | ع ل ى | ا ل أ ق ل | و ه و | ر ق م | م ن | ا ل م ت و ق ع | أ ن | ي س ت م ر | ب ا ل ا ر ت ف ا ع |	109440	FEMALE
562	13971639749933878700.wav	ستحتاج إلى ملاحظة وضعية الضحية وأنت تقترب منه، وأي مؤشرات خطر تلقائية.	ستحتاج إلى ملاحظة وضعية الضحية وأنت تقترب منه وأي مؤشرات خطر تلقائية	س ت ح ت ا ج | إ ل ى | م ل ا ح ظ ة | و ض ع ي ة | ا ل ض ح ي ة | و أ ن ت | ت ق ت ر ب | م ن ه | و أ ي | م ؤ ش ر ا ت | خ ط ر | ت ل ق ا ئ ي ة |	146880	FEMALE
1223	16115542442583332258.wav	هو حث البلاد النامية "على تجنب الطريق القديم الذي يقوم على مبدأ أن تلوث أولاً ثم تنظف لاحقاً"	هو حث البلاد النامية على تجنب الطريق القديم الذي يقوم على مبدأ أن تلوث أولاً ثم تنظف لاحقاً	ه و | ح ث | ا ل ب ل ا د | ا ل ن ا م ي ة | ع ل ى | ت ج ن ب | ا ل ط ر ي ق | ا ل ق د ي م | ا ل ذ ي | ي ق و م | ع ل ى | م ب د أ | أ ن | ت ل و ث | أ و ل ا ً | ث م | ت ن ظ ف | ل ا ح ق ا ً |	215040	FEMALE
1239	1237703008892791203.wav	وكل من يخطط لزيارة دولة قد تعتبر منطقة حرب فلابد وأن يحصل على تدريب مهني.	وكل من يخطط لزيارة دولة قد تعتبر منطقة حرب فلابد وأن يحصل على تدريب مهني	و ك ل | م ن | ي خ ط ط | ل ز ي ا ر ة | د و ل ة | ق د | ت ع ت ب ر | م ن ط ق ة | ح ر ب | ف ل ا ب د | و أ ن | ي ح ص ل | ع ل ى | ت د ر ي ب | م ه ن ي |	119040	FEMALE
849	12218986241457947268.wav	معظم "بوميرانج" المتاحة في أستراليا لا ترجع في الواقع. من الأفضل للمبتدئين عدم محاولة رميها في الرياح القوية.	معظم بوميرانج المتاحة في أستراليا لا ترجع في الواقع من الأفضل للمبتدئين عدم محاولة رميها في الرياح القوية	م ع ظ م | ب و م ي ر ا ن ج | ا ل م ت ا ح ة | ف ي | أ س ت ر ا ل ي ا | ل ا | ت ر ج ع | ف ي | ا ل و ا ق ع | م ن | ا ل أ ف ض ل | ل ل م ب ت د ئ ي ن | ع د م | م ح ا و ل ة | ر م ي ه ا | ف ي | ا ل ر ي ا ح | ا ل ق و ي ة |	149760	FEMALE
1467	6494440749872599653.wav	في سنة 1884 انتقل تيسلا إلى الولايات المتحدة الأمريكية للعمل مع شركة إديسون في مدينة نيويورك.	في سنة 1884 انتقل تيسلا إلى الولايات المتحدة الأمريكية للعمل مع شركة إديسون في مدينة نيويورك	ف ي | س ن ة | 1 8 8 4 | ا ن ت ق ل | ت ي س ل ا | إ ل ى | ا ل و ل ا ي ا ت | ا ل م ت ح د ة | ا ل أ م ر ي ك ي ة | ل ل ع م ل | م ع | ش ر ك ة | إ د ي س و ن | ف ي | م د ي ن ة | ن ي و ي و ر ك |	172800	FEMALE
1076	3890393891502291696.wav	أُرسلت واحدة منهم إلى جورج واشنطن في السادس من يوليو، وقد قرأها على قوّاته في نيويورك في التاسع من تموز. ووصلت نسخة منها إلى لندن في العاشر من آب.	أُرسلت واحدة منهم إلى جورج واشنطن في السادس من يوليو وقد قرأها على قوّاته في نيويورك في التاسع من تموز ووصلت نسخة منها إلى لندن في العاشر من آب	أ ُ ر س ل ت | و ا ح د ة | م ن ه م | إ ل ى | ج و ر ج | و ا ش ن ط ن | ف ي | ا ل س ا د س | م ن | ي و ل ي و | و ق د | ق ر أ ه ا | ع ل ى | ق و ّ ا ت ه | ف ي | ن ي و ي و ر ك | ف ي | ا ل ت ا س ع | م ن | ت م و ز | و و ص ل ت | ن س خ ة | م ن ه ا | إ ل ى | ل ن د ن | ف ي | ا ل ع ا ش ر | م ن | آ ب |	240000	FEMALE
260	10882578580388823141.wav	وتم استعمال شاحنات التفريغ لإغلاق مداخل النفق، كما تم تقديم المساعدة من 80 شرطياً لتوجيه سائقي السيارات إلى طرقٍ بديلة.	وتم استعمال شاحنات التفريغ لإغلاق مداخل النفق كما تم تقديم المساعدة من 80 شرطياً لتوجيه سائقي السيارات إلى طرقٍ بديلة	و ت م | ا س ت ع م ا ل | ش ا ح ن ا ت | ا ل ت ف ر ي غ | ل إ غ ل ا ق | م د ا خ ل | ا ل ن ف ق | ك م ا | ت م | ت ق د ي م | ا ل م س ا ع د ة | م ن | 8 0 | ش ر ط ي ا ً | ل ت و ج ي ه | س ا ئ ق ي | ا ل س ي ا ر ا ت | إ ل ى | ط ر ق ٍ | ب د ي ل ة |	137280	FEMALE
331	6869041523847079107.wav	لم يسبق لأي شخص آخر أن سجل حضوراً أو أحرز أهدافاً للنادي مقارنة ببوبيك.	لم يسبق لأي شخص آخر أن سجل حضوراً أو أحرز أهدافاً للنادي مقارنة ببوبيك	ل م | ي س ب ق | ل أ ي | ش خ ص | آ خ ر | أ ن | س ج ل | ح ض و ر ا ً | أ و | أ ح ر ز | أ ه د ا ف ا ً | ل ل ن ا د ي | م ق ا ر ن ة | ب ب و ب ي ك |	132480	FEMALE
940	7690896907444249189.wav	تأكد من أنك تعرف ما يمكنك وما لا يمكنك إحضاره والإعلان عن أي شيء يتجاوز الحدود القانونية.	تأكد من أنك تعرف ما يمكنك وما لا يمكنك إحضاره والإعلان عن أي شيء يتجاوز الحدود القانونية	ت أ ك د | م ن | أ ن ك | ت ع ر ف | م ا | ي م ك ن ك | و م ا | ل ا | ي م ك ن ك | إ ح ض ا ر ه | و ا ل إ ع ل ا ن | ع ن | أ ي | ش ي ء | ي ت ج ا و ز | ا ل ح د و د | ا ل ق ا ن و ن ي ة |	207360	FEMALE
293	7253701810327218593.wav	تم تسجيل ظهور سحب مظلمة غير مرتبطة بأي أنشطة بركانية عند قاعدة الجبل.	تم تسجيل ظهور سحب مظلمة غير مرتبطة بأي أنشطة بركانية عند قاعدة الجبل	ت م | ت س ج ي ل | ظ ه و ر | س ح ب | م ظ ل م ة | غ ي ر | م ر ت ب ط ة | ب أ ي | أ ن ش ط ة | ب ر ك ا ن ي ة | ع ن د | ق ا ع د ة | ا ل ج ب ل |	81600	FEMALE
1191	7649315418411711192.wav	على الرغم من أن عربات السكك الحديدية القديمة كانت تتكون فقط من ألواحٍ خشبيةٍ متوازيةٍ، إلا أنها سمحت للخيول بسحبها لتحقيق سرعاتٍ أكبر وسحب أحمالٍ أكبر مقارنة بالطرق التي كانت تعتبر أكثر من وعرةٍ في ذلك التوقيت.	على الرغم من أن عربات السكك الحديدية القديمة كانت تتكون فقط من ألواحٍ خشبيةٍ متوازيةٍ إلا أنها سمحت للخيول بسحبها لتحقيق سرعاتٍ أكبر وسحب أحمالٍ أكبر مقارنة بالطرق التي كانت تعتبر أكثر من وعرةٍ في ذلك التوقيت	ع ل ى | ا ل ر غ م | م ن | أ ن | ع ر ب ا ت | ا ل س ك ك | ا ل ح د ي د ي ة | ا ل ق د ي م ة | ك ا ن ت | ت ت ك و ن | ف ق ط | م ن | أ ل و ا ح ٍ | خ ش ب ي ة ٍ | م ت و ا ز ي ة ٍ | إ ل ا | أ ن ه ا | س م ح ت | ل ل خ ي و ل | ب س ح ب ه ا | ل ت ح ق ي ق | س ر ع ا ت ٍ | أ ك ب ر | و س ح ب | أ ح م ا ل ٍ | أ ك ب ر | م ق ا ر ن ة | ب ا ل ط ر ق | ا ل ت ي | ك ا ن ت | ت ع ت ب ر | أ ك ث ر | م ن | و ع ر ة ٍ | ف ي | ذ ل ك | ا ل ت و ق ي ت |	275520	FEMALE
1072	12650594309876326647.wav	وتحدد الممرات المائية الداخلية أيضاً الطرق الشائعة للسفر على الأقدام وركوب الدراجات.	وتحدد الممرات المائية الداخلية أيضاً الطرق الشائعة للسفر على الأقدام وركوب الدراجات	و ت ح د د | ا ل م م ر ا ت | ا ل م ا ئ ي ة | ا ل د ا خ ل ي ة | أ ي ض ا ً | ا ل ط ر ق | ا ل ش ا ئ ع ة | ل ل س ف ر | ع ل ى | ا ل أ ق د ا م | و ر ك و ب | ا ل د ر ا ج ا ت |	129600	FEMALE
84	10967562358960936497.wav	مخلبه الثاني كان أكبر، وبسببه سُمّي الديناصور هيسبيرونيكس والذي يعني "المخلب الغربي".	مخلبه الثاني كان أكبر وبسببه سُمّي الديناصور هيسبيرونيكس والذي يعني المخلب الغربي	م خ ل ب ه | ا ل ث ا ن ي | ك ا ن | أ ك ب ر | و ب س ب ب ه | س ُ م ّ ي | ا ل د ي ن ا ص و ر | ه ي س ب ي ر و ن ي ك س | و ا ل ذ ي | ي ع ن ي | ا ل م خ ل ب | ا ل غ ر ب ي |	153600	MALE
1008	14629532621666357449.wav	خسر موراي المجموعة الأولى في شوط كسر التعادل، بعد كسر كلا اللاعبين لجميع ضربات الإرسال بالمجموعة بالكامل.	خسر موراي المجموعة الأولى في شوط كسر التعادل بعد كسر كلا اللاعبين لجميع ضربات الإرسال بالمجموعة بالكامل	خ س ر | م و ر ا ي | ا ل م ج م و ع ة | ا ل أ و ل ى | ف ي | ش و ط | ك س ر | ا ل ت ع ا د ل | ب ع د | ك س ر | ك ل ا | ا ل ل ا ع ب ي ن | ل ج م ي ع | ض ر ب ا ت | ا ل إ ر س ا ل | ب ا ل م ج م و ع ة | ب ا ل ك ا م ل |	138240	FEMALE
891	16600009265965420371.wav	تذهب الجولات الجوية المتخصّصة من حينٍ لآخر إلى الداخل، لتسلّق الجبال أو للوصول إلى القطب، الذي يحتوي على قاعدةٍ كبيرةٍ.	تذهب الجولات الجوية المتخصّصة من حينٍ لآخر إلى الداخل لتسلّق الجبال أو للوصول إلى القطب الذي يحتوي على قاعدةٍ كبيرةٍ	ت ذ ه ب | ا ل ج و ل ا ت | ا ل ج و ي ة | ا ل م ت خ ص ّ ص ة | م ن | ح ي ن ٍ | ل آ خ ر | إ ل ى | ا ل د ا خ ل | ل ت س ل ّ ق | ا ل ج ب ا ل | أ و | ل ل و ص و ل | إ ل ى | ا ل ق ط ب | ا ل ذ ي | ي ح ت و ي | ع ل ى | ق ا ع د ة ٍ | ك ب ي ر ة ٍ |	163200	FEMALE
1186	4645611054242486773.wav	اللغة الفارسية لديها قواعد سهلة نسبياً وغالباً مألوفة.	اللغة الفارسية لديها قواعد سهلة نسبياً وغالباً مألوفة	ا ل ل غ ة | ا ل ف ا ر س ي ة | ل د ي ه ا | ق و ا ع د | س ه ل ة | ن س ب ي ا ً | و غ ا ل ب ا ً | م أ ل و ف ة |	117120	FEMALE
322	14386081069851206664.wav	للمرّة الأولى، صدّرت الصين في العام الماضي سيّارات أكثر من ألمانيا، وتجاوزت الولايات المتحدة كأكبر سوق في هذه الصناعة.	للمرّة الأولى صدّرت الصين في العام الماضي سيّارات أكثر من ألمانيا وتجاوزت الولايات المتحدة كأكبر سوق في هذه الصناعة	ل ل م ر ّ ة | ا ل أ و ل ى | ص د ّ ر ت | ا ل ص ي ن | ف ي | ا ل ع ا م | ا ل م ا ض ي | س ي ّ ا ر ا ت | أ ك ث ر | م ن | أ ل م ا ن ي ا | و ت ج ا و ز ت | ا ل و ل ا ي ا ت | ا ل م ت ح د ة | ك أ ك ب ر | س و ق | ف ي | ه ذ ه | ا ل ص ن ا ع ة |	158400	FEMALE
1473	10246523743465365933.wav	فرّ جميعهم عائدين من حيث وقعت الحادثة.	فرّ جميعهم عائدين من حيث وقعت الحادثة	ف ر ّ | ج م ي ع ه م | ع ا ئ د ي ن | م ن | ح ي ث | و ق ع ت | ا ل ح ا د ث ة |	77760	MALE
70	4130758379770764472.wav	ألغت الفرقة العرض بإستاد الحرب التذكاري في ماوي والتي كان سوف يحضرها 9000 شخص، واعتذرت للمعجبين.	ألغت الفرقة العرض بإستاد الحرب التذكاري في ماوي والتي كان سوف يحضرها 9000 شخص واعتذرت للمعجبين	أ ل غ ت | ا ل ف ر ق ة | ا ل ع ر ض | ب إ س ت ا د | ا ل ح ر ب | ا ل ت ذ ك ا ر ي | ف ي | م ا و ي | و ا ل ت ي | ك ا ن | س و ف | ي ح ض ر ه ا | 9 0 0 0 | ش خ ص | و ا ع ت ذ ر ت | ل ل م ع ج ب ي ن |	164160	MALE
454	7495496084669635882.wav	التصميم التفاعلي يتطلب أن تكون أجزاء من مشروع ما متصلة ببعضها البعض، ولكن أيضاً أن يكون لها معنى ككيان منفصل.	التصميم التفاعلي يتطلب أن تكون أجزاء من مشروع ما متصلة ببعضها البعض ولكن أيضاً أن يكون لها معنى ككيان منفصل	ا ل ت ص م ي م | ا ل ت ف ا ع ل ي | ي ت ط ل ب | أ ن | ت ك و ن | أ ج ز ا ء | م ن | م ش ر و ع | م ا | م ت ص ل ة | ب ب ع ض ه ا | ا ل ب ع ض | و ل ك ن | أ ي ض ا ً | أ ن | ي ك و ن | ل ه ا | م ع ن ى | ك ك ي ا ن | م ن ف ص ل |	148800	FEMALE
268	3431502664859773227.wav	رٌفعت دعوى القضية في ولاية فرجينيا لأنها موطن شركة AOL الرائدة في تقديم خدمات الإنترنت، والتي نٌسِبت إليها الاتهامات.	رٌفعت دعوى القضية في ولاية فرجينيا لأنها موطن شركة aol الرائدة في تقديم خدمات الإنترنت والتي نٌسِبت إليها الاتهامات	ر ٌ ف ع ت | د ع و ى | ا ل ق ض ي ة | ف ي | و ل ا ي ة | ف ر ج ي ن ي ا | ل أ ن ه ا | م و ط ن | ش ر ك ة | a o l | ا ل ر ا ئ د ة | ف ي | ت ق د ي م | خ د م ا ت | ا ل إ ن ت ر ن ت | و ا ل ت ي | ن ٌ س ِ ب ت | إ ل ي ه ا | ا ل ا ت ه ا م ا ت |	179520	FEMALE
1056	14248343069599088422.wav	لكن إن تم استعماله من دون مصطلحات إضافية، فإن المصطلح يميل ليعني أن الطعام أصله من المناطق الوسطى والشرقية للجزيرة الرئيسية جافا.	لكن إن تم استعماله من دون مصطلحات إضافية فإن المصطلح يميل ليعني أن الطعام أصله من المناطق الوسطى والشرقية للجزيرة الرئيسية جافا	ل ك ن | إ ن | ت م | ا س ت ع م ا ل ه | م ن | د و ن | م ص ط ل ح ا ت | إ ض ا ف ي ة | ف إ ن | ا ل م ص ط ل ح | ي م ي ل | ل ي ع ن ي | أ ن | ا ل ط ع ا م | أ ص ل ه | م ن | ا ل م ن ا ط ق | ا ل و س ط ى | و ا ل ش ر ق ي ة | ل ل ج ز ي ر ة | ا ل ر ئ ي س ي ة | ج ا ف ا |	170880	FEMALE
1324	5577316360883178258.wav	وهذا يمنحهم مجموعة أكبر من الأماكن الصغيرة للاختباء من الحيوانات المفترسة.	وهذا يمنحهم مجموعة أكبر من الأماكن الصغيرة للاختباء من الحيوانات المفترسة	و ه ذ ا | ي م ن ح ه م | م ج م و ع ة | أ ك ب ر | م ن | ا ل أ م ا ك ن | ا ل ص غ ي ر ة | ل ل ا خ ت ب ا ء | م ن | ا ل ح ي و ا ن ا ت | ا ل م ف ت ر س ة |	100800	FEMALE
261	14412532286555827787.wav	لم نتلق أي أخبار عن تأخر حركة المرور المؤدية لطريق المدينة البديل.	لم نتلق أي أخبار عن تأخر حركة المرور المؤدية لطريق المدينة البديل	ل م | ن ت ل ق | أ ي | أ خ ب ا ر | ع ن | ت أ خ ر | ح ر ك ة | ا ل م ر و ر | ا ل م ؤ د ي ة | ل ط ر ي ق | ا ل م د ي ن ة | ا ل ب د ي ل |	99840	FEMALE
1124	6485125841953505542.wav	يتسم كل من "البق القاتل" و"بق الفراش" بطول مدة الحضانة، ويتكيفان مع العيش في عش أو سكن مضيفهم.	يتسم كل من البق القاتل و"بق الفراش بطول مدة الحضانة، ويتكيفان مع العيش في عش أو سكن مضيفهم	ي ت س م | ك ل | م ن | ا ل ب ق | ا ل ق ا ت ل | و " ب ق | ا ل ف ر ا ش | ب ط و ل | م د ة | ا ل ح ض ا ن ة ، | و ي ت ك ي ف ا ن | م ع | ا ل ع ي ش | ف ي | ع ش | أ و | س ك ن | م ض ي ف ه م |	134400	FEMALE
576	3182023170795197568.wav	استمرت كل من هذه الاقتحامات أو المسيرات التي يقوم بها البدو الرُحل لمدة 17 يومًا تقريبًا.	استمرت كل من هذه الاقتحامات أو المسيرات التي يقوم بها البدو الرُحل لمدة 17 يومًا تقريبًا	ا س ت م ر ت | ك ل | م ن | ه ذ ه | ا ل ا ق ت ح ا م ا ت | أ و | ا ل م س ي ر ا ت | ا ل ت ي | ي ق و م | ب ه ا | ا ل ب د و | ا ل ر ُ ح ل | ل م د ة | 1 7 | ي و م ً ا | ت ق ر ي ب ً ا |	124800	FEMALE
1382	1463746406465571548.wav	في يوم الاثنين، أعلنت سارة دانيوس -السكرتيرة الدائمة للجنة نوبل للأدب في الأكاديمية السويدية- على الملأ خلال برنامج إذاعي على راديو السويد في السويد، أن اللجنة -التي لم تتمكن من الوصول مباشرة إلى بوب ديلان بشأن الفوز بجائزة نوبل في الأدب لعام 2016- قد تخلت عن جهودها للوصول إليه.	في يوم الاثنين، أعلنت سارة دانيوس -السكرتيرة الدائمة للجنة نوبل للأدب في الأكاديمية السويدية- على الملأ خلال برنامج إذاعي على راديو السويد في السويد، أن اللجنة -التي لم تتمكن من الوصول مباشرة إلى بوب ديلان بشأن الفوز بجائزة نوبل في الأدب لعام 2016- قد تخلت عن جهودها للوصول إليه	ف ي | ي و م | ا ل ا ث ن ي ن ، | أ ع ل ن ت | س ا ر ة | د ا ن ي و س | - ا ل س ك ر ت ي ر ة | ا ل د ا ئ م ة | ل ل ج ن ة | ن و ب ل | ل ل أ د ب | ف ي | ا ل أ ك ا د ي م ي ة | ا ل س و ي د ي ة - | ع ل ى | ا ل م ل أ | خ ل ا ل | ب ر ن ا م ج | إ ذ ا ع ي | ع ل ى | ر ا د ي و | ا ل س و ي د | ف ي | ا ل س و ي د ، | أ ن | ا ل ل ج ن ة | - ا ل ت ي | ل م | ت ت م ك ن | م ن | ا ل و ص و ل | م ب ا ش ر ة | إ ل ى | ب و ب | د ي ل ا ن | ب ش أ ن | ا ل ف و ز | ب ج ا ئ ز ة | ن و ب ل | ف ي | ا ل أ د ب | ل ع ا م | 2 0 1 6 - | ق د | ت خ ل ت | ع ن | ج ه و د ه ا | ل ل و ص و ل | إ ل ي ه |	384000	FEMALE
920	4010946606816992077.wav	فهو يمكنه توفير المال من خلال شراء خرائط جديدة لنظام تحديد المواقع العالمي (GPS)، أو جهاز مستقل لنظام تحديد المواقع العالمي (GPS)، أو استئجار جهاز من شركة لتأجير السيارات.	فهو يمكنه توفير المال من خلال شراء خرائط جديدة لنظام تحديد المواقع العالمي gps، أو جهاز مستقل لنظام تحديد المواقع العالمي gps، أو استئجار جهاز من شركة لتأجير السيارات	ف ه و | ي م ك ن ه | ت و ف ي ر | ا ل م ا ل | م ن | خ ل ا ل | ش ر ا ء | خ ر ا ئ ط | ج د ي د ة | ل ن ظ ا م | ت ح د ي د | ا ل م و ا ق ع | ا ل ع ا ل م ي | g p s ، | أ و | ج ه ا ز | م س ت ق ل | ل ن ظ ا م | ت ح د ي د | ا ل م و ا ق ع | ا ل ع ا ل م ي | g p s ، | أ و | ا س ت ئ ج ا ر | ج ه ا ز | م ن | ش ر ك ة | ل ت أ ج ي ر | ا ل س ي ا ر ا ت |	263040	FEMALE
