1072	3430817941938008038.wav	ისინი ასევე ადგენენ ლაშქრობის და ველოსიპედის პოპულარულ მარშრუტებს.	ისინი ასევე ადგენენ ლაშქრობის და ველოსიპედის პოპულარულ მარშრუტებს	ი ს ი ნ ი | ა ს ე ვ ე | ა დ გ ე ნ ე ნ | ლ ა შ ქ რ ო ბ ი ს | დ ა | ვ ე ლ ო ს ი პ ე დ ი ს | პ ო პ უ ლ ა რ უ ლ | მ ა რ შ რ უ ტ ე ბ ს |	105600	MALE
1442	17007779231974701321.wav	სუბკულტურები წევრთა ასაკის, ეთნიკური ნიშნის, კლასის, ლოკაციის და/ან სქესის მიხედვით შეიძლება განსხვავდებოდეს.	სუბკულტურები წევრთა ასაკის ეთნიკური ნიშნის კლასის ლოკაციის და/ან სქესის მიხედვით შეიძლება განსხვავდებოდეს	ს უ ბ კ უ ლ ტ უ რ ე ბ ი | წ ე ვ რ თ ა | ა ს ა კ ი ს | ე თ ნ ი კ უ რ ი | ნ ი შ ნ ი ს | კ ლ ა ს ი ს | ლ ო კ ა ც ი ი ს | დ ა / ა ნ | ს ქ ე ს ი ს | მ ი ხ ე დ ვ ი თ | შ ე ი ძ ლ ე ბ ა | გ ა ნ ს ხ ვ ა ვ დ ე ბ ო დ ე ს |	126720	FEMALE
435	3322235579853224964.wav	ლუქსემბურგი მუდამ ცდილობდა ნეიტრალური სახელმწიფო ყოფილიყო, მაგრამ გერმანიამ მოახდინა მისი ოკუპაცია როგორც პირველ, ისევე მეორე მსოფლიო ომში.	ლუქსემბურგი მუდამ ცდილობდა ნეიტრალური სახელმწიფო ყოფილიყო მაგრამ გერმანიამ მოახდინა მისი ოკუპაცია როგორც პირველ ისევე მეორე მსოფლიო ომში	ლ უ ქ ს ე მ ბ უ რ გ ი | მ უ დ ა მ | ც დ ი ლ ო ბ დ ა | ნ ე ი ტ რ ა ლ უ რ ი | ს ა ხ ე ლ მ წ ი ფ ო | ყ ო ფ ი ლ ი ყ ო | მ ა გ რ ა მ | გ ე რ მ ა ნ ი ა მ | მ ო ა ხ დ ი ნ ა | მ ი ს ი | ო კ უ პ ა ც ი ა | რ ო გ ო რ ც | პ ი რ ვ ე ლ | ი ს ე ვ ე | მ ე ო რ ე | მ ს ო ფ ლ ი ო | ო მ შ ი |	164160	MALE
966	17321435387178790847.wav	მთლიანი დასახლება თავისი განსაკუთრებული კულტურული და ისტორიული მნიშვნელობით იუნესკოს მსოფლიო მემკვიდრეობის ძეგლად აღიარეს და ქვყნის უდიდეს ქონებრივ ფასეულობას წარმოადგენს.	მთლიანი დასახლება თავისი განსაკუთრებული კულტურული და ისტორიული მნიშვნელობით იუნესკოს მსოფლიო მემკვიდრეობის ძეგლად აღიარეს და ქვყნის უდიდეს ქონებრივ ფასეულობას წარმოადგენს	მ თ ლ ი ა ნ ი | დ ა ს ა ხ ლ ე ბ ა | თ ა ვ ი ს ი | გ ა ნ ს ა კ უ თ რ ე ბ უ ლ ი | კ უ ლ ტ უ რ უ ლ ი | დ ა | ი ს ტ ო რ ი უ ლ ი | მ ნ ი შ ვ ნ ე ლ ო ბ ი თ | ი უ ნ ე ს კ ო ს | მ ს ო ფ ლ ი ო | მ ე მ კ ვ ი დ რ ე ო ბ ი ს | ძ ე გ ლ ა დ | ა ღ ი ა რ ე ს | დ ა | ქ ვ ყ ნ ი ს | უ დ ი დ ე ს | ქ ო ნ ე ბ რ ი ვ | ფ ა ს ე უ ლ ო ბ ა ს | წ ა რ მ ო ა დ გ ე ნ ს |	194880	FEMALE
9	15645232138035873715.wav	11:00 საათის შემდეგ, მომიტინგეებმა უაიტჰოლში ჩრდილოეთით მიმავალ ვაგონს გზა გადაუკეტეს.	11:00 საათის შემდეგ მომიტინგეებმა უაიტჰოლში ჩრდილოეთით მიმავალ ვაგონს გზა გადაუკეტეს	1 1 : 0 0 | ს ა ა თ ი ს | შ ე მ დ ე გ | მ ო მ ი ტ ი ნ გ ე ე ბ მ ა | უ ა ი ტ ჰ ო ლ შ ი | ჩ რ დ ი ლ ო ე თ ი თ | მ ი მ ა ვ ა ლ | ვ ა გ ო ნ ს | გ ზ ა | გ ა დ ა უ კ ე ტ ე ს |	144960	MALE
36	4022190730962274749.wav	დაყენებულია სინათლის ორი სხივი, რომელიც ღამით ცისკენ არის მიმართული.	დაყენებულია სინათლის ორი სხივი რომელიც ღამით ცისკენ არის მიმართული	დ ა ყ ე ნ ე ბ უ ლ ი ა | ს ი ნ ა თ ლ ი ს | ო რ ი | ს ხ ი ვ ი | რ ო მ ე ლ ი ც | ღ ა მ ი თ | ც ი ს კ ე ნ | ა რ ი ს | მ ი მ ა რ თ უ ლ ი |	111360	MALE
81	15582210723844413527.wav	მაროჰიდორმა კაბულტური ნახევარ ფინალში დაამარცხა.	მაროჰიდორმა კაბულტური ნახევარ ფინალში დაამარცხა	მ ა რ ო ჰ ი დ ო რ მ ა | კ ა ბ უ ლ ტ უ რ ი | ნ ა ხ ე ვ ა რ | ფ ი ნ ა ლ შ ი | დ ა ა მ ა რ ც ხ ა |	98880	FEMALE
1227	4967749799601346858.wav	კომპანია Ring-მა ასევე მოაგვარა სარჩელი უსაფრთხოების კონკურენტ კომპანიასთან ADT.	კომპანია ring-მა ასევე მოაგვარა სარჩელი უსაფრთხოების კონკურენტ კომპანიასთან adt	კ ო მ პ ა ნ ი ა | r i n g - მ ა | ა ს ე ვ ე | მ ო ა გ ვ ა რ ა | ს ა რ ჩ ე ლ ი | უ ს ა ფ რ თ ხ ო ე ბ ი ს | კ ო ნ კ უ რ ე ნ ტ | კ ო მ პ ა ნ ი ა ს თ ა ნ | a d t |	145920	MALE
5	12193101957267127163.wav	როგორც ადგილობრივი მედია ატყობინებს აეროპორტს, ხუთი მანქანა შემოვიდა რეაგირების პერიოდში.	როგორც ადგილობრივი მედია ატყობინებს აეროპორტს ხუთი მანქანა შემოვიდა რეაგირების პერიოდში	რ ო გ ო რ ც | ა დ გ ი ლ ო ბ რ ი ვ ი | მ ე დ ი ა | ა ტ ყ ო ბ ი ნ ე ბ ს | ა ე რ ო პ ო რ ტ ს | ხ უ თ ი | მ ა ნ ქ ა ნ ა | შ ე მ ო ვ ი დ ა | რ ე ა გ ი რ ე ბ ი ს | პ ე რ ი ო დ შ ი |	139200	FEMALE
1234	13659034064458993631.wav	ლიგინსმა მამამისის კვალდაკვალ სამედიცინო კარიერა დაიწყო.	ლიგინსმა მამამისის კვალდაკვალ სამედიცინო კარიერა დაიწყო	ლ ი გ ი ნ ს მ ა | მ ა მ ა მ ი ს ი ს | კ ვ ა ლ დ ა კ ვ ა ლ | ს ა მ ე დ ი ც ი ნ ო | კ ა რ ი ე რ ა | დ ა ი წ ყ ო |	107520	MALE
378	2238642340374859240.wav	იმ გარე ნაწილს, რომელსაც მზეზე ყურებისას ვხედავთ, ფოტოსფერო ეწოდება, რაც „სინათლის ბურთს“ ნიშნავს.	იმ გარე ნაწილს რომელსაც მზეზე ყურებისას ვხედავთ ფოტოსფერო ეწოდება რაც სინათლის ბურთს ნიშნავს	ი მ | გ ა რ ე | ნ ა წ ი ლ ს | რ ო მ ე ლ ს ა ც | მ ზ ე ზ ე | ყ უ რ ე ბ ი ს ა ს | ვ ხ ე დ ა ვ თ | ფ ო ტ ო ს ფ ე რ ო | ე წ ო დ ე ბ ა | რ ა ც | ს ი ნ ა თ ლ ი ს | ბ უ რ თ ს | ნ ი შ ნ ა ვ ს |	157440	FEMALE
613	16729949926716264766.wav	მუსიკა ხშირად რთული კომპიუტერების მეშვეობით იწერება, ხმების ერთად დამუშავების და შერევის მიზნით.	მუსიკა ხშირად რთული კომპიუტერების მეშვეობით იწერება ხმების ერთად დამუშავების და შერევის მიზნით	მ უ ს ი კ ა | ხ შ ი რ ა დ | რ თ უ ლ ი | კ ო მ პ ი უ ტ ე რ ე ბ ი ს | მ ე შ ვ ე ო ბ ი თ | ი წ ე რ ე ბ ა | ხ მ ე ბ ი ს | ე რ თ ა დ | დ ა მ უ შ ა ვ ე ბ ი ს | დ ა | შ ე რ ე ვ ი ს | მ ი ზ ნ ი თ |	168000	FEMALE
999	10753569618555086785.wav	მაგრამ, მისი აღმოჩენის მიუხედავად, იმ დროს იქ უკვე ცხოვრობდნენ ესკიმოს ტომები.	მაგრამ მისი აღმოჩენის მიუხედავად იმ დროს იქ უკვე ცხოვრობდნენ ესკიმოს ტომები	მ ა გ რ ა მ | მ ი ს ი | ა ღ მ ო ჩ ე ნ ი ს | მ ი უ ხ ე დ ა ვ ა დ | ი მ | დ რ ო ს | ი ქ | უ კ ვ ე | ც ხ ო ვ რ ო ბ დ ნ ე ნ | ე ს კ ი მ ო ს | ტ ო მ ე ბ ი |	143040	FEMALE
1299	6694669027564422948.wav	ქალები საკვებს ეზოში ამზადებდნენ. მაღაზიები იყო პირდაპირ ქუჩაში მდგომი ღია დახლები. სახლის ასაშენებლად ქვას იყენებდნენ.	ქალები საკვებს ეზოში ამზადებდნენ მაღაზიები იყო პირდაპირ ქუჩაში მდგომი ღია დახლები სახლის ასაშენებლად ქვას იყენებდნენ	ქ ა ლ ე ბ ი | ს ა კ ვ ე ბ ს | ე ზ ო შ ი | ა მ ზ ა დ ე ბ დ ნ ე ნ | მ ა ღ ა ზ ი ე ბ ი | ი ყ ო | პ ი რ დ ა პ ი რ | ქ უ ჩ ა შ ი | მ დ გ ო მ ი | ღ ი ა | დ ა ხ ლ ე ბ ი | ს ა ხ ლ ი ს | ა ს ა შ ე ნ ე ბ ლ ა დ | ქ ვ ა ს | ი ყ ე ნ ე ბ დ ნ ე ნ |	196800	FEMALE
920	16950518028155918569.wav	მისი მეშვეობით შესაძლებელია თანხის დაზოგვა GPS-თვის ახალი რუქის ყიდვისას ან ცალკეული GPS მოწყობილობის შეძენისას ან გამქირავებელი კომპანიისგან ქირავნობისას.	მისი მეშვეობით შესაძლებელია თანხის დაზოგვა gps-თვის ახალი რუქის ყიდვისას ან ცალკეული gps მოწყობილობის შეძენისას ან გამქირავებელი კომპანიისგან ქირავნობისას	მ ი ს ი | მ ე შ ვ ე ო ბ ი თ | შ ე ს ა ძ ლ ე ბ ე ლ ი ა | თ ა ნ ხ ი ს | დ ა ზ ო გ ვ ა | g p s - თ ვ ი ს | ა ხ ა ლ ი | რ უ ქ ი ს | ყ ი დ ვ ი ს ა ს | ა ნ | ც ა ლ კ ე უ ლ ი | g p s | მ ო წ ყ ო ბ ი ლ ო ბ ი ს | შ ე ძ ე ნ ი ს ა ს | ა ნ | გ ა მ ქ ი რ ა ვ ე ბ ე ლ ი | კ ო მ პ ა ნ ი ი ს გ ა ნ | ქ ი რ ა ვ ნ ო ბ ი ს ა ს |	576000	FEMALE
92	18022830547710564388.wav	ლოდინმა ამასთანავე განაცხადა, რომ ოფიციალურმა პირებმა გადაწყვიტეს გაეუქმებინათ არჩევნების მეორე ტური ავღანელების ხარჯების დაზოგვისა და კიდევ ერთი არჩევნების უსაფრთხოების რისკის თავიდან აცილების მიზნით.	ლოდინმა ამასთანავე განაცხადა რომ ოფიციალურმა პირებმა გადაწყვიტეს გაეუქმებინათ არჩევნების მეორე ტური ავღანელების ხარჯების დაზოგვისა და კიდევ ერთი არჩევნების უსაფრთხოების რისკის თავიდან აცილების მიზნით	ლ ო დ ი ნ მ ა | ა მ ა ს თ ა ნ ა ვ ე | გ ა ნ ა ც ხ ა დ ა | რ ო მ | ო ფ ი ც ი ა ლ უ რ მ ა | პ ი რ ე ბ მ ა | გ ა დ ა წ ყ ვ ი ტ ე ს | გ ა ე უ ქ მ ე ბ ი ნ ა თ | ა რ ჩ ე ვ ნ ე ბ ი ს | მ ე ო რ ე | ტ უ რ ი | ა ვ ღ ა ნ ე ლ ე ბ ი ს | ხ ა რ ჯ ე ბ ი ს | დ ა ზ ო გ ვ ი ს ა | დ ა | კ ი დ ე ვ | ე რ თ ი | ა რ ჩ ე ვ ნ ე ბ ი ს | უ ს ა ფ რ თ ხ ო ე ბ ი ს | რ ი ს კ ი ს | თ ა ვ ი დ ა ნ | ა ც ი ლ ე ბ ი ს | მ ი ზ ნ ი თ |	517440	FEMALE
255	16441614045187969319.wav	მან „საბჭოთა კავშირის გმირის“ წოდება მიიღო, საბჭოთა კავშირის უმაღლესი ჯილდო.	მან საბჭოთა კავშირის გმირის წოდება მიიღო საბჭოთა კავშირის უმაღლესი ჯილდო	მ ა ნ | ს ა ბ ჭ ო თ ა | კ ა ვ შ ი რ ი ს | გ მ ი რ ი ს | წ ო დ ე ბ ა | მ ი ი ღ ო | ს ა ბ ჭ ო თ ა | კ ა ვ შ ი რ ი ს | უ მ ა ღ ლ ე ს ი | ჯ ი ლ დ ო |	122880	FEMALE
1375	7183069195365602548.wav	მაღლა გულისხმობს, რომ თქვენ უნდა დაიწყოთ ხემის წვეტიდან და მიაწვეთ მას, ხოლო დაბლა გულისხმობს, რომ თქვენ უნდა დაიწყოთ ხემის კალაპოტთან (იქ სადაც ხელით ხემი გიჭირავთ) და გამოწიოთ ის თქვენკენ.	მაღლა გულისხმობს რომ თქვენ უნდა დაიწყოთ ხემის წვეტიდან და მიაწვეთ მას ხოლო დაბლა გულისხმობს რომ თქვენ უნდა დაიწყოთ ხემის კალაპოტთან იქ სადაც ხელით ხემი გიჭირავთ და გამოწიოთ ის თქვენკენ	მ ა ღ ლ ა | გ უ ლ ი ს ხ მ ო ბ ს | რ ო მ | თ ქ ვ ე ნ | უ ნ დ ა | დ ა ი წ ყ ო თ | ხ ე მ ი ს | წ ვ ე ტ ი დ ა ნ | დ ა | მ ი ა წ ვ ე თ | მ ა ს | ხ ო ლ ო | დ ა ბ ლ ა | გ უ ლ ი ს ხ მ ო ბ ს | რ ო მ | თ ქ ვ ე ნ | უ ნ დ ა | დ ა ი წ ყ ო თ | ხ ე მ ი ს | კ ა ლ ა პ ო ტ თ ა ნ | ი ქ | ს ა დ ა ც | ხ ე ლ ი თ | ხ ე მ ი | გ ი ჭ ი რ ა ვ თ | დ ა | გ ა მ ო წ ი ო თ | ი ს | თ ქ ვ ე ნ კ ე ნ |	384960	FEMALE
1354	10368938856900176474.wav	თურქეთის სიდიდით მესამე ქალაქი იზმირია, სადაც დაახლოებით 3,7 მილიონი ადამიანი ცხოვრობს, ის სტამბოლის მერე მეორე უდიდესი პორტი და სატრანსპორტო საკვანძო ადგილია.	თურქეთის სიდიდით მესამე ქალაქი იზმირია სადაც დაახლოებით 3,7 მილიონი ადამიანი ცხოვრობს ის სტამბოლის მერე მეორე უდიდესი პორტი და სატრანსპორტო საკვანძო ადგილია	თ უ რ ქ ე თ ი ს | ს ი დ ი დ ი თ | მ ე ს ა მ ე | ქ ა ლ ა ქ ი | ი ზ მ ი რ ი ა | ს ა დ ა ც | დ ა ა ხ ლ ო ე ბ ი თ | 3 , 7 | მ ი ლ ი ო ნ ი | ა დ ა მ ი ა ნ ი | ც ხ ო ვ რ ო ბ ს | ი ს | ს ტ ა მ ბ ო ლ ი ს | მ ე რ ე | მ ე ო რ ე | უ დ ი დ ე ს ი | პ ო რ ტ ი | დ ა | ს ა ტ რ ა ნ ს პ ო რ ტ ო | ს ა კ ვ ა ნ ძ ო | ა დ გ ი ლ ი ა |	222720	FEMALE
224	9347206149529287158.wav	ბლეიკი მსჯავრდებული იყო მართლმსაჯულების განხორციელებაში ხელის შეშლის მცდელობისთვისაც.	ბლეიკი მსჯავრდებული იყო მართლმსაჯულების განხორციელებაში ხელის შეშლის მცდელობისთვისაც	ბ ლ ე ი კ ი | მ ს ჯ ა ვ რ დ ე ბ უ ლ ი | ი ყ ო | მ ა რ თ ლ მ ს ა ჯ უ ლ ე ბ ი ს | გ ა ნ ხ ო რ ც ი ე ლ ე ბ ა შ ი | ხ ე ლ ი ს | შ ე შ ლ ი ს | მ ც დ ე ლ ო ბ ი ს თ ვ ი ს ა ც |	137280	MALE
214	11893476890149319514.wav	იმ დროს ტერიტორიიდან ევაკუირებული იქნა თითქმის 100 მაცხოვრებელი.	იმ დროს ტერიტორიიდან ევაკუირებული იქნა თითქმის 100 მაცხოვრებელი	ი მ | დ რ ო ს | ტ ე რ ი ტ ო რ ი ი დ ა ნ | ე ვ ა კ უ ი რ ე ბ უ ლ ი | ი ქ ნ ა | თ ი თ ქ მ ი ს | 1 0 0 | მ ა ც ხ ო ვ რ ე ბ ე ლ ი |	104640	MALE
566	3403626206923155221.wav	მათ, ვინც რეგულარულ ფიზიკურ დატვირთვას ეწევა, ესაჭიროება მეტი მხარდაჭერა ტკივილის ნეგატიური აღქმის კუთხით, რათა განასხვაონ ქრონიკული ტკივილი და დისკომფორტი ნორმალური ფიზიკური მოძრაობისგან.	მათ ვინც რეგულარულ ფიზიკურ დატვირთვას ეწევა ესაჭიროება მეტი მხარდაჭერა ტკივილის ნეგატიური აღქმის კუთხით რათა განასხვაონ ქრონიკული ტკივილი და დისკომფორტი ნორმალური ფიზიკური მოძრაობისგან	მ ა თ | ვ ი ნ ც | რ ე გ უ ლ ა რ უ ლ | ფ ი ზ ი კ უ რ | დ ა ტ ვ ი რ თ ვ ა ს | ე წ ე ვ ა | ე ს ა ჭ ი რ ო ე ბ ა | მ ე ტ ი | მ ხ ა რ დ ა ჭ ე რ ა | ტ კ ი ვ ი ლ ი ს | ნ ე გ ა ტ ი უ რ ი | ა ღ ქ მ ი ს | კ უ თ ხ ი თ | რ ა თ ა | გ ა ნ ა ს ხ ვ ა ო ნ | ქ რ ო ნ ი კ უ ლ ი | ტ კ ი ვ ი ლ ი | დ ა | დ ი ს კ ო მ ფ ო რ ტ ი | ნ ო რ მ ა ლ უ რ ი | ფ ი ზ ი კ უ რ ი | მ ო ძ რ ა ო ბ ი ს გ ა ნ |	218880	FEMALE
40	15175441891633461620.wav	ყოველ გადაცემაში ასევე იქნება რჩევები იმ წიგნებზე, რომლებსაც ბავშვებმა ბიბლიოთეკაში შესვლისას უნდა მიაქციონ ყურადღება.	ყოველ გადაცემაში ასევე იქნება რჩევები იმ წიგნებზე რომლებსაც ბავშვებმა ბიბლიოთეკაში შესვლისას უნდა მიაქციონ ყურადღება	ყ ო ვ ე ლ | გ ა დ ა ც ე მ ა შ ი | ა ს ე ვ ე | ი ქ ნ ე ბ ა | რ ჩ ე ვ ე ბ ი | ი მ | წ ი გ ნ ე ბ ზ ე | რ ო მ ლ ე ბ ს ა ც | ბ ა ვ შ ვ ე ბ მ ა | ბ ი ბ ლ ი ო თ ე კ ა შ ი | შ ე ს ვ ლ ი ს ა ს | უ ნ დ ა | მ ი ა ქ ც ი ო ნ | ყ უ რ ა დ ღ ე ბ ა |	139200	MALE
1098	6124214293916968390.wav	კალიფორნიაში გაყიდვადი ძალადობრივი ვიდეო თამაშების ეტიკეტირება „18“-ით და მცირეწლოვანებისთვის მათი მიყიდვის შემთხვევაში 1000 აშშ დოლარის ოდენობით ჯარიმის დაკისრება მოითხოვება კანონპროექტით.	კალიფორნიაში გაყიდვადი ძალადობრივი ვიდეო თამაშების ეტიკეტირება 18 -ით და მცირეწლოვანებისთვის მათი მიყიდვის შემთხვევაში 1000 აშშ დოლარის ოდენობით ჯარიმის დაკისრება მოითხოვება კანონპროექტით	კ ა ლ ი ფ ო რ ნ ი ა შ ი | გ ა ყ ი დ ვ ა დ ი | ძ ა ლ ა დ ო ბ რ ი ვ ი | ვ ი დ ე ო | თ ა მ ა შ ე ბ ი ს | ე ტ ი კ ე ტ ი რ ე ბ ა | 1 8 | - ი თ | დ ა | მ ც ი რ ე წ ლ ო ვ ა ნ ე ბ ი ს თ ვ ი ს | მ ა თ ი | მ ი ყ ი დ ვ ი ს | შ ე მ თ ხ ვ ე ვ ა შ ი | 1 0 0 0 | ა შ შ | დ ო ლ ა რ ი ს | ო დ ე ნ ო ბ ი თ | ჯ ა რ ი მ ი ს | დ ა კ ი ს რ ე ბ ა | მ ო ი თ ხ ო ვ ე ბ ა | კ ა ნ ო ნ პ რ ო ე ქ ტ ი თ |	269760	MALE
