808	8801256440439445146.wav	ყავა არის მსოფლიოში ერთ-ერთი ყველაზე გაყიდვადი საქონელი, და თქვენ სავარაუდოდ თქვენს რეგიონშიც რამდენიმე ტიპის ყავის პოვნა შეგიძლიათ.	ყავა არის მსოფლიოში ერთ-ერთი ყველაზე გაყიდვადი საქონელი და თქვენ სავარაუდოდ თქვენს რეგიონშიც რამდენიმე ტიპის ყავის პოვნა შეგიძლიათ	ყ ა ვ ა | ა რ ი ს | მ ს ო ფ ლ ი ო შ ი | ე რ თ - ე რ თ ი | ყ ვ ე ლ ა ზ ე | გ ა ყ ი დ ვ ა დ ი | ს ა ქ ო ნ ე ლ ი | დ ა | თ ქ ვ ე ნ | ს ა ვ ა რ ა უ დ ო დ | თ ქ ვ ე ნ ს | რ ე გ ი ო ნ შ ი ც | რ ა მ დ ე ნ ი მ ე | ტ ი პ ი ს | ყ ა ვ ი ს | პ ო ვ ნ ა | შ ე გ ი ძ ლ ი ა თ |	297600	FEMALE
1247	955986406437104508.wav	მაგალითისთვის, ამერიკის მოქალაქეები, რომლებიც შუა აღმოსავლეთში იმყოფებიან შესაძლოა აღმოჩნდნენ ევროპელებისგან ან არაბებისგან განსხვავებულ სიტუაციაში.	მაგალითისთვის ამერიკის მოქალაქეები რომლებიც შუა აღმოსავლეთში იმყოფებიან შესაძლოა აღმოჩნდნენ ევროპელებისგან ან არაბებისგან განსხვავებულ სიტუაციაში	მ ა გ ა ლ ი თ ი ს თ ვ ი ს | ა მ ე რ ი კ ი ს | მ ო ქ ა ლ ა ქ ე ე ბ ი | რ ო მ ლ ე ბ ი ც | შ უ ა | ა ღ მ ო ს ა ვ ლ ე თ შ ი | ი მ ყ ო ფ ე ბ ი ა ნ | შ ე ს ა ძ ლ ო ა | ა ღ მ ო ჩ ნ დ ნ ე ნ | ე ვ რ ო პ ე ლ ე ბ ი ს გ ა ნ | ა ნ | ა რ ა ბ ე ბ ი ს გ ა ნ | გ ა ნ ს ხ ვ ა ვ ე ბ უ ლ | ს ი ტ უ ა ც ი ა შ ი |	185280	FEMALE
994	14024631848882023537.wav	თუმცა, ზამთრის პერიოდში ისინი განსხვავებული სილამაზითა და ხიბლით გამოირჩევიან, ისეთი მთის სადგურებით, სადაც საკმაო ოდენობით თოვლი მოდის და შესაძლებელია ისეთი აქტივობებით დაკავება, როგორიცაა სნოუბორდინგი და თხილამურებით სრიალი.	თუმცა ზამთრის პერიოდში ისინი განსხვავებული სილამაზითა და ხიბლით გამოირჩევიან ისეთი მთის სადგურებით სადაც საკმაო ოდენობით თოვლი მოდის და შესაძლებელია ისეთი აქტივობებით დაკავება როგორიცაა სნოუბორდინგი და თხილამურებით სრიალი	თ უ მ ც ა | ზ ა მ თ რ ი ს | პ ე რ ი ო დ შ ი | ი ს ი ნ ი | გ ა ნ ს ხ ვ ა ვ ე ბ უ ლ ი | ს ი ლ ა მ ა ზ ი თ ა | დ ა | ხ ი ბ ლ ი თ | გ ა მ ო ი რ ჩ ე ვ ი ა ნ | ი ს ე თ ი | მ თ ი ს | ს ა დ გ უ რ ე ბ ი თ | ს ა დ ა ც | ს ა კ მ ა ო | ო დ ე ნ ო ბ ი თ | თ ო ვ ლ ი | მ ო დ ი ს | დ ა | შ ე ს ა ძ ლ ე ბ ე ლ ი ა | ი ს ე თ ი | ა ქ ტ ი ვ ო ბ ე ბ ი თ | დ ა კ ა ვ ე ბ ა | რ ო გ ო რ ი ც ა ა | ს ნ ო უ ბ ო რ დ ი ნ გ ი | დ ა | თ ხ ი ლ ა მ უ რ ე ბ ი თ | ს რ ი ა ლ ი |	238080	FEMALE
465	7245337277335199204.wav	შუასაუკუნეების ტრადიციული ციხესიმაგრე უხსოვარი დროიდან შთააგონებდა წარმოსახვას რაინდული ტურნირებით, ბანკეტებითა და მეფე ართურის რაინდობის გამოსახულებებით.	შუასაუკუნეების ტრადიციული ციხესიმაგრე უხსოვარი დროიდან შთააგონებდა წარმოსახვას რაინდული ტურნირებით ბანკეტებითა და მეფე ართურის რაინდობის გამოსახულებებით	შ უ ა ს ა უ კ უ ნ ე ე ბ ი ს | ტ რ ა დ ი ც ი უ ლ ი | ც ი ხ ე ს ი მ ა გ რ ე | უ ხ ს ო ვ ა რ ი | დ რ ო ი დ ა ნ | შ თ ა ა გ ო ნ ე ბ დ ა | წ ა რ მ ო ს ა ხ ვ ა ს | რ ა ი ნ დ უ ლ ი | ტ უ რ ნ ი რ ე ბ ი თ | ბ ა ნ კ ე ტ ე ბ ი თ ა | დ ა | მ ე ფ ე | ა რ თ უ რ ი ს | რ ა ი ნ დ ო ბ ი ს | გ ა მ ო ს ა ხ უ ლ ე ბ ე ბ ი თ |	228480	MALE
1225	7995037594099890280.wav	უმჯობესია ატაროთ ბეჭედი (ოღონდ არა ის, რომელიც ზედმეტად ძვირადღირებულად გამოიყურება).	უმჯობესია ატაროთ ბეჭედი ოღონდ არა ის რომელიც ზედმეტად ძვირადღირებულად გამოიყურება	უ მ ჯ ო ბ ე ს ი ა | ა ტ ა რ ო თ | ბ ე ჭ ე დ ი | ო ღ ო ნ დ | ა რ ა | ი ს | რ ო მ ე ლ ი ც | ზ ე დ მ ე ტ ა დ | ძ ვ ი რ ა დ ღ ი რ ე ბ უ ლ ა დ | გ ა მ ო ი ყ უ რ ე ბ ა |	130560	MALE
861	5331533901074454583.wav	უყურადღებოდ დატოვებული ჩანთები ქურდების სამიზნე ხდება და ასევე, იპყრობს ძალოვანების ყურადღებას, რომლებიც ფრთხილად ეკიდებიან ბომბის საფრთხეს.	უყურადღებოდ დატოვებული ჩანთები ქურდების სამიზნე ხდება და ასევე იპყრობს ძალოვანების ყურადღებას რომლებიც ფრთხილად ეკიდებიან ბომბის საფრთხეს	უ ყ უ რ ა დ ღ ე ბ ო დ | დ ა ტ ო ვ ე ბ უ ლ ი | ჩ ა ნ თ ე ბ ი | ქ უ რ დ ე ბ ი ს | ს ა მ ი ზ ნ ე | ხ დ ე ბ ა | დ ა | ა ს ე ვ ე | ი პ ყ რ ო ბ ს | ძ ა ლ ო ვ ა ნ ე ბ ი ს | ყ უ რ ა დ ღ ე ბ ა ს | რ ო მ ლ ე ბ ი ც | ფ რ თ ხ ი ლ ა დ | ე კ ი დ ე ბ ი ა ნ | ბ ო მ ბ ი ს | ს ა ფ რ თ ხ ე ს |	211200	MALE
437	1003306681984556429.wav	დრუკიელ ძონგი — დანგრეული ციხე-სიმაგრე და ბუდისტური მონასტერია, რომელიც პაროს ოლქის ზედა ნაწილში (სოფელ ფონდიში) მდებარეობს.	დრუკიელ ძონგი — დანგრეული ციხე-სიმაგრე და ბუდისტური მონასტერია რომელიც პაროს ოლქის ზედა ნაწილში სოფელ ფონდიში მდებარეობს	დ რ უ კ ი ე ლ | ძ ო ნ გ ი | — | დ ა ნ გ რ ე უ ლ ი | ც ი ხ ე - ს ი მ ა გ რ ე | დ ა | ბ უ დ ი ს ტ უ რ ი | მ ო ნ ა ს ტ ე რ ი ა | რ ო მ ე ლ ი ც | პ ა რ ო ს | ო ლ ქ ი ს | ზ ე დ ა | ნ ა წ ი ლ შ ი | ს ო ფ ე ლ | ფ ო ნ დ ი შ ი | მ დ ე ბ ა რ ე ო ბ ს |	192960	FEMALE
1496	4821101139719548943.wav	სტანდარტულად, ამ საგანმანათლებლო პროგრამებითვის სწავლის საფასურია გადასახდელი.	სტანდარტულად ამ საგანმანათლებლო პროგრამებითვის სწავლის საფასურია გადასახდელი	ს ტ ა ნ დ ა რ ტ უ ლ ა დ | ა მ | ს ა გ ა ნ მ ა ნ ა თ ლ ე ბ ლ ო | პ რ ო გ რ ა მ ე ბ ი თ ვ ი ს | ს წ ა ვ ლ ი ს | ს ა ფ ა ს უ რ ი ა | გ ა დ ა ს ა ხ დ ე ლ ი |	124800	MALE
1190	14434937863095922067.wav	სამხრეთელ დემონსტრანტებს ბიშკეკის ზოგიერთი მობინადრე არაკანონიერი ქმედებების ჩადენაში სდებდა ბრალს.	სამხრეთელ დემონსტრანტებს ბიშკეკის ზოგიერთი მობინადრე არაკანონიერი ქმედებების ჩადენაში სდებდა ბრალს	ს ა მ ხ რ ე თ ე ლ | დ ე მ ო ნ ს ტ რ ა ნ ტ ე ბ ს | ბ ი შ კ ე კ ი ს | ზ ო გ ი ე რ თ ი | მ ო ბ ი ნ ა დ რ ე | ა რ ა კ ა ნ ო ნ ი ე რ ი | ქ მ ე დ ე ბ ე ბ ი ს | ჩ ა დ ე ნ ა შ ი | ს დ ე ბ დ ა | ბ რ ა ლ ს |	161280	MALE
1401	5086106768430602774.wav	შეერთებული შტატების გეოლოგიურ სამსახურს (USGS) და მიწისძვრის საინფორამციო ეროვნულ ცენტრს ჯერ არ მიუღიათ უახლოესი ცნობები ზარალის შესახებ.	შეერთებული შტატების გეოლოგიურ სამსახურს usgs და მიწისძვრის საინფორამციო ეროვნულ ცენტრს ჯერ არ მიუღიათ უახლოესი ცნობები ზარალის შესახებ	შ ე ე რ თ ე ბ უ ლ ი | შ ტ ა ტ ე ბ ი ს | გ ე ო ლ ო გ ი უ რ | ს ა მ ს ა ხ უ რ ს | u s g s | დ ა | მ ი წ ი ს ძ ვ რ ი ს | ს ა ი ნ ფ ო რ ა მ ც ი ო | ე რ ო ვ ნ უ ლ | ც ე ნ ტ რ ს | ჯ ე რ | ა რ | მ ი უ ღ ი ა თ | უ ა ხ ლ ო ე ს ი | ც ნ ო ბ ე ბ ი | ზ ა რ ა ლ ი ს | შ ე ს ა ხ ე ბ |	176640	FEMALE
951	17644692177872511235.wav	ეცადეთ, რომ ესაუბროთ რაც შეიძლება ბევრ ადამიანს. ცოტა ხანში ყველა გაგიცნობთ და მიიღებთ ინფორმაციას იმ ნავებზე, რომელიც ეძებს მგზავრებს.	ეცადეთ რომ ესაუბროთ რაც შეიძლება ბევრ ადამიანს ცოტა ხანში ყველა გაგიცნობთ და მიიღებთ ინფორმაციას იმ ნავებზე რომელიც ეძებს მგზავრებს	ე ც ა დ ე თ | რ ო მ | ე ს ა უ ბ რ ო თ | რ ა ც | შ ე ი ძ ლ ე ბ ა | ბ ე ვ რ | ა დ ა მ ი ა ნ ს | ც ო ტ ა | ხ ა ნ შ ი | ყ ვ ე ლ ა | გ ა გ ი ც ნ ო ბ თ | დ ა | მ ი ი ღ ე ბ თ | ი ნ ფ ო რ მ ა ც ი ა ს | ი მ | ნ ა ვ ე ბ ზ ე | რ ო მ ე ლ ი ც | ე ძ ე ბ ს | მ გ ზ ა ვ რ ე ბ ს |	170880	FEMALE
240	11334134567240674641.wav	პრობლემას 1-ლ იანვარს ჩაეყარა საფუძველი, როდესაც ობანაზავას ფოსტის წინაშე პრეტენზია გამოთქვა ათობით ადგილობრივმა მაცხოვრებელმა ტრადიციული და ყოველწლიური საახალწლო ბარათების მიუღებლობის გამო.	პრობლემას 1-ლ იანვარს ჩაეყარა საფუძველი როდესაც ობანაზავას ფოსტის წინაშე პრეტენზია გამოთქვა ათობით ადგილობრივმა მაცხოვრებელმა ტრადიციული და ყოველწლიური საახალწლო ბარათების მიუღებლობის გამო	პ რ ო ბ ლ ე მ ა ს | 1 - ლ | ი ა ნ ვ ა რ ს | ჩ ა ე ყ ა რ ა | ს ა ფ უ ძ ვ ე ლ ი | რ ო დ ე ს ა ც | ო ბ ა ნ ა ზ ა ვ ა ს | ფ ო ს ტ ი ს | წ ი ნ ა შ ე | პ რ ე ტ ე ნ ზ ი ა | გ ა მ ო თ ქ ვ ა | ა თ ო ბ ი თ | ა დ გ ი ლ ო ბ რ ი ვ მ ა | მ ა ც ხ ო ვ რ ე ბ ე ლ მ ა | ტ რ ა დ ი ც ი უ ლ ი | დ ა | ყ ო ვ ე ლ წ ლ ი უ რ ი | ს ა ა ხ ა ლ წ ლ ო | ბ ა რ ა თ ე ბ ი ს | მ ი უ ღ ე ბ ლ ო ბ ი ს | გ ა მ ო |	226560	FEMALE
1132	3206157699906003820.wav	იაპონური მუშაობის კულტურა იმასთან შედარებით რასაც დასავლეთი იყენებს, უფრო იერარქიული და ფორმალურია.	იაპონური მუშაობის კულტურა იმასთან შედარებით რასაც დასავლეთი იყენებს უფრო იერარქიული და ფორმალურია	ი ა პ ო ნ უ რ ი | მ უ შ ა ო ბ ი ს | კ უ ლ ტ უ რ ა | ი მ ა ს თ ა ნ | შ ე დ ა რ ე ბ ი თ | რ ა ს ა ც | დ ა ს ა ვ ლ ე თ ი | ი ყ ე ნ ე ბ ს | უ ფ რ ო | ი ე რ ა რ ქ ი უ ლ ი | დ ა | ფ ო რ მ ა ლ უ რ ი ა |	131520	FEMALE
467	14106252455650624081.wav	განა რეალობას ემყარება ფანტაზია? რატომ იყო, რომ ციხე-სიმაგრეები აშენდა უპირველეს ყოვლისა? როგორ დაპროექტდა და აშენდა ისინი?	განა რეალობას ემყარება ფანტაზია რატომ იყო რომ ციხე-სიმაგრეები აშენდა უპირველეს ყოვლისა როგორ დაპროექტდა და აშენდა ისინი	გ ა ნ ა | რ ე ა ლ ო ბ ა ს | ე მ ყ ა რ ე ბ ა | ფ ა ნ ტ ა ზ ი ა | რ ა ტ ო მ | ი ყ ო | რ ო მ | ც ი ხ ე - ს ი მ ა გ რ ე ე ბ ი | ა შ ე ნ დ ა | უ პ ი რ ვ ე ლ ე ს | ყ ო ვ ლ ი ს ა | რ ო გ ო რ | დ ა პ რ ო ე ქ ტ დ ა | დ ა | ა შ ე ნ დ ა | ი ს ი ნ ი |	171840	FEMALE
753	7237158812276813508.wav	მოკლედ რომ ვთქვათ, გზაზე მოგზაურობისთვის თქვენი მანქანის გამოყენება შესანიშნავია, მაგრამ იშვიათად გულისხმობს „კემპინგს“.	მოკლედ რომ ვთქვათ გზაზე მოგზაურობისთვის თქვენი მანქანის გამოყენება შესანიშნავია მაგრამ იშვიათად გულისხმობს კემპინგს	მ ო კ ლ ე დ | რ ო მ | ვ თ ქ ვ ა თ | გ ზ ა ზ ე | მ ო გ ზ ა უ რ ო ბ ი ს თ ვ ი ს | თ ქ ვ ე ნ ი | მ ა ნ ქ ა ნ ი ს | გ ა მ ო ყ ე ნ ე ბ ა | შ ე ს ა ნ ი შ ნ ა ვ ი ა | მ ა გ რ ა მ | ი შ ვ ი ა თ ა დ | გ უ ლ ი ს ხ მ ო ბ ს | კ ე მ პ ი ნ გ ს |	172800	FEMALE
343	9664413668389527945.wav	ჩვენ ვიმყოფებით ერთ წლიან ფინანსურ კრიზისში, რომლის ყველაზე მწვავე პერიოდი ორი თვის წინ იყო და ვფიქრობ, ახლა ფინანსური ბაზარი აღდგენას იწყებს“.	ჩვენ ვიმყოფებით ერთ წლიან ფინანსურ კრიზისში რომლის ყველაზე მწვავე პერიოდი ორი თვის წინ იყო და ვფიქრობ ახლა ფინანსური ბაზარი აღდგენას იწყებს	ჩ ვ ე ნ | ვ ი მ ყ ო ფ ე ბ ი თ | ე რ თ | წ ლ ი ა ნ | ფ ი ნ ა ნ ს უ რ | კ რ ი ზ ი ს შ ი | რ ო მ ლ ი ს | ყ ვ ე ლ ა ზ ე | მ წ ვ ა ვ ე | პ ე რ ი ო დ ი | ო რ ი | თ ვ ი ს | წ ი ნ | ი ყ ო | დ ა | ვ ფ ი ქ რ ო ბ | ა ხ ლ ა | ფ ი ნ ა ნ ს უ რ ი | ბ ა ზ ა რ ი | ა ღ დ გ ე ნ ა ს | ი წ ყ ე ბ ს |	169920	FEMALE
1023	12673178866317200284.wav	მავნებლებს შეუძლიათ გააფუჭონ საკვები, გამოიწვიონ გაღიზიანება ან, უარეს შემთხვევაში, ალერგიული რეაქციები, გაავრცელონ შხამი ან გადასცენ სხვას ინფექციები.	მავნებლებს შეუძლიათ გააფუჭონ საკვები გამოიწვიონ გაღიზიანება ან უარეს შემთხვევაში ალერგიული რეაქციები გაავრცელონ შხამი ან გადასცენ სხვას ინფექციები	მ ა ვ ნ ე ბ ლ ე ბ ს | შ ე უ ძ ლ ი ა თ | გ ა ა ფ უ ჭ ო ნ | ს ა კ ვ ე ბ ი | გ ა მ ო ი წ ვ ი ო ნ | გ ა ღ ი ზ ი ა ნ ე ბ ა | ა ნ | უ ა რ ე ს | შ ე მ თ ხ ვ ე ვ ა შ ი | ა ლ ე რ გ ი უ ლ ი | რ ე ა ქ ც ი ე ბ ი | გ ა ა ვ რ ც ე ლ ო ნ | შ ხ ა მ ი | ა ნ | გ ა დ ა ს ც ე ნ | ს ხ ვ ა ს | ი ნ ფ ე ქ ც ი ე ბ ი |	257280	MALE
1428	10536030121535119459.wav	დაღმართზე თხილამურებით სრიალის სპორტად ჩამოყალიბება არაუმეტეს მე-17 საუკუნეში დაიწყო, ხოლო 1861 წელს კი ნორვეგიელებმა პირველი სარეკრეაციო სათხილამურო კლუბი დაარსეს ავსტრალიაში.	დაღმართზე თხილამურებით სრიალის სპორტად ჩამოყალიბება არაუმეტეს მე-17 საუკუნეში დაიწყო ხოლო 1861 წელს კი ნორვეგიელებმა პირველი სარეკრეაციო სათხილამურო კლუბი დაარსეს ავსტრალიაში	დ ა ღ მ ა რ თ ზ ე | თ ხ ი ლ ა მ უ რ ე ბ ი თ | ს რ ი ა ლ ი ს | ს პ ო რ ტ ა დ | ჩ ა მ ო ყ ა ლ ი ბ ე ბ ა | ა რ ა უ მ ე ტ ე ს | მ ე - 1 7 | ს ა უ კ უ ნ ე შ ი | დ ა ი წ ყ ო | ხ ო ლ ო | 1 8 6 1 | წ ე ლ ს | კ ი | ნ ო რ ვ ე გ ი ე ლ ე ბ მ ა | პ ი რ ვ ე ლ ი | ს ა რ ე კ რ ე ა ც ი ო | ს ა თ ხ ი ლ ა მ უ რ ო | კ ლ უ ბ ი | დ ა ა რ ს ე ს | ა ვ ს ტ რ ა ლ ი ა შ ი |	209280	FEMALE
1397	6941574722563727731.wav	ამასთანავე, გახსოვდეთ, რომ დათვებს და სხვა ველურ ცხოველებს სუნი იზიდავს, ამიტომ სუნიანი საკვების ტარებას ან მომზადებას მოერიდეთ და ბანაკი სუფთად შეინარჩუნეთ.	ამასთანავე გახსოვდეთ რომ დათვებს და სხვა ველურ ცხოველებს სუნი იზიდავს ამიტომ სუნიანი საკვების ტარებას ან მომზადებას მოერიდეთ და ბანაკი სუფთად შეინარჩუნეთ	ა მ ა ს თ ა ნ ა ვ ე | გ ა ხ ს ო ვ დ ე თ | რ ო მ | დ ა თ ვ ე ბ ს | დ ა | ს ხ ვ ა | ვ ე ლ უ რ | ც ხ ო ვ ე ლ ე ბ ს | ს უ ნ ი | ი ზ ი დ ა ვ ს | ა მ ი ტ ო მ | ს უ ნ ი ა ნ ი | ს ა კ ვ ე ბ ი ს | ტ ა რ ე ბ ა ს | ა ნ | მ ო მ ზ ა დ ე ბ ა ს | მ ო ე რ ი დ ე თ | დ ა | ბ ა ნ ა კ ი | ს უ ფ თ ა დ | შ ე ი ნ ა რ ჩ უ ნ ე თ |	228480	FEMALE
878	5567853900743313400.wav	პათოგენით გამოწვეული დაავადება, როგორიცაა ვირუსი, ბაქტერია, სოკო ან სხვა პარაზიტები არის ინფექციური დაავადება.	პათოგენით გამოწვეული დაავადება როგორიცაა ვირუსი ბაქტერია სოკო ან სხვა პარაზიტები არის ინფექციური დაავადება	პ ა თ ო გ ე ნ ი თ | გ ა მ ო წ ვ ე უ ლ ი | დ ა ა ვ ა დ ე ბ ა | რ ო გ ო რ ი ც ა ა | ვ ი რ უ ს ი | ბ ა ქ ტ ე რ ი ა | ს ო კ ო | ა ნ | ს ხ ვ ა | პ ა რ ა ზ ი ტ ე ბ ი | ა რ ი ს | ი ნ ფ ე ქ ც ი უ რ ი | დ ა ა ვ ა დ ე ბ ა |	164160	MALE
