1067	1727028880488801633.wav	კარგ პირობებში თქვენ შეგიძლიათ გაიაროთ უფრო დიდი მანძილი, ვიდრე ფეხით სიარულის დროს, მაგრამ ძალიან იშვიათია ყველგანმავალი სათხილამურო სიჩქარის მიღება მოვლილ ბილიკებზე მძიმე ზურგჩანთის გარეშე.	კარგ პირობებში თქვენ შეგიძლიათ გაიაროთ უფრო დიდი მანძილი ვიდრე ფეხით სიარულის დროს მაგრამ ძალიან იშვიათია ყველგანმავალი სათხილამურო სიჩქარის მიღება მოვლილ ბილიკებზე მძიმე ზურგჩანთის გარეშე	კ ა რ გ | პ ი რ ო ბ ე ბ შ ი | თ ქ ვ ე ნ | შ ე გ ი ძ ლ ი ა თ | გ ა ი ა რ ო თ | უ ფ რ ო | დ ი დ ი | მ ა ნ ძ ი ლ ი | ვ ი დ რ ე | ფ ე ხ ი თ | ს ი ა რ უ ლ ი ს | დ რ ო ს | მ ა გ რ ა მ | ძ ა ლ ი ა ნ | ი შ ვ ი ა თ ი ა | ყ ვ ე ლ გ ა ნ მ ა ვ ა ლ ი | ს ა თ ხ ი ლ ა მ უ რ ო | ს ი ჩ ქ ა რ ი ს | მ ი ღ ე ბ ა | მ ო ვ ლ ი ლ | ბ ი ლ ი კ ე ბ ზ ე | მ ძ ი მ ე | ზ უ რ გ ჩ ა ნ თ ი ს | გ ა რ ე შ ე |	252480	FEMALE
586	1308920462264491565.wav	მე-16 საუკუნის ბოლოს, ევროპაში პირველი ნამდვილი ტელესკოპი შეიქმნა.	მე-16 საუკუნის ბოლოს ევროპაში პირველი ნამდვილი ტელესკოპი შეიქმნა	მ ე - 1 6 | ს ა უ კ უ ნ ი ს | ბ ო ლ ო ს | ე ვ რ ო პ ა შ ი | პ ი რ ვ ე ლ ი | ნ ა მ დ ვ ი ლ ი | ტ ე ლ ე ს კ ო პ ი | შ ე ი ქ მ ნ ა |	109440	MALE
1198	11876627872323333766.wav	მიხაელ შუმახერმა რბოლა ალონსოს მერე რბოლა მალევე დაასრულა, რბოლის დროს რამდენიმე დაჯახების შედეგად მიღებული დაზიანების გამო.	მიხაელ შუმახერმა რბოლა ალონსოს მერე რბოლა მალევე დაასრულა რბოლის დროს რამდენიმე დაჯახების შედეგად მიღებული დაზიანების გამო	მ ი ხ ა ე ლ | შ უ მ ა ხ ე რ მ ა | რ ბ ო ლ ა | ა ლ ო ნ ს ო ს | მ ე რ ე | რ ბ ო ლ ა | მ ა ლ ე ვ ე | დ ა ა ს რ უ ლ ა | რ ბ ო ლ ი ს | დ რ ო ს | რ ა მ დ ე ნ ი მ ე | დ ა ჯ ა ხ ე ბ ი ს | შ ე დ ე გ ა დ | მ ი ღ ე ბ უ ლ ი | დ ა ზ ი ა ნ ე ბ ი ს | გ ა მ ო |	178560	MALE
1245	3632689159811138148.wav	თოვლის ან ნამქერის, მანქანის მინებზე წარმოქმნილი კონდენსაციის ან ყინულის საფარის გამო ხილვადობა შეიძლება ასევე შეიზღუდოს.	თოვლის ან ნამქერის მანქანის მინებზე წარმოქმნილი კონდენსაციის ან ყინულის საფარის გამო ხილვადობა შეიძლება ასევე შეიზღუდოს	თ ო ვ ლ ი ს | ა ნ | ნ ა მ ქ ე რ ი ს | მ ა ნ ქ ა ნ ი ს | მ ი ნ ე ბ ზ ე | წ ა რ მ ო ქ მ ნ ი ლ ი | კ ო ნ დ ე ნ ს ა ც ი ი ს | ა ნ | ყ ი ნ უ ლ ი ს | ს ა ფ ა რ ი ს | გ ა მ ო | ხ ი ლ ვ ა დ ო ბ ა | შ ე ი ძ ლ ე ბ ა | ა ს ე ვ ე | შ ე ი ზ ღ უ დ ო ს |	171840	FEMALE
369	11843872914910895577.wav	ასეთი კბილებით ტრიცერატოპებს არა მხოლოდ ფოთლების ჭამა შეეძლოთ, არამედ მყარი ტოტებისა და ფესვების დაკვნეტასაც კარგად ახერხებდნენ.	ასეთი კბილებით ტრიცერატოპებს არა მხოლოდ ფოთლების ჭამა შეეძლოთ არამედ მყარი ტოტებისა და ფესვების დაკვნეტასაც კარგად ახერხებდნენ	ა ს ე თ ი | კ ბ ი ლ ე ბ ი თ | ტ რ ი ც ე რ ა ტ ო პ ე ბ ს | ა რ ა | მ ხ ო ლ ო დ | ფ ო თ ლ ე ბ ი ს | ჭ ა მ ა | შ ე ე ძ ლ ო თ | ა რ ა მ ე დ | მ ყ ა რ ი | ტ ო ტ ე ბ ი ს ა | დ ა | ფ ე ს ვ ე ბ ი ს | დ ა კ ვ ნ ე ტ ა ს ა ც | კ ა რ გ ა დ | ა ხ ე რ ხ ე ბ დ ნ ე ნ |	331200	FEMALE
837	13986257500241161676.wav	არქიტექტურა დაკავშირებულია შენობების დიზაინსა და კონტრუქციასთან. ადგილის არქიტექტურა ხშირად ტურისტულ ღირსშესანიშნაობას თავად წარმოადგენს.	არქიტექტურა დაკავშირებულია შენობების დიზაინსა და კონტრუქციასთან ადგილის არქიტექტურა ხშირად ტურისტულ ღირსშესანიშნაობას თავად წარმოადგენს	ა რ ქ ი ტ ე ქ ტ უ რ ა | დ ა კ ა ვ შ ი რ ე ბ უ ლ ი ა | შ ე ნ ო ბ ე ბ ი ს | დ ი ზ ა ი ნ ს ა | დ ა | კ ო ნ ტ რ უ ქ ც ი ა ს თ ა ნ | ა დ გ ი ლ ი ს | ა რ ქ ი ტ ე ქ ტ უ რ ა | ხ შ ი რ ა დ | ტ უ რ ი ს ტ უ ლ | ღ ი რ ს შ ე ს ა ნ ი შ ნ ა ო ბ ა ს | თ ა ვ ა დ | წ ა რ მ ო ა დ გ ე ნ ს |	123840	MALE
780	3215443503926484472.wav	ზოგიერთი საშუალო ფორმატის ვიდეოკამერა 6-6 სმ ფორმატს იყენებს, უფრო სწორედ კი 56-დან 56 მმ-იან ნეგატივს.	ზოგიერთი საშუალო ფორმატის ვიდეოკამერა 6-6 სმ ფორმატს იყენებს უფრო სწორედ კი 56-დან 56 მმ-იან ნეგატივს	ზ ო გ ი ე რ თ ი | ს ა შ უ ა ლ ო | ფ ო რ მ ა ტ ი ს | ვ ი დ ე ო კ ა მ ე რ ა | 6 - 6 | ს მ | ფ ო რ მ ა ტ ს | ი ყ ე ნ ე ბ ს | უ ფ რ ო | ს წ ო რ ე დ | კ ი | 5 6 - დ ა ნ | 5 6 | მ მ - ი ა ნ | ნ ე გ ა ტ ი ვ ს |	178560	MALE
362	11229493749676478403.wav	ფოტონები ატომის შემადგენელ ნაწილაკებთან შედარებით კივედ უფრო პატარაა!	ფოტონები ატომის შემადგენელ ნაწილაკებთან შედარებით კივედ უფრო პატარაა	ფ ო ტ ო ნ ე ბ ი | ა ტ ო მ ი ს | შ ე მ ა დ გ ე ნ ე ლ | ნ ა წ ი ლ ა კ ე ბ თ ა ნ | შ ე დ ა რ ე ბ ი თ | კ ი ვ ე დ | უ ფ რ ო | პ ა ტ ა რ ა ა |	111360	MALE
90	9143850771147739979.wav	თუმცა წყარომ, რომელსაც გააჩნდა ცნობები გამოძიების შესახებ, მინეაპოლისის სტარ ტრიბიუნს განუცხადა, რომ ეს იყო რედ ლეიქ თრაიბალის თავმჯდომარის, ფლოიდ ჯურდანის 16 წლის ვაჟი ლუი ჯურდანი.	თუმცა წყარომ რომელსაც გააჩნდა ცნობები გამოძიების შესახებ მინეაპოლისის სტარ ტრიბიუნს განუცხადა რომ ეს იყო რედ ლეიქ თრაიბალის თავმჯდომარის ფლოიდ ჯურდანის 16 წლის ვაჟი ლუი ჯურდანი	თ უ მ ც ა | წ ყ ა რ ო მ | რ ო მ ე ლ ს ა ც | გ ა ა ჩ ნ დ ა | ც ნ ო ბ ე ბ ი | გ ა მ ო ძ ი ე ბ ი ს | შ ე ს ა ხ ე ბ | მ ი ნ ე ა პ ო ლ ი ს ი ს | ს ტ ა რ | ტ რ ი ბ ი უ ნ ს | გ ა ნ უ ც ხ ა დ ა | რ ო მ | ე ს | ი ყ ო | რ ე დ | ლ ე ი ქ | თ რ ა ი ბ ა ლ ი ს | თ ა ვ მ ჯ დ ო მ ა რ ი ს | ფ ლ ო ი დ | ჯ უ რ დ ა ნ ი ს | 1 6 | წ ლ ი ს | ვ ა ჟ ი | ლ უ ი | ჯ უ რ დ ა ნ ი |	459840	FEMALE
401	3280637839001918854.wav	ახლა რაც შეეხება იაპონიას. იაპონია კუნძულოვანი სახელმწიფო იყო, ზუსტად ბრიტანეთის მსგავსად.	ახლა რაც შეეხება იაპონიას იაპონია კუნძულოვანი სახელმწიფო იყო ზუსტად ბრიტანეთის მსგავსად	ა ხ ლ ა | რ ა ც | შ ე ე ხ ე ბ ა | ი ა პ ო ნ ი ა ს | ი ა პ ო ნ ი ა | კ უ ნ ძ უ ლ ო ვ ა ნ ი | ს ა ხ ე ლ მ წ ი ფ ო | ი ყ ო | ზ უ ს ტ ა დ | ბ რ ი ტ ა ნ ე თ ი ს | მ ს გ ა ვ ს ა დ |	136320	MALE
453	5546457713233378022.wav	ინტერაქტიული დიზაინი მოითხოვს თქვენი მედიის წარმოების შესახებ ვარაუდების გადახედვას და არასწორხაზოვან აზროვნებას.	ინტერაქტიული დიზაინი მოითხოვს თქვენი მედიის წარმოების შესახებ ვარაუდების გადახედვას და არასწორხაზოვან აზროვნებას	ი ნ ტ ე რ ა ქ ტ ი უ ლ ი | დ ი ზ ა ი ნ ი | მ ო ი თ ხ ო ვ ს | თ ქ ვ ე ნ ი | მ ე დ ი ი ს | წ ა რ მ ო ე ბ ი ს | შ ე ს ა ხ ე ბ | ვ ა რ ა უ დ ე ბ ი ს | გ ა დ ა ხ ე დ ვ ა ს | დ ა | ა რ ა ს წ ო რ ხ ა ზ ო ვ ა ნ | ა ზ რ ო ვ ნ ე ბ ა ს |	156480	FEMALE
379	15925749756708930806.wav	1610 წელს, დაახლოებით სამი ათასი წლის შემდეგ, გალილეო გალილეიმ, იტალიელმა ასტრონომმა ტელესკოპით დაკვირვებისას აღმოაჩინა, რომ ზუსტად მთვარის მსგავსად ვენერასაც ფაზები აქვს.	1610 წელს დაახლოებით სამი ათასი წლის შემდეგ გალილეო გალილეიმ იტალიელმა ასტრონომმა ტელესკოპით დაკვირვებისას აღმოაჩინა რომ ზუსტად მთვარის მსგავსად ვენერასაც ფაზები აქვს	1 6 1 0 | წ ე ლ ს | დ ა ა ხ ლ ო ე ბ ი თ | ს ა მ ი | ა თ ა ს ი | წ ლ ი ს | შ ე მ დ ე გ | გ ა ლ ი ლ ე ო | გ ა ლ ი ლ ე ი მ | ი ტ ა ლ ი ე ლ მ ა | ა ს ტ რ ო ნ ო მ მ ა | ტ ე ლ ე ს კ ო პ ი თ | დ ა კ ვ ი რ ვ ე ბ ი ს ა ს | ა ღ მ ო ა ჩ ი ნ ა | რ ო მ | ზ უ ს ტ ა დ | მ თ ვ ა რ ი ს | მ ს გ ა ვ ს ა დ | ვ ე ნ ე რ ა ს ა ც | ფ ა ზ ე ბ ი | ა ქ ვ ს |	240000	FEMALE
646	12298600003811438322.wav	სინამდვილეში, არაფერია სასწავლი. სწავლება ეფუძნება მოსწავლეს გამოცდილებას და წარმოდგენილ ცოდნას.	სინამდვილეში არაფერია სასწავლი სწავლება ეფუძნება მოსწავლეს გამოცდილებას და წარმოდგენილ ცოდნას	ს ი ნ ა მ დ ვ ი ლ ე შ ი | ა რ ა ფ ე რ ი ა | ს ა ს წ ა ვ ლ ი | ს წ ა ვ ლ ე ბ ა | ე ფ უ ძ ნ ე ბ ა | მ ო ს წ ა ვ ლ ე ს | გ ა მ ო ც დ ი ლ ე ბ ა ს | დ ა | წ ა რ მ ო დ გ ე ნ ი ლ | ც ო დ ნ ა ს |	116160	MALE
416	14417451764871006479.wav	პითაგორა არის ასევე ერთ-ერთი ცნობილი მათემატიკოსი, რომელიც ცნობილია მართკუთხა სამკუთხედების გვერდებს შორის ურთიერთკავშირის თეორემით.	პითაგორა არის ასევე ერთ-ერთი ცნობილი მათემატიკოსი რომელიც ცნობილია მართკუთხა სამკუთხედების გვერდებს შორის ურთიერთკავშირის თეორემით	პ ი თ ა გ ო რ ა | ა რ ი ს | ა ს ე ვ ე | ე რ თ - ე რ თ ი | ც ნ ო ბ ი ლ ი | მ ა თ ე მ ა ტ ი კ ო ს ი | რ ო მ ე ლ ი ც | ც ნ ო ბ ი ლ ი ა | მ ა რ თ კ უ თ ხ ა | ს ა მ კ უ თ ხ ე დ ე ბ ი ს | გ ვ ე რ დ ე ბ ს | შ ო რ ი ს | უ რ თ ი ე რ თ კ ა ვ შ ი რ ი ს | თ ე ო რ ე მ ი თ |	178560	MALE
1216	6702316926193198942.wav	წყნარ ოკეანეზე განთავსებულია ჩრდილოეთ სანაპიროები (ჩრდილოეთ ჰარბორის რეგიონი), რომლებიც ჩრდილოეთით ლონგ-ბეიდან სამხრეთით დევონპორტამდეა განფენილი.	წყნარ ოკეანეზე განთავსებულია ჩრდილოეთ სანაპიროები ჩრდილოეთ ჰარბორის რეგიონი რომლებიც ჩრდილოეთით ლონგ-ბეიდან სამხრეთით დევონპორტამდეა განფენილი	წ ყ ნ ა რ | ო კ ე ა ნ ე ზ ე | გ ა ნ თ ა ვ ს ე ბ უ ლ ი ა | ჩ რ დ ი ლ ო ე თ | ს ა ნ ა პ ი რ ო ე ბ ი | ჩ რ დ ი ლ ო ე თ | ჰ ა რ ბ ო რ ი ს | რ ე გ ი ო ნ ი | რ ო მ ლ ე ბ ი ც | ჩ რ დ ი ლ ო ე თ ი თ | ლ ო ნ გ - ბ ე ი დ ა ნ | ს ა მ ხ რ ე თ ი თ | დ ე ვ ო ნ პ ო რ ტ ა მ დ ე ა | გ ა ნ ფ ე ნ ი ლ ი |	258240	MALE
65	443925708826083131.wav	მარტა სუპლისმა, სან პაულოს ყოფილმა მერმა შეადგინა საწყისი კანონპროექტი. რედაქტირების შემდეგ, ამჟამად რობერტო ჯეფერსონის ხელშია შეთავაზებული კანონპროექტი.	მარტა სუპლისმა სან პაულოს ყოფილმა მერმა შეადგინა საწყისი კანონპროექტი რედაქტირების შემდეგ ამჟამად რობერტო ჯეფერსონის ხელშია შეთავაზებული კანონპროექტი	მ ა რ ტ ა | ს უ პ ლ ი ს მ ა | ს ა ნ | პ ა უ ლ ო ს | ყ ო ფ ი ლ მ ა | მ ე რ მ ა | შ ე ა დ გ ი ნ ა | ს ა წ ყ ი ს ი | კ ა ნ ო ნ პ რ ო ე ქ ტ ი | რ ე დ ა ქ ტ ი რ ე ბ ი ს | შ ე მ დ ე გ | ა მ ჟ ა მ ა დ | რ ო ბ ე რ ტ ო | ჯ ე ფ ე რ ს ო ნ ი ს | ხ ე ლ შ ი ა | შ ე თ ა ვ ა ზ ე ბ უ ლ ი | კ ა ნ ო ნ პ რ ო ე ქ ტ ი |	206400	MALE
767	10257625025950415584.wav	2022 წლის ზამთრის ოლიმპიური თამაშების მასპინძელი ქალაქი იქნება პეკინი, ჩინეთი, რითაც ის გახდება პირველი ქალაქი, რომელიც უმასპინძლებს ორივეს, ზაფხულის და ზამთრის ოლიმპიურ თამაშებს.	2022 წლის ზამთრის ოლიმპიური თამაშების მასპინძელი ქალაქი იქნება პეკინი ჩინეთი რითაც ის გახდება პირველი ქალაქი რომელიც უმასპინძლებს ორივეს ზაფხულის და ზამთრის ოლიმპიურ თამაშებს	2 0 2 2 | წ ლ ი ს | ზ ა მ თ რ ი ს | ო ლ ი მ პ ი უ რ ი | თ ა მ ა შ ე ბ ი ს | მ ა ს პ ი ნ ძ ე ლ ი | ქ ა ლ ა ქ ი | ი ქ ნ ე ბ ა | პ ე კ ი ნ ი | ჩ ი ნ ე თ ი | რ ი თ ა ც | ი ს | გ ა ხ დ ე ბ ა | პ ი რ ვ ე ლ ი | ქ ა ლ ა ქ ი | რ ო მ ე ლ ი ც | უ მ ა ს პ ი ნ ძ ლ ე ბ ს | ო რ ი ვ ე ს | ზ ა ფ ხ უ ლ ი ს | დ ა | ზ ა მ თ რ ი ს | ო ლ ი მ პ ი უ რ | თ ა მ ა შ ე ბ ს |	259200	FEMALE
679	9445059660612808619.wav	ყველა ქვეყანას აქვს უნიკალური კანონები, რომლებიც ადგენენ თუ რა საგნები უნდა იყოს მანქანაში საგანგებო სიტუაციისთვის.	ყველა ქვეყანას აქვს უნიკალური კანონები რომლებიც ადგენენ თუ რა საგნები უნდა იყოს მანქანაში საგანგებო სიტუაციისთვის	ყ ვ ე ლ ა | ქ ვ ე ყ ა ნ ა ს | ა ქ ვ ს | უ ნ ი კ ა ლ უ რ ი | კ ა ნ ო ნ ე ბ ი | რ ო მ ლ ე ბ ი ც | ა დ გ ე ნ ე ნ | თ უ | რ ა | ს ა გ ნ ე ბ ი | უ ნ დ ა | ი ყ ო ს | მ ა ნ ქ ა ნ ა შ ი | ს ა გ ა ნ გ ე ბ ო | ს ი ტ უ ა ც ი ი ს თ ვ ი ს |	152640	MALE
1232	3341405211143619984.wav	ადაპტაცია ორ ფეხზე სიარულზე აღმოჩენილია ავსტრალოპითეკის ნამარხზე, 4.2-3.9 მილიონი წლის წინ, მაგრამ საჰელანთროპი დიდი ალბათობით უფრო ადრე, შვიდი მილიონი წლის წინ გადაადგილდებოდა ორ ფეხზე.	ადაპტაცია ორ ფეხზე სიარულზე აღმოჩენილია ავსტრალოპითეკის ნამარხზე 4.2-3.9 მილიონი წლის წინ მაგრამ საჰელანთროპი დიდი ალბათობით უფრო ადრე შვიდი მილიონი წლის წინ გადაადგილდებოდა ორ ფეხზე	ა დ ა პ ტ ა ც ი ა | ო რ | ფ ე ხ ზ ე | ს ი ა რ უ ლ ზ ე | ა ღ მ ო ჩ ე ნ ი ლ ი ა | ა ვ ს ტ რ ა ლ ო პ ი თ ე კ ი ს | ნ ა მ ა რ ხ ზ ე | 4 . 2 - 3 . 9 | მ ი ლ ი ო ნ ი | წ ლ ი ს | წ ი ნ | მ ა გ რ ა მ | ს ა ჰ ე ლ ა ნ თ რ ო პ ი | დ ი დ ი | ა ლ ბ ა თ ო ბ ი თ | უ ფ რ ო | ა დ რ ე | შ ვ ი დ ი | მ ი ლ ი ო ნ ი | წ ლ ი ს | წ ი ნ | გ ა დ ა ა დ გ ი ლ დ ე ბ ო დ ა | ო რ | ფ ე ხ ზ ე |	280320	FEMALE
542	8631541670271578145.wav	სტარკის ხალხმა კოლონისტის პოზიციიდან ჩრდილოეთით არსებული ღობის გასწვრივ დაიკავეს პოზიციები.	სტარკის ხალხმა კოლონისტის პოზიციიდან ჩრდილოეთით არსებული ღობის გასწვრივ დაიკავეს პოზიციები	ს ტ ა რ კ ი ს | ხ ა ლ ხ მ ა | კ ო ლ ო ნ ი ს ტ ი ს | პ ო ზ ი ც ი ი დ ა ნ | ჩ რ დ ი ლ ო ე თ ი თ | ა რ ს ე ბ უ ლ ი | ღ ო ბ ი ს | გ ა ს წ ვ რ ი ვ | დ ა ი კ ა ვ ე ს | პ ო ზ ი ც ი ე ბ ი |	138240	FEMALE
