466	4806130592924466297.wav	ადვილია გაიხსენო დიდი ხნის წინ დამთავრებული ბრძოლების ხმა და სუნი, გაიგო ქვაფენილზე ჩლიქების ხმა და შეიგრძნო საპყრობილეს ორმოებიდან ამომავალი შიშის სუნი მაშინაც კი, როდესაც ათასწლოვან ნანგრევებში დგახარ.	ადვილია გაიხსენო დიდი ხნის წინ დამთავრებული ბრძოლების ხმა და სუნი გაიგო ქვაფენილზე ჩლიქების ხმა და შეიგრძნო საპყრობილეს ორმოებიდან ამომავალი შიშის სუნი მაშინაც კი როდესაც ათასწლოვან ნანგრევებში დგახარ	ა დ ვ ი ლ ი ა | გ ა ი ხ ს ე ნ ო | დ ი დ ი | ხ ნ ი ს | წ ი ნ | დ ა მ თ ა ვ რ ე ბ უ ლ ი | ბ რ ძ ო ლ ე ბ ი ს | ხ მ ა | დ ა | ს უ ნ ი | გ ა ი გ ო | ქ ვ ა ფ ე ნ ი ლ ზ ე | ჩ ლ ი ქ ე ბ ი ს | ხ მ ა | დ ა | შ ე ი გ რ ძ ნ ო | ს ა პ ყ რ ო ბ ი ლ ე ს | ო რ მ ო ე ბ ი დ ა ნ | ა მ ო მ ა ვ ა ლ ი | შ ი შ ი ს | ს უ ნ ი | მ ა შ ი ნ ა ც | კ ი | რ ო დ ე ს ა ც | ა თ ა ს წ ლ ო ვ ა ნ | ნ ა ნ გ რ ე ვ ე ბ შ ი | დ გ ა ხ ა რ |	262080	FEMALE
175	18087129076722226994.wav	მსოფლიოში ერთ-ერთმა ყველაზე მდიდარმა ადამიანმა, ალენმა, მომხდარი ომით მთელი ცხოვრების მანძილზე დაინტერესების გამო თავისი სიმდიდრის დიდი ნაწილის ინვესტირება საზღვაო კვლევაში და მუსაშის ძიებაში დაიწყო.	მსოფლიოში ერთ-ერთმა ყველაზე მდიდარმა ადამიანმა ალენმა მომხდარი ომით მთელი ცხოვრების მანძილზე დაინტერესების გამო თავისი სიმდიდრის დიდი ნაწილის ინვესტირება საზღვაო კვლევაში და მუსაშის ძიებაში დაიწყო	მ ს ო ფ ლ ი ო შ ი | ე რ თ - ე რ თ მ ა | ყ ვ ე ლ ა ზ ე | მ დ ი დ ა რ მ ა | ა დ ა მ ი ა ნ მ ა | ა ლ ე ნ მ ა | მ ო მ ხ დ ა რ ი | ო მ ი თ | მ თ ე ლ ი | ც ხ ო ვ რ ე ბ ი ს | მ ა ნ ძ ი ლ ზ ე | დ ა ი ნ ტ ე რ ე ს ე ბ ი ს | გ ა მ ო | თ ა ვ ი ს ი | ს ი მ დ ი დ რ ი ს | დ ი დ ი | ნ ა წ ი ლ ი ს | ი ნ ვ ე ს ტ ი რ ე ბ ა | ს ა ზ ღ ვ ა ო | კ ვ ლ ე ვ ა შ ი | დ ა | მ უ ს ა შ ი ს | ძ ი ე ბ ა შ ი | დ ა ი წ ყ ო |	228480	FEMALE
897	14857614088745416969.wav	ყალიბი საკმაოდ სქელი უნდა იყოს, 5 მმ (1/5 ინჩი) ან მეტი, ხოლო ქსოვილი დაბალ ტემპერატურაზე უნდა იყოს საკმარისად რბილი.	ყალიბი საკმაოდ სქელი უნდა იყოს 5 მმ 1/5 ინჩი ან მეტი ხოლო ქსოვილი დაბალ ტემპერატურაზე უნდა იყოს საკმარისად რბილი	ყ ა ლ ი ბ ი | ს ა კ მ ა ო დ | ს ქ ე ლ ი | უ ნ დ ა | ი ყ ო ს | 5 | მ მ | 1 / 5 | ი ნ ჩ ი | ა ნ | მ ე ტ ი | ხ ო ლ ო | ქ ს ო ვ ი ლ ი | დ ა ბ ა ლ | ტ ე მ პ ე რ ა ტ უ რ ა ზ ე | უ ნ დ ა | ი ყ ო ს | ს ა კ მ ა რ ი ს ა დ | რ ბ ი ლ ი |	184320	MALE
859	16695740559529802436.wav	ეს მოიცავს რიგში დგომასაც, რადგან ნარკოტიკების მაძიებელი ძაღლების გამოყენება წინასწარი შეტყობინების გარეშე ნებისმიერ დროს არის შესაძლებელი.	ეს მოიცავს რიგში დგომასაც რადგან ნარკოტიკების მაძიებელი ძაღლების გამოყენება წინასწარი შეტყობინების გარეშე ნებისმიერ დროს არის შესაძლებელი	ე ს | მ ო ი ც ა ვ ს | რ ი გ შ ი | დ გ ო მ ა ს ა ც | რ ა დ გ ა ნ | ნ ა რ კ ო ტ ი კ ე ბ ი ს | მ ა ძ ი ე ბ ე ლ ი | ძ ა ღ ლ ე ბ ი ს | გ ა მ ო ყ ე ნ ე ბ ა | წ ი ნ ა ს წ ა რ ი | შ ე ტ ყ ო ბ ი ნ ე ბ ი ს | გ ა რ ე შ ე | ნ ე ბ ი ს მ ი ე რ | დ რ ო ს | ა რ ი ს | შ ე ს ა ძ ლ ე ბ ე ლ ი |	165120	FEMALE
204	10489497216756843523.wav	ნალექების ნაწილს ელჭექი და ხშირი გაელვება ახლდა თან.	ნალექების ნაწილს ელჭექი და ხშირი გაელვება ახლდა თან	ნ ა ლ ე ქ ე ბ ი ს | ნ ა წ ი ლ ს | ე ლ ჭ ე ქ ი | დ ა | ხ შ ი რ ი | გ ა ე ლ ვ ე ბ ა | ა ხ ლ დ ა | თ ა ნ |	131520	FEMALE
1268	11580918647405238857.wav	ავიაკომპანიებისთვის კარგად ცნობილია, რომ არსებობს მგზავრების გარკვეული ჯგუფი, რომლებიც სადმე უფრო სწრაფად და კომფორტულად მოხვედრის პრივილეგიისთვის იხდიან დიდი ოდენობით თანხებს და ისინი შესაბამის ფასებსაც აწესებენ.	ავიაკომპანიებისთვის კარგად ცნობილია რომ არსებობს მგზავრების გარკვეული ჯგუფი რომლებიც სადმე უფრო სწრაფად და კომფორტულად მოხვედრის პრივილეგიისთვის იხდიან დიდი ოდენობით თანხებს და ისინი შესაბამის ფასებსაც აწესებენ	ა ვ ი ა კ ო მ პ ა ნ ი ე ბ ი ს თ ვ ი ს | კ ა რ გ ა დ | ც ნ ო ბ ი ლ ი ა | რ ო მ | ა რ ს ე ბ ო ბ ს | მ გ ზ ა ვ რ ე ბ ი ს | გ ა რ კ ვ ე უ ლ ი | ჯ გ უ ფ ი | რ ო მ ლ ე ბ ი ც | ს ა დ მ ე | უ ფ რ ო | ს წ რ ა ფ ა დ | დ ა | კ ო მ ფ ო რ ტ უ ლ ა დ | მ ო ხ ვ ე დ რ ი ს | პ რ ი ვ ი ლ ე გ ი ი ს თ ვ ი ს | ი ხ დ ი ა ნ | დ ი დ ი | ო დ ე ნ ო ბ ი თ | თ ა ნ ხ ე ბ ს | დ ა | ი ს ი ნ ი | შ ე ს ა ბ ა მ ი ს | ფ ა ს ე ბ ს ა ც | ა წ ე ს ე ბ ე ნ |	265920	MALE
514	16910618494293094098.wav	გამომდინარე იქიდან, ცოდნის მიღების და სწავლის შესაძლებლობა შეიცვალა როგორც ეს ზემოთ იყო აღნიშნული, შესაბამისად შეიცვალა ცოდნის მიღების ძირითადი სიჩქარეც.	გამომდინარე იქიდან ცოდნის მიღების და სწავლის შესაძლებლობა შეიცვალა როგორც ეს ზემოთ იყო აღნიშნული შესაბამისად შეიცვალა ცოდნის მიღების ძირითადი სიჩქარეც	გ ა მ ო მ დ ი ნ ა რ ე | ი ქ ი დ ა ნ | ც ო დ ნ ი ს | მ ი ღ ე ბ ი ს | დ ა | ს წ ა ვ ლ ი ს | შ ე ს ა ძ ლ ე ბ ლ ო ბ ა | შ ე ი ც ვ ა ლ ა | რ ო გ ო რ ც | ე ს | ზ ე მ ო თ | ი ყ ო | ა ღ ნ ი შ ნ უ ლ ი | შ ე ს ა ბ ა მ ი ს ა დ | შ ე ი ც ვ ა ლ ა | ც ო დ ნ ი ს | მ ი ღ ე ბ ი ს | ძ ი რ ი თ ა დ ი | ს ი ჩ ქ ა რ ე ც |	178560	FEMALE
870	14469285731382022136.wav	ისეთ ადგილებში, სადაც არ იცნობთ ადგილობრივ ფაუნას, ნუ დაიძინებთ მიწაზე გაშლილ მატრასზე ან ლეიბზე.	ისეთ ადგილებში სადაც არ იცნობთ ადგილობრივ ფაუნას ნუ დაიძინებთ მიწაზე გაშლილ მატრასზე ან ლეიბზე	ი ს ე თ | ა დ გ ი ლ ე ბ შ ი | ს ა დ ა ც | ა რ | ი ც ნ ო ბ თ | ა დ გ ი ლ ო ბ რ ი ვ | ფ ა უ ნ ა ს | ნ უ | დ ა ი ძ ი ნ ე ბ თ | მ ი წ ა ზ ე | გ ა შ ლ ი ლ | მ ა ტ რ ა ს ზ ე | ა ნ | ლ ე ი ბ ზ ე |	139200	FEMALE
484	3722965324572775498.wav	მიმდევრები ცხოვრების გარკვეულ წესებს იცავენ ან პრაქტიკას მიჰყვებიან, რაც ამ გამოცდილების შემუშავებას ისახავს მიზნად.	მიმდევრები ცხოვრების გარკვეულ წესებს იცავენ ან პრაქტიკას მიჰყვებიან რაც ამ გამოცდილების შემუშავებას ისახავს მიზნად	მ ი მ დ ე ვ რ ე ბ ი | ც ხ ო ვ რ ე ბ ი ს | გ ა რ კ ვ ე უ ლ | წ ე ს ე ბ ს | ი ც ა ვ ე ნ | ა ნ | პ რ ა ქ ტ ი კ ა ს | მ ი ჰ ყ ვ ე ბ ი ა ნ | რ ა ც | ა მ | გ ა მ ო ც დ ი ლ ე ბ ი ს | შ ე მ უ შ ა ვ ე ბ ა ს | ი ს ა ხ ა ვ ს | მ ი ზ ნ ა დ |	144960	MALE
888	6718322295565893938.wav	ტურისტული მოგზაურობები ძვირი სიამოვნებაა. ფიზიკურ მომზადებას მოითხოვს. შეიძლება მხოლოდ ზაფხულში და ნოემბრიდან თებერვლამდე განხორციელდეს და ძირითადად ნახევარკუნძულით, კუნძულებით და როსის ზღვით შემოიფარგლება.	ტურისტული მოგზაურობები ძვირი სიამოვნებაა ფიზიკურ მომზადებას მოითხოვს შეიძლება მხოლოდ ზაფხულში და ნოემბრიდან თებერვლამდე განხორციელდეს და ძირითადად ნახევარკუნძულით კუნძულებით და როსის ზღვით შემოიფარგლება	ტ უ რ ი ს ტ უ ლ ი | მ ო გ ზ ა უ რ ო ბ ე ბ ი | ძ ვ ი რ ი | ს ი ა მ ო ვ ნ ე ბ ა ა | ფ ი ზ ი კ უ რ | მ ო მ ზ ა დ ე ბ ა ს | მ ო ი თ ხ ო ვ ს | შ ე ი ძ ლ ე ბ ა | მ ხ ო ლ ო დ | ზ ა ფ ხ უ ლ შ ი | დ ა | ნ ო ე მ ბ რ ი დ ა ნ | თ ე ბ ე რ ვ ლ ა მ დ ე | გ ა ნ ხ ო რ ც ი ე ლ დ ე ს | დ ა | ძ ი რ ი თ ა დ ა დ | ნ ა ხ ე ვ ა რ კ უ ნ ძ უ ლ ი თ | კ უ ნ ძ უ ლ ე ბ ი თ | დ ა | რ ო ს ი ს | ზ ღ ვ ი თ | შ ე მ ო ი ფ ა რ გ ლ ე ბ ა |	294720	FEMALE
202	6495941522525124499.wav	მისმა ნარჩენებმა გამოიწვია კოკისპირული წვიმები კუნძულების უმეტეს ნაწილში. თუმცა, ამ ეტაპზე ზიანი ან წყალდიდობა არ დაფიქსირებულა.	მისმა ნარჩენებმა გამოიწვია კოკისპირული წვიმები კუნძულების უმეტეს ნაწილში თუმცა ამ ეტაპზე ზიანი ან წყალდიდობა არ დაფიქსირებულა	მ ი ს მ ა | ნ ა რ ჩ ე ნ ე ბ მ ა | გ ა მ ო ი წ ვ ი ა | კ ო კ ი ს პ ი რ უ ლ ი | წ ვ ი მ ე ბ ი | კ უ ნ ძ უ ლ ე ბ ი ს | უ მ ე ტ ე ს | ნ ა წ ი ლ შ ი | თ უ მ ც ა | ა მ | ე ტ ა პ ზ ე | ზ ი ა ნ ი | ა ნ | წ ყ ა ლ დ ი დ ო ბ ა | ა რ | დ ა ფ ი ქ ს ი რ ე ბ უ ლ ა |	111360	MALE
418	11482995259074226948.wav	მშობლიურ ენაზე მოსაუბრეთა რაოდენობა იცვლება იმის მიხედვით, თუ რამდენად ითვლება ამ რაოდენობაში მისთვის ახლო დიალექტებიც.	მშობლიურ ენაზე მოსაუბრეთა რაოდენობა იცვლება იმის მიხედვით თუ რამდენად ითვლება ამ რაოდენობაში მისთვის ახლო დიალექტებიც	მ შ ო ბ ლ ი უ რ | ე ნ ა ზ ე | მ ო ს ა უ ბ რ ე თ ა | რ ა ო დ ე ნ ო ბ ა | ი ც ვ ლ ე ბ ა | ი მ ი ს | მ ი ხ ე დ ვ ი თ | თ უ | რ ა მ დ ე ნ ა დ | ი თ ვ ლ ე ბ ა | ა მ | რ ა ო დ ე ნ ო ბ ა შ ი | მ ი ს თ ვ ი ს | ა ხ ლ ო | დ ი ა ლ ე ქ ტ ე ბ ი ც |	180480	MALE
118	8726624199395053497.wav	ყველაზე ამრეკლავი ობიექტი მზის სისტემაში ენცელადია, ის მასზე მოხვედრილი მზის სინათლის დაახლოებით 90 პროცენტს ირეკლავს.	ყველაზე ამრეკლავი ობიექტი მზის სისტემაში ენცელადია ის მასზე მოხვედრილი მზის სინათლის დაახლოებით 90 პროცენტს ირეკლავს	ყ ვ ე ლ ა ზ ე | ა მ რ ე კ ლ ა ვ ი | ო ბ ი ე ქ ტ ი | მ ზ ი ს | ს ი ს ტ ე მ ა შ ი | ე ნ ც ე ლ ა დ ი ა | ი ს | მ ა ს ზ ე | მ ო ხ ვ ე დ რ ი ლ ი | მ ზ ი ს | ს ი ნ ა თ ლ ი ს | დ ა ა ხ ლ ო ე ბ ი თ | 9 0 | პ რ ო ც ე ნ ტ ს | ი რ ე კ ლ ა ვ ს |	195840	MALE
196	12212575323983027001.wav	2009 წლის სეზონის მიწურვამდე მასსამ რბოლაში მონაწილეობა უნდა მიიღოს.	2009 წლის სეზონის მიწურვამდე მასსამ რბოლაში მონაწილეობა უნდა მიიღოს	2 0 0 9 | წ ლ ი ს | ს ე ზ ო ნ ი ს | მ ი წ უ რ ვ ა მ დ ე | მ ა ს ს ა მ | რ ბ ო ლ ა შ ი | მ ო ნ ა წ ი ლ ე ო ბ ა | უ ნ დ ა | მ ი ი ღ ო ს |	155520	MALE
1384	8573543093538924901.wav	დესანტის გადმოსხდომამ და შემდეგმა ბრძოლებმა საფრანგეთის ჩრდილოეთი გაათავისუფლა, მაგრამ სამხრეთი კვლავ ოკუპირებული რჩებოდა.	დესანტის გადმოსხდომამ და შემდეგმა ბრძოლებმა საფრანგეთის ჩრდილოეთი გაათავისუფლა მაგრამ სამხრეთი კვლავ ოკუპირებული რჩებოდა	დ ე ს ა ნ ტ ი ს | გ ა დ მ ო ს ხ დ ო მ ა მ | დ ა | შ ე მ დ ე გ მ ა | ბ რ ძ ო ლ ე ბ მ ა | ს ა ფ რ ა ნ გ ე თ ი ს | ჩ რ დ ი ლ ო ე თ ი | გ ა ა თ ა ვ ი ს უ ფ ლ ა | მ ა გ რ ა მ | ს ა მ ხ რ ე თ ი | კ ვ ლ ა ვ | ო კ უ პ ი რ ე ბ უ ლ ი | რ ჩ ე ბ ო დ ა |	157440	FEMALE
71	5972616779237735224.wav	HK Management Inc.-მა, ჯგუფის მმართველმა კომპანიამ პირვანდელი მიზეზი არ დაასახელა, როდესაც 20 სექტემბრის კონცერტი გააუქმა, მაგრამ მომდევნო დღეს ლოგისტიკური მიზეზები დაასახელა.	hk management inc.-მა ჯგუფის მმართველმა კომპანიამ პირვანდელი მიზეზი არ დაასახელა როდესაც 20 სექტემბრის კონცერტი გააუქმა მაგრამ მომდევნო დღეს ლოგისტიკური მიზეზები დაასახელა	h k | m a n a g e m e n t | i n c . - მ ა | ჯ გ უ ფ ი ს | მ მ ა რ თ ვ ე ლ მ ა | კ ო მ პ ა ნ ი ა მ | პ ი რ ვ ა ნ დ ე ლ ი | მ ი ზ ე ზ ი | ა რ | დ ა ა ს ა ხ ე ლ ა | რ ო დ ე ს ა ც | 2 0 | ს ე ქ ტ ე მ ბ რ ი ს | კ ო ნ ც ე რ ტ ი | გ ა ა უ ქ მ ა | მ ა გ რ ა მ | მ ო მ დ ე ვ ნ ო | დ ღ ე ს | ლ ო გ ი ს ტ ი კ უ რ ი | მ ი ზ ე ზ ე ბ ი | დ ა ა ს ა ხ ე ლ ა |	233280	MALE
767	39933183155392723.wav	2022 წლის ზამთრის ოლიმპიური თამაშების მასპინძელი ქალაქი იქნება პეკინი, ჩინეთი, რითაც ის გახდება პირველი ქალაქი, რომელიც უმასპინძლებს ორივეს, ზაფხულის და ზამთრის ოლიმპიურ თამაშებს.	2022 წლის ზამთრის ოლიმპიური თამაშების მასპინძელი ქალაქი იქნება პეკინი ჩინეთი რითაც ის გახდება პირველი ქალაქი რომელიც უმასპინძლებს ორივეს ზაფხულის და ზამთრის ოლიმპიურ თამაშებს	2 0 2 2 | წ ლ ი ს | ზ ა მ თ რ ი ს | ო ლ ი მ პ ი უ რ ი | თ ა მ ა შ ე ბ ი ს | მ ა ს პ ი ნ ძ ე ლ ი | ქ ა ლ ა ქ ი | ი ქ ნ ე ბ ა | პ ე კ ი ნ ი | ჩ ი ნ ე თ ი | რ ი თ ა ც | ი ს | გ ა ხ დ ე ბ ა | პ ი რ ვ ე ლ ი | ქ ა ლ ა ქ ი | რ ო მ ე ლ ი ც | უ მ ა ს პ ი ნ ძ ლ ე ბ ს | ო რ ი ვ ე ს | ზ ა ფ ხ უ ლ ი ს | დ ა | ზ ა მ თ რ ი ს | ო ლ ი მ პ ი უ რ | თ ა მ ა შ ე ბ ს |	234240	FEMALE
1035	13777379225679212449.wav	კომეტები შესაძლოა დედამიწაზე წყლის და ორგანული ნივთიერებების მოხვედრის წყარო ყოფილიყო, რომელსაც შეუძლია ცილების შექმნა და სიცოცხლის უზრუნველყოფა საარსებო საშუალებებით.	კომეტები შესაძლოა დედამიწაზე წყლის და ორგანული ნივთიერებების მოხვედრის წყარო ყოფილიყო რომელსაც შეუძლია ცილების შექმნა და სიცოცხლის უზრუნველყოფა საარსებო საშუალებებით	კ ო მ ე ტ ე ბ ი | შ ე ს ა ძ ლ ო ა | დ ე დ ა მ ი წ ა ზ ე | წ ყ ლ ი ს | დ ა | ო რ გ ა ნ უ ლ ი | ნ ი ვ თ ი ე რ ე ბ ე ბ ი ს | მ ო ხ ვ ე დ რ ი ს | წ ყ ა რ ო | ყ ო ფ ი ლ ი ყ ო | რ ო მ ე ლ ს ა ც | შ ე უ ძ ლ ი ა | ც ი ლ ე ბ ი ს | შ ე ქ მ ნ ა | დ ა | ს ი ც ო ც ხ ლ ი ს | უ ზ რ უ ნ ვ ე ლ ყ ო ფ ა | ს ა ა რ ს ე ბ ო | ს ა შ უ ა ლ ე ბ ე ბ ი თ |	236160	FEMALE
390	3807682124873512765.wav	სანსკრიტი უძველესი ენაა. იგი შეიძლება შედარდეს ლათინურთან, რომელზეც ევროპაში საუბრობენ.	სანსკრიტი უძველესი ენაა იგი შეიძლება შედარდეს ლათინურთან რომელზეც ევროპაში საუბრობენ	ს ა ნ ს კ რ ი ტ ი | უ ძ ვ ე ლ ე ს ი | ე ნ ა ა | ი გ ი | შ ე ი ძ ლ ე ბ ა | შ ე დ ა რ დ ე ს | ლ ა თ ი ნ უ რ თ ა ნ | რ ო მ ე ლ ზ ე ც | ე ვ რ ო პ ა შ ი | ს ა უ ბ რ ო ბ ე ნ |	140160	MALE
152	7070234024648366388.wav	ნაციონალიზაციის პერიოდში, 2010 წელს, მიმდინარე ბანკი Northern Rock plc გამოეყო „ცუდ ბანკს“, როგორც Northern Rock (აქტივების მართვა).	ნაციონალიზაციის პერიოდში 2010 წელს მიმდინარე ბანკი northern rock plc გამოეყო ცუდ ბანკს  როგორც northern rock აქტივების მართვა	ნ ა ც ი ო ნ ა ლ ი ზ ა ც ი ი ს | პ ე რ ი ო დ შ ი | 2 0 1 0 | წ ე ლ ს | მ ი მ დ ი ნ ა რ ე | ბ ა ნ კ ი | n o r t h e r n | r o c k | p l c | გ ა მ ო ე ყ ო | ც უ დ | ბ ა ნ კ ს | რ ო გ ო რ ც | n o r t h e r n | r o c k | ა ქ ტ ი ვ ე ბ ი ს | მ ა რ თ ვ ა |	223680	FEMALE
