1307	1835889547146586560.wav	Byggingu píramída úr steini var haldið áfram til loka gamla konungsríkisins, en hins vegar voru aldrei byggðir jafn stórir og tæknilega háþróaðir píramídar og píramídarnir í Gísa.	byggingu píramída úr steini var haldið áfram til loka gamla konungsríkisins en hins vegar voru aldrei byggðir jafn stórir og tæknilega háþróaðir píramídar og píramídarnir í gísa	b y g g i n g u | p í r a m í d a | ú r | s t e i n i | v a r | h a l d i ð | á f r a m | t i l | l o k a | g a m l a | k o n u n g s r í k i s i n s | e n | h i n s | v e g a r | v o r u | a l d r e i | b y g g ð i r | j a f n | s t ó r i r | o g | t æ k n i l e g a | h á þ r ó a ð i r | p í r a m í d a r | o g | p í r a m í d a r n i r | í | g í s a |	246720	FEMALE
961	3054452816577716811.wav	Þetta flug er ekki eini valkosturinn ef þú vilt sleppa Suður-Kyrrahafi og vesturströnd Suður-Ameríku. (sjá hér að neðan)	þetta flug er ekki eini valkosturinn ef þú vilt sleppa suður-kyrrahafi og vesturströnd suður-ameríku. sjá hér að neðan	þ e t t a | f l u g | e r | e k k i | e i n i | v a l k o s t u r i n n | e f | þ ú | v i l t | s l e p p a | s u ð u r - k y r r a h a f i | o g | v e s t u r s t r ö n d | s u ð u r - a m e r í k u . | s j á | h é r | a ð | n e ð a n |	169920	FEMALE
120	18158773165217617538.wav	Leikurinn er byggist á síðari orrustunni um Fallujah, sem var hræðilegur bardagi á milli bandarískra og íraskra hersveita.	leikurinn er byggist á síðari orrustunni um fallujah sem var hræðilegur bardagi á milli bandarískra og íraskra hersveita	l e i k u r i n n | e r | b y g g i s t | á | s í ð a r i | o r r u s t u n n i | u m | f a l l u j a h | s e m | v a r | h r æ ð i l e g u r | b a r d a g i | á | m i l l i | b a n d a r í s k r a | o g | í r a s k r a | h e r s v e i t a |	172800	FEMALE
681	16532720110162061909.wav	Bærinn liggur rétt við fossana en þeir eru aðalaðdráttaraflið. Á þessum vinsæla áfangastað er ýmislegt hægt að gera fyrir ævintýraleitendur og tækifæri eru til að dveljast lengur fyrir þá sem vilja skoða sig um.	bærinn liggur rétt við fossana en þeir eru aðalaðdráttaraflið á þessum vinsæla áfangastað er ýmislegt hægt að gera fyrir ævintýraleitendur og tækifæri eru til að dveljast lengur fyrir þá sem vilja skoða sig um	b æ r i n n | l i g g u r | r é t t | v i ð | f o s s a n a | e n | þ e i r | e r u | a ð a l a ð d r á t t a r a f l i ð | á | þ e s s u m | v i n s æ l a | á f a n g a s t a ð | e r | ý m i s l e g t | h æ g t | a ð | g e r a | f y r i r | æ v i n t ý r a l e i t e n d u r | o g | t æ k i f æ r i | e r u | t i l | a ð | d v e l j a s t | l e n g u r | f y r i r | þ á | s e m | v i l j a | s k o ð a | s i g | u m |	211200	MALE
946	1848487979404081642.wav	Víkinigarnir notuðu vatnaleiðir í Rússlandi til að komast í Svartahafið og Kaspíahafið. Hluti þeirra leiða er enn hægt að nota. Athugið hvort sækja þurfi um sérstök leyfi, en slíkt getur verið erfitt að fá.	víkinigarnir notuðu vatnaleiðir í rússlandi til að komast í svartahafið og kaspíahafið hluti þeirra leiða er enn hægt að nota athugið hvort sækja þurfi um sérstök leyfi en slíkt getur verið erfitt að fá	v í k i n i g a r n i r | n o t u ð u | v a t n a l e i ð i r | í | r ú s s l a n d i | t i l | a ð | k o m a s t | í | s v a r t a h a f i ð | o g | k a s p í a h a f i ð | h l u t i | þ e i r r a | l e i ð a | e r | e n n | h æ g t | a ð | n o t a | a t h u g i ð | h v o r t | s æ k j a | þ u r f i | u m | s é r s t ö k | l e y f i | e n | s l í k t | g e t u r | v e r i ð | e r f i t t | a ð | f á |	241920	FEMALE
105	4481322928607244806.wav	Þær innihalda takmarkanir á fjárhagssviði og bann Evrópusambandsins við útflutningi á hráolíu, sem býr að baki 80% erlendra tekna íranska hagkerfisins.	þær innihalda takmarkanir á fjárhagssviði og bann evrópusambandsins við útflutningi á hráolíu sem býr að baki 80% erlendra tekna íranska hagkerfisins	þ æ r | i n n i h a l d a | t a k m a r k a n i r | á | f j á r h a g s s v i ð i | o g | b a n n | e v r ó p u s a m b a n d s i n s | v i ð | ú t f l u t n i n g i | á | h r á o l í u | s e m | b ý r | a ð | b a k i | 8 0 % | e r l e n d r a | t e k n a | í r a n s k a | h a g k e r f i s i n s |	228480	FEMALE
1194	15893871800891274503.wav	Schneider bar vitni í gegnum myndsendibúnað frá USAF-bækistöð í heimalandinu.	schneider bar vitni í gegnum myndsendibúnað frá usaf-bækistöð í heimalandinu	s c h n e i d e r | b a r | v i t n i | í | g e g n u m | m y n d s e n d i b ú n a ð | f r á | u s a f - b æ k i s t ö ð | í | h e i m a l a n d i n u |	167040	FEMALE
1457	699758514018537506.wav	Leikirnir hófust klukkan 10:00 í frábæru veðri og ef litið er framhjá súldarinnar um miðjan morgun, sem stytti fljótt upp, var þetta fullkominn dagur fyrir 7's rúgbý.	leikirnir hófust klukkan 10:00 í frábæru veðri og ef litið er framhjá súldarinnar um miðjan morgun sem stytti fljótt upp var þetta fullkominn dagur fyrir 7's rúgbý	l e i k i r n i r | h ó f u s t | k l u k k a n | 1 0 : 0 0 | í | f r á b æ r u | v e ð r i | o g | e f | l i t i ð | e r | f r a m h j á | s ú l d a r i n n a r | u m | m i ð j a n | m o r g u n | s e m | s t y t t i | f l j ó t t | u p p | v a r | þ e t t a | f u l l k o m i n n | d a g u r | f y r i r | 7 ' s | r ú g b ý |	233280	FEMALE
865	7352111378790356599.wav	Þar af leiðandi Delhi Belly plágan, bölvun farósins, hefnd Montezuma og fjölmargir vinir þeirra.	þar af leiðandi delhi belly plágan bölvun farósins hefnd montezuma og fjölmargir vinir þeirra	þ a r | a f | l e i ð a n d i | d e l h i | b e l l y | p l á g a n | b ö l v u n | f a r ó s i n s | h e f n d | m o n t e z u m a | o g | f j ö l m a r g i r | v i n i r | þ e i r r a |	127680	MALE
478	1842741444984138905.wav	Þegar Alexander var konungur bauðst hann til að greiða fyrir endurbyggingu hofsins en boðinu var hafnað. Síðar, eftir andlát Alexanders, var hofið endurbyggt, eða árið 323 fyrir fæðingu Krists.	þegar alexander var konungur bauðst hann til að greiða fyrir endurbyggingu hofsins en boðinu var hafnað síðar eftir andlát alexanders var hofið endurbyggt eða árið 323 fyrir fæðingu krists	þ e g a r | a l e x a n d e r | v a r | k o n u n g u r | b a u ð s t | h a n n | t i l | a ð | g r e i ð a | f y r i r | e n d u r b y g g i n g u | h o f s i n s | e n | b o ð i n u | v a r | h a f n a ð | s í ð a r | e f t i r | a n d l á t | a l e x a n d e r s | v a r | h o f i ð | e n d u r b y g g t | e ð a | á r i ð | 3 2 3 | f y r i r | f æ ð i n g u | k r i s t s |	204480	MALE
263	16699029755275479940.wav	Albert Muchanga, stjórnarmaður verslunar- og iðnaðarráðs Afríkusambandsins, tilkynnti að Benín ætlaði að taka þátt.	albert muchanga stjórnarmaður verslunar og iðnaðarráðs afríkusambandsins tilkynnti að benín ætlaði að taka þátt	a l b e r t | m u c h a n g a | s t j ó r n a r m a ð u r | v e r s l u n a r | o g | i ð n a ð a r r á ð s | a f r í k u s a m b a n d s i n s | t i l k y n n t i | a ð | b e n í n | æ t l a ð i | a ð | t a k a | þ á t t |	155520	FEMALE
18	12021645153604727337.wav	Breska dagblaðið The Guardian gaf í skyn að Deutsche Bank hefði stýrt hartnær þriðjungi þeirra 1200 skúffufyrirtækja sem notuð voru til að koma þessu í kring.	breska dagblaðið the guardian gaf í skyn að deutsche bank hefði stýrt hartnær þriðjungi þeirra 1200 skúffufyrirtækja sem notuð voru til að koma þessu í kring	b r e s k a | d a g b l a ð i ð | t h e | g u a r d i a n | g a f | í | s k y n | a ð | d e u t s c h e | b a n k | h e f ð i | s t ý r t | h a r t n æ r | þ r i ð j u n g i | þ e i r r a | 1 2 0 0 | s k ú f f u f y r i r t æ k j a | s e m | n o t u ð | v o r u | t i l | a ð | k o m a | þ e s s u | í | k r i n g |	216960	FEMALE
1142	16141559154638526270.wav	"Við munum leitast við að draga úr losun koltvísýrings á hverja einingu landsframleiðslu um verulegt magn árið 2020 miðað við það sem var 2005," sagði Hu.	við munum leitast við að draga úr losun koltvísýrings á hverja einingu landsframleiðslu um verulegt magn árið 2020 miðað við það sem var 2005 sagði hu	v i ð | m u n u m | l e i t a s t | v i ð | a ð | d r a g a | ú r | l o s u n | k o l t v í s ý r i n g s | á | h v e r j a | e i n i n g u | l a n d s f r a m l e i ð s l u | u m | v e r u l e g t | m a g n | á r i ð | 2 0 2 0 | m i ð a ð | v i ð | þ a ð | s e m | v a r | 2 0 0 5 | s a g ð i | h u |	229440	FEMALE
847	4621593064200214635.wav	Bjúgverpilskast er vinsæl iðja sem margir ferðamenn vilja ná valdi á.	bjúgverpilskast er vinsæl iðja sem margir ferðamenn vilja ná valdi á	b j ú g v e r p i l s k a s t | e r | v i n s æ l | i ð j a | s e m | m a r g i r | f e r ð a m e n n | v i l j a | n á | v a l d i | á |	89280	MALE
289	1563402556283731317.wav	„Eftirlitsbúnaðurinn myndi vissulega senda sterk skilaboð til fólks sem vinnur með dýr, um að velferð þeirra sé í forgangi."	eftirlitsbúnaðurinn myndi vissulega senda sterk skilaboð til fólks sem vinnur með dýr um að velferð þeirra sé í forgangi	e f t i r l i t s b ú n a ð u r i n n | m y n d i | v i s s u l e g a | s e n d a | s t e r k | s k i l a b o ð | t i l | f ó l k s | s e m | v i n n u r | m e ð | d ý r | u m | a ð | v e l f e r ð | þ e i r r a | s é | í | f o r g a n g i |	153600	FEMALE
1465	2039236965878734481.wav	Þetta þýðir að þú getur heimsótt sögulegu borgina á daginn og svo snúið aftur til baka á skipið til að sofa á nóttunni.	þetta þýðir að þú getur heimsótt sögulegu borgina á daginn og svo snúið aftur til baka á skipið til að sofa á nóttunni	þ e t t a | þ ý ð i r | a ð | þ ú | g e t u r | h e i m s ó t t | s ö g u l e g u | b o r g i n a | á | d a g i n n | o g | s v o | s n ú i ð | a f t u r | t i l | b a k a | á | s k i p i ð | t i l | a ð | s o f a | á | n ó t t u n n i |	124800	MALE
1	12096439779290990573.wav	Á mánudag tilkynntu vísindamenn frá læknadeild Stanford-háskóla uppfinningu á nýju greiningartæki sem getur flokkað frumur eftir tegund: örlítill prentanleg flaga sem hægt er að framleiða með venjulegum bleksprautuprentara fyrir mögulega um eitt bandarískt sent stykkið.	á mánudag tilkynntu vísindamenn frá læknadeild stanford-háskóla uppfinningu á nýju greiningartæki sem getur flokkað frumur eftir tegund örlítill prentanleg flaga sem hægt er að framleiða með venjulegum bleksprautuprentara fyrir mögulega um eitt bandarískt sent stykkið	á | m á n u d a g | t i l k y n n t u | v í s i n d a m e n n | f r á | l æ k n a d e i l d | s t a n f o r d - h á s k ó l a | u p p f i n n i n g u | á | n ý j u | g r e i n i n g a r t æ k i | s e m | g e t u r | f l o k k a ð | f r u m u r | e f t i r | t e g u n d | ö r l í t i l l | p r e n t a n l e g | f l a g a | s e m | h æ g t | e r | a ð | f r a m l e i ð a | m e ð | v e n j u l e g u m | b l e k s p r a u t u p r e n t a r a | f y r i r | m ö g u l e g a | u m | e i t t | b a n d a r í s k t | s e n t | s t y k k i ð |	236160	MALE
1399	10053528006055158568.wav	Tiil að lýsa betur flæði umferðar hafa verið skilgreind tengsl á milli þriggja helstu eiginleika umferðar: (1) flæði, (2) þéttleiki og (3) hraði.	tiil að lýsa betur flæði umferðar hafa verið skilgreind tengsl á milli þriggja helstu eiginleika umferðar: 1 flæði 2 þéttleiki og 3 hraði	t i i l | a ð | l ý s a | b e t u r | f l æ ð i | u m f e r ð a r | h a f a | v e r i ð | s k i l g r e i n d | t e n g s l | á | m i l l i | þ r i g g j a | h e l s t u | e i g i n l e i k a | u m f e r ð a r : | 1 | f l æ ð i | 2 | þ é t t l e i k i | o g | 3 | h r a ð i |	202560	FEMALE
1128	2497494334356118101.wav	Yfirvöld telja þetta vísbendingu um að tankar á staðnum sem innihalda úraneldsneyti séu hugsanlega að leka.	yfirvöld telja þetta vísbendingu um að tankar á staðnum sem innihalda úraneldsneyti séu hugsanlega að leka	y f i r v ö l d | t e l j a | þ e t t a | v í s b e n d i n g u | u m | a ð | t a n k a r | á | s t a ð n u m | s e m | i n n i h a l d a | ú r a n e l d s n e y t i | s é u | h u g s a n l e g a | a ð | l e k a |	140160	MALE
135	12108991698514406176.wav	Litaður sjór vegna mergðar skoruþörunga orsakast af óeðlilega háum styrk Karenia brevis, einfrumunga í sjó.	litaður sjór vegna mergðar skoruþörunga orsakast af óeðlilega háum styrk karenia brevis einfrumunga í sjó	l i t a ð u r | s j ó r | v e g n a | m e r g ð a r | s k o r u þ ö r u n g a | o r s a k a s t | a f | ó e ð l i l e g a | h á u m | s t y r k | k a r e n i a | b r e v i s | e i n f r u m u n g a | í | s j ó |	202560	FEMALE
1181	16030411036621083866.wav	Upphaf Taívan má rekja aftur á 15. öld þegar evrópskir sjómenn sem áttu leið hjá skrásettu nafn eyjunnar sem Ilha Formosa, eða falleg eyja.	upphaf taívan má rekja aftur á 15. öld þegar evrópskir sjómenn sem áttu leið hjá skrásettu nafn eyjunnar sem ilha formosa eða falleg eyja	u p p h a f | t a í v a n | m á | r e k j a | a f t u r | á | 1 5 . | ö l d | þ e g a r | e v r ó p s k i r | s j ó m e n n | s e m | á t t u | l e i ð | h j á | s k r á s e t t u | n a f n | e y j u n n a r | s e m | i l h a | f o r m o s a | e ð a | f a l l e g | e y j a |	155520	MALE
368	4734698515758987781.wav	Blóð flæðir frá hjartanu í gegnum pípur sem kallast slagæðar og flæðir aftur til hjartans í pípum sem kallast bláæðar. Minnstu pípurnar eru kallaðar háræðar.	blóð flæðir frá hjartanu í gegnum pípur sem kallast slagæðar og flæðir aftur til hjartans í pípum sem kallast bláæðar minnstu pípurnar eru kallaðar háræðar	b l ó ð | f l æ ð i r | f r á | h j a r t a n u | í | g e g n u m | p í p u r | s e m | k a l l a s t | s l a g æ ð a r | o g | f l æ ð i r | a f t u r | t i l | h j a r t a n s | í | p í p u m | s e m | k a l l a s t | b l á æ ð a r | m i n n s t u | p í p u r n a r | e r u | k a l l a ð a r | h á r æ ð a r |	229440	FEMALE
367	3098867947219082017.wav	Aðallíffæri blóðrásarkerfisins er hjartað sem dælir blóðinu.	aðallíffæri blóðrásarkerfisins er hjartað sem dælir blóðinu	a ð a l l í f f æ r i | b l ó ð r á s a r k e r f i s i n s | e r | h j a r t a ð | s e m | d æ l i r | b l ó ð i n u |	95040	FEMALE
94	18254927460221491595.wav	Þetta stangast á við fyrri fregnir sem sögðu að ef hætta yrði við viðbótarumferðina væri það brot gegn stjórnarskránni.	þetta stangast á við fyrri fregnir sem sögðu að ef hætta yrði við viðbótarumferðina væri það brot gegn stjórnarskránni	þ e t t a | s t a n g a s t | á | v i ð | f y r r i | f r e g n i r | s e m | s ö g ð u | a ð | e f | h æ t t a | y r ð i | v i ð | v i ð b ó t a r u m f e r ð i n a | v æ r i | þ a ð | b r o t | g e g n | s t j ó r n a r s k r á n n i |	195840	FEMALE
1089	1071383882758491538.wav	Prófaðu að nota hárblásara, ef hann er til taks, ef þú átt ekki straujárn eða ef þú vilt ekki ganga um í straujuðum sokkum.	prófaðu að nota hárblásara ef hann er til taks ef þú átt ekki straujárn eða ef þú vilt ekki ganga um í straujuðum sokkum	p r ó f a ð u | a ð | n o t a | h á r b l á s a r a | e f | h a n n | e r | t i l | t a k s | e f | þ ú | á t t | e k k i | s t r a u j á r n | e ð a | e f | þ ú | v i l t | e k k i | g a n g a | u m | í | s t r a u j u ð u m | s o k k u m |	188160	FEMALE
241	1226173168411574588.wav	Póstþjónustan gaf í gær út afsökunarbeiðni til íbúa og fjölmiðla þegar upp komst að drengurinn hafði falið meira en 600 póstsendingar, þeirra á meðal 429 nýárskort, sem ekki voru afhent fyrirhuguðum viðtakendum þeirra.	póstþjónustan gaf í gær út afsökunarbeiðni til íbúa og fjölmiðla þegar upp komst að drengurinn hafði falið meira en 600 póstsendingar þeirra á meðal 429 nýárskort sem ekki voru afhent fyrirhuguðum viðtakendum þeirra	p ó s t þ j ó n u s t a n | g a f | í | g æ r | ú t | a f s ö k u n a r b e i ð n i | t i l | í b ú a | o g | f j ö l m i ð l a | þ e g a r | u p p | k o m s t | a ð | d r e n g u r i n n | h a f ð i | f a l i ð | m e i r a | e n | 6 0 0 | p ó s t s e n d i n g a r | þ e i r r a | á | m e ð a l | 4 2 9 | n ý á r s k o r t | s e m | e k k i | v o r u | a f h e n t | f y r i r h u g u ð u m | v i ð t a k e n d u m | þ e i r r a |	292800	FEMALE
250	13132943436370898094.wav	Byggingin hýsti fjölda pílagríma sem komu til að heimsækja borgina helgu í aðdraganda hajj-pílagrímsferðar.	byggingin hýsti fjölda pílagríma sem komu til að heimsækja borgina helgu í aðdraganda hajj-pílagrímsferðar	b y g g i n g i n | h ý s t i | f j ö l d a | p í l a g r í m a | s e m | k o m u | t i l | a ð | h e i m s æ k j a | b o r g i n a | h e l g u | í | a ð d r a g a n d a | h a j j - p í l a g r í m s f e r ð a r |	181440	FEMALE
529	6686772205687373292.wav	Nútímaskylmingar eru leiknar á mörgum stigum, allt frá nemendum sem læra í háskóla til atvinnu- og ólympíukeppni.	nútímaskylmingar eru leiknar á mörgum stigum allt frá nemendum sem læra í háskóla til atvinnu og ólympíukeppni	n ú t í m a s k y l m i n g a r | e r u | l e i k n a r | á | m ö r g u m | s t i g u m | a l l t | f r á | n e m e n d u m | s e m | l æ r a | í | h á s k ó l a | t i l | a t v i n n u | o g | ó l y m p í u k e p p n i |	192000	FEMALE
1006	1649181381079106702.wav	Hvert hof var með opinn hofgarð og síðan innri helgistað sem aðeins prestar máttu fara inn í.	hvert hof var með opinn hofgarð og síðan innri helgistað sem aðeins prestar máttu fara inn í	h v e r t | h o f | v a r | m e ð | o p i n n | h o f g a r ð | o g | s í ð a n | i n n r i | h e l g i s t a ð | s e m | a ð e i n s | p r e s t a r | m á t t u | f a r a | i n n | í |	131520	FEMALE
1170	16407669836634611664.wav	Við lítum svo á að fósturforeldrakerfið sé öryggissvæði fyrir þessi börn.	við lítum svo á að fósturforeldrakerfið sé öryggissvæði fyrir þessi börn	v i ð | l í t u m | s v o | á | a ð | f ó s t u r f o r e l d r a k e r f i ð | s é | ö r y g g i s s v æ ð i | f y r i r | þ e s s i | b ö r n |	92160	FEMALE
830	16779146581282271565.wav	Útlendingaeftirlit er yfirleitt fyrsta skoðunin þegar gengið er frá borði við komu með flugvél, skipi eða öðrum farartækjum.	útlendingaeftirlit er yfirleitt fyrsta skoðunin þegar gengið er frá borði við komu með flugvél skipi eða öðrum farartækjum	ú t l e n d i n g a e f t i r l i t | e r | y f i r l e i t t | f y r s t a | s k o ð u n i n | þ e g a r | g e n g i ð | e r | f r á | b o r ð i | v i ð | k o m u | m e ð | f l u g v é l | s k i p i | e ð a | ö ð r u m | f a r a r t æ k j u m |	155520	FEMALE
1344	3892521767175364726.wav	Ljón, blettatígrar og hlébarðar eru stundum feimnir og maður sér þá betur með sjónaukum.	ljón blettatígrar og hlébarðar eru stundum feimnir og maður sér þá betur með sjónaukum	l j ó n | b l e t t a t í g r a r | o g | h l é b a r ð a r | e r u | s t u n d u m | f e i m n i r | o g | m a ð u r | s é r | þ á | b e t u r | m e ð | s j ó n a u k u m |	156480	FEMALE
3	13429760750220241282.wav	JAS 39C Gripen-flugvélin brotlenti á flugbraut um klukkan 9:30 að staðartíma (02:30 UTC). Hún sprakk og lokað var á allt áætlunarflug á flugvellinum.	jas 39c gripen-flugvélin brotlenti á flugbraut um klukkan 9:30 að staðartíma 02:30 utc. hún sprakk og lokað var á allt áætlunarflug á flugvellinum	j a s | 3 9 c | g r i p e n - f l u g v é l i n | b r o t l e n t i | á | f l u g b r a u t | u m | k l u k k a n | 9 : 3 0 | a ð | s t a ð a r t í m a | 0 2 : 3 0 | u t c . | h ú n | s p r a k k | o g | l o k a ð | v a r | á | a l l t | á æ t l u n a r f l u g | á | f l u g v e l l i n u m |	240960	FEMALE
1451	15399492904733359297.wav	Samtímis var þýski sjóherinn, sem notaðist að mestu við kafbáta, að reyna að stöðva þessa flutninga.	samtímis var þýski sjóherinn sem notaðist að mestu við kafbáta að reyna að stöðva þessa flutninga	s a m t í m i s | v a r | þ ý s k i | s j ó h e r i n n | s e m | n o t a ð i s t | a ð | m e s t u | v i ð | k a f b á t a | a ð | r e y n a | a ð | s t ö ð v a | þ e s s a | f l u t n i n g a |	100800	MALE
1090	5892368225367747674.wav	Mótmælin, sem voru stundum með ofbeldi, fóru af stað vegna þess að kosningar voru ekki haldnar, ákveðnar kosningar áttu að fara fram árið 2011.	mótmælin sem voru stundum með ofbeldi fóru af stað vegna þess að kosningar voru ekki haldnar ákveðnar kosningar áttu að fara fram árið 2011	m ó t m æ l i n | s e m | v o r u | s t u n d u m | m e ð | o f b e l d i | f ó r u | a f | s t a ð | v e g n a | þ e s s | a ð | k o s n i n g a r | v o r u | e k k i | h a l d n a r | á k v e ð n a r | k o s n i n g a r | á t t u | a ð | f a r a | f r a m | á r i ð | 2 0 1 1 |	215040	FEMALE
129	9257771299169589196.wav	Listræni atburðurinn er líka hluti af herferð ráðhúss Búkarest þar sem markmiðið er að skapa að nýju ímynd rúmensku höfuðborgarinnar sem skapandi og litríkar stórborgar.	listræni atburðurinn er líka hluti af herferð ráðhúss búkarest þar sem markmiðið er að skapa að nýju ímynd rúmensku höfuðborgarinnar sem skapandi og litríkar stórborgar	l i s t r æ n i | a t b u r ð u r i n n | e r | l í k a | h l u t i | a f | h e r f e r ð | r á ð h ú s s | b ú k a r e s t | þ a r | s e m | m a r k m i ð i ð | e r | a ð | s k a p a | a ð | n ý j u | í m y n d | r ú m e n s k u | h ö f u ð b o r g a r i n n a r | s e m | s k a p a n d i | o g | l i t r í k a r | s t ó r b o r g a r |	248640	FEMALE
892	14775864759909175839.wav	South Pole Traverse (eða Highway) er 1600 km leið frá McMurdo-stöðinni við Rosshaf á Pólinn.	south pole traverse eða highway er 1600 km leið frá mcmurdo-stöðinni við rosshaf á pólinn	s o u t h | p o l e | t r a v e r s e | e ð a | h i g h w a y | e r | 1 6 0 0 | k m | l e i ð | f r á | m c m u r d o - s t ö ð i n n i | v i ð | r o s s h a f | á | p ó l i n n |	130560	MALE
383	6051040382556255310.wav	Ethelred þurfti hins vegar að mæta víkingaflota árið 991 sem var stærri en nokkur annar floti frá því við Guthrum einni öld áður.	ethelred þurfti hins vegar að mæta víkingaflota árið 991 sem var stærri en nokkur annar floti frá því við guthrum einni öld áður	e t h e l r e d | þ u r f t i | h i n s | v e g a r | a ð | m æ t a | v í k i n g a f l o t a | á r i ð | 9 9 1 | s e m | v a r | s t æ r r i | e n | n o k k u r | a n n a r | f l o t i | f r á | þ v í | v i ð | g u t h r u m | e i n n i | ö l d | á ð u r |	214080	FEMALE
799	371042592674008763.wav	Láttu líka ferðafélaga fá afrit af reglunum/tengiliðaupplýsingum eða deildu þeim með vinum og vandamönnum heima við sem vilja hjálpa til.	láttu líka ferðafélaga fá afrit af reglunum/tengiliðaupplýsingum eða deildu þeim með vinum og vandamönnum heima við sem vilja hjálpa til	l á t t u | l í k a | f e r ð a f é l a g a | f á | a f r i t | a f | r e g l u n u m / t e n g i l i ð a u p p l ý s i n g u m | e ð a | d e i l d u | þ e i m | m e ð | v i n u m | o g | v a n d a m ö n n u m | h e i m a | v i ð | s e m | v i l j a | h j á l p a | t i l |	158400	FEMALE
1334	3155692457220210942.wav	Það er auðveldlega hægt að gera með því að nota tiltölulega hljóðláta vekjaraklukku til að koma þér til meðvitundar án þess að vekja þig að fullu.	það er auðveldlega hægt að gera með því að nota tiltölulega hljóðláta vekjaraklukku til að koma þér til meðvitundar án þess að vekja þig að fullu	þ a ð | e r | a u ð v e l d l e g a | h æ g t | a ð | g e r a | m e ð | þ v í | a ð | n o t a | t i l t ö l u l e g a | h l j ó ð l á t a | v e k j a r a k l u k k u | t i l | a ð | k o m a | þ é r | t i l | m e ð v i t u n d a r | á n | þ e s s | a ð | v e k j a | þ i g | a ð | f u l l u |	187200	FEMALE
264	1652816987311697472.wav	Framkvæmdastjórinn sagði: "Við höfum ekki enn samþykkt reglur um uppruna og gjaldskrár, en ramminn sem við höfum er nægur til að hefja viðskipti 1. júlí 2020".	framkvæmdastjórinn sagði við höfum ekki enn samþykkt reglur um uppruna og gjaldskrár en ramminn sem við höfum er nægur til að hefja viðskipti 1. júlí 2020	f r a m k v æ m d a s t j ó r i n n | s a g ð i | v i ð | h ö f u m | e k k i | e n n | s a m þ y k k t | r e g l u r | u m | u p p r u n a | o g | g j a l d s k r á r | e n | r a m m i n n | s e m | v i ð | h ö f u m | e r | n æ g u r | t i l | a ð | h e f j a | v i ð s k i p t i | 1 . | j ú l í | 2 0 2 0 |	264960	FEMALE
