6	5762351627126232718.wav	Hinn 28 ára gamli Vidal gekk til liðs við Barcelona frá Sevilla fyrir þremur keppnistímabilum.	hinn 28 ára gamli vidal gekk til liðs við barcelona frá sevilla fyrir þremur keppnistímabilum	h i n n | 2 8 | á r a | g a m l i | v i d a l | g e k k | t i l | l i ð s | v i ð | b a r c e l o n a | f r á | s e v i l l a | f y r i r | þ r e m u r | k e p p n i s t í m a b i l u m |	131520	FEMALE
374	16936398256913701337.wav	Hvernig myndi aðdráttarafl Io toga í mig? Ef þú myndir standa á yfirborði Io myndir þú vega minna en á Jörðinni.	hvernig myndi aðdráttarafl io toga í mig ef þú myndir standa á yfirborði io myndir þú vega minna en á jörðinni	h v e r n i g | m y n d i | a ð d r á t t a r a f l | i o | t o g a | í | m i g | e f | þ ú | m y n d i r | s t a n d a | á | y f i r b o r ð i | i o | m y n d i r | þ ú | v e g a | m i n n a | e n | á | j ö r ð i n n i |	148800	FEMALE
189	4323694939618746600.wav	Aðfaranótt 9. ágúst var fellibylurinn Morakot um sjötíu kílómetra frá kínverska héraðinu Fujian.	aðfaranótt 9. ágúst var fellibylurinn morakot um sjötíu kílómetra frá kínverska héraðinu fujian	a ð f a r a n ó t t | 9 . | á g ú s t | v a r | f e l l i b y l u r i n n | m o r a k o t | u m | s j ö t í u | k í l ó m e t r a | f r á | k í n v e r s k a | h é r a ð i n u | f u j i a n |	168000	FEMALE
1066	1318860204890704780.wav	Þó við hefðum kannast við flest af mat þeirra, áttu Rómverjar sér líka nokkuð af óvenjulegum veislumat, meðal annars villigölt, páfugl, snigla og eitt nagdýr sem heitir svefnmús.	þó við hefðum kannast við flest af mat þeirra áttu rómverjar sér líka nokkuð af óvenjulegum veislumat meðal annars villigölt páfugl snigla og eitt nagdýr sem heitir svefnmús	þ ó | v i ð | h e f ð u m | k a n n a s t | v i ð | f l e s t | a f | m a t | þ e i r r a | á t t u | r ó m v e r j a r | s é r | l í k a | n o k k u ð | a f | ó v e n j u l e g u m | v e i s l u m a t | m e ð a l | a n n a r s | v i l l i g ö l t | p á f u g l | s n i g l a | o g | e i t t | n a g d ý r | s e m | h e i t i r | s v e f n m ú s |	187200	MALE
1399	10081031016848653570.wav	Tiil að lýsa betur flæði umferðar hafa verið skilgreind tengsl á milli þriggja helstu eiginleika umferðar: (1) flæði, (2) þéttleiki og (3) hraði.	tiil að lýsa betur flæði umferðar hafa verið skilgreind tengsl á milli þriggja helstu eiginleika umferðar: 1 flæði 2 þéttleiki og 3 hraði	t i i l | a ð | l ý s a | b e t u r | f l æ ð i | u m f e r ð a r | h a f a | v e r i ð | s k i l g r e i n d | t e n g s l | á | m i l l i | þ r i g g j a | h e l s t u | e i g i n l e i k a | u m f e r ð a r : | 1 | f l æ ð i | 2 | þ é t t l e i k i | o g | 3 | h r a ð i |	216960	FEMALE
100	7383245879503182663.wav	Við prófun á brunakerfi kom upp aflskortur sem leiddi til þess að öryggislokar opnuðust og jarðolía flæddi yfir í nágrenni dælustöðvar 9 í Fort Greely.	við prófun á brunakerfi kom upp aflskortur sem leiddi til þess að öryggislokar opnuðust og jarðolía flæddi yfir í nágrenni dælustöðvar 9 í fort greely	v i ð | p r ó f u n | á | b r u n a k e r f i | k o m | u p p | a f l s k o r t u r | s e m | l e i d d i | t i l | þ e s s | a ð | ö r y g g i s l o k a r | o p n u ð u s t | o g | j a r ð o l í a | f l æ d d i | y f i r | í | n á g r e n n i | d æ l u s t ö ð v a r | 9 | í | f o r t | g r e e l y |	217920	FEMALE
209	17883678760481027885.wav	Fréttir herma að sprenging hafi orðið í íbúð á Macbeth Street vegna gasleka.	fréttir herma að sprenging hafi orðið í íbúð á macbeth street vegna gasleka	f r é t t i r | h e r m a | a ð | s p r e n g i n g | h a f i | o r ð i ð | í | í b ú ð | á | m a c b e t h | s t r e e t | v e g n a | g a s l e k a |	152640	FEMALE
719	11099849876786589838.wav	Síle lýsti yfir sjálfstæði árið 1810 (í miðjum Napóleónsstríðunum þegar engin ríkisstjórn var á Spáni) en lokasigurinn á móti Spánverjunum vannst ekki fyrr en árið 1818.	síle lýsti yfir sjálfstæði árið 1810 í miðjum napóleónsstríðunum þegar engin ríkisstjórn var á spáni en lokasigurinn á móti spánverjunum vannst ekki fyrr en árið 1818	s í l e | l ý s t i | y f i r | s j á l f s t æ ð i | á r i ð | 1 8 1 0 | í | m i ð j u m | n a p ó l e ó n s s t r í ð u n u m | þ e g a r | e n g i n | r í k i s s t j ó r n | v a r | á | s p á n i | e n | l o k a s i g u r i n n | á | m ó t i | s p á n v e r j u n u m | v a n n s t | e k k i | f y r r | e n | á r i ð | 1 8 1 8 |	224640	FEMALE
394	13813258420162200762.wav	Þýskaland gaf árásinni heitið „Aðgerðin sæljón“. Þungavopn og birgðir breska hersins höfðu tapast að mestu leyti þegar hann yfirgaf Dunkirk, þannig að herinn var frekar veikburða.	þýskaland gaf árásinni heitið aðgerðin sæljón þungavopn og birgðir breska hersins höfðu tapast að mestu leyti þegar hann yfirgaf dunkirk þannig að herinn var frekar veikburða	þ ý s k a l a n d | g a f | á r á s i n n i | h e i t i ð | a ð g e r ð i n | s æ l j ó n | þ u n g a v o p n | o g | b i r g ð i r | b r e s k a | h e r s i n s | h ö f ð u | t a p a s t | a ð | m e s t u | l e y t i | þ e g a r | h a n n | y f i r g a f | d u n k i r k | þ a n n i g | a ð | h e r i n n | v a r | f r e k a r | v e i k b u r ð a |	262080	FEMALE
1500	11851616114073547702.wav	Lífsklukkur eru sjálfstæðar sveiflur sem halda áfram reglubundnum takti jafnvel án ytra áreitis.	lífsklukkur eru sjálfstæðar sveiflur sem halda áfram reglubundnum takti jafnvel án ytra áreitis	l í f s k l u k k u r | e r u | s j á l f s t æ ð a r | s v e i f l u r | s e m | h a l d a | á f r a m | r e g l u b u n d n u m | t a k t i | j a f n v e l | á n | y t r a | á r e i t i s |	144000	FEMALE
409	16091818533005432688.wav	Hann varð hins vegar heimsfrægur þegar grafhvelfing hans var uppgötvuð árið 1922. Mýmargar grafhvelfingar voru rændar í fyrndinni en grafhvelfing hans var nánast ósnert.	hann varð hins vegar heimsfrægur þegar grafhvelfing hans var uppgötvuð árið 1922. mýmargar grafhvelfingar voru rændar í fyrndinni en grafhvelfing hans var nánast ósnert	h a n n | v a r ð | h i n s | v e g a r | h e i m s f r æ g u r | þ e g a r | g r a f h v e l f i n g | h a n s | v a r | u p p g ö t v u ð | á r i ð | 1 9 2 2 . | m ý m a r g a r | g r a f h v e l f i n g a r | v o r u | r æ n d a r | í | f y r n d i n n i | e n | g r a f h v e l f i n g | h a n s | v a r | n á n a s t | ó s n e r t |	268800	FEMALE
395	7804728880624045722.wav	En breski sjóherinn var samt mun sterkari en sá þýski („Kriegsmarine“) og hefði getað grandað hvers kyns innrásarflota sem kæmi frá Ermasundinu.	en breski sjóherinn var samt mun sterkari en sá þýski kriegsmarine  og hefði getað grandað hvers kyns innrásarflota sem kæmi frá ermasundinu	e n | b r e s k i | s j ó h e r i n n | v a r | s a m t | m u n | s t e r k a r i | e n | s á | þ ý s k i | k r i e g s m a r i n e | o g | h e f ð i | g e t a ð | g r a n d a ð | h v e r s | k y n s | i n n r á s a r f l o t a | s e m | k æ m i | f r á | e r m a s u n d i n u |	237120	FEMALE
452	862599838093871601.wav	Að læra að búa til gagnvirka miðla krefst hefðbundinnar sem og verkfæra sem lærð eru í gagnvirkum tímum (söguborð, hljóð- og myndvinnsla, frásögn o.s.frv.)	að læra að búa til gagnvirka miðla krefst hefðbundinnar sem og verkfæra sem lærð eru í gagnvirkum tímum söguborð hljóð- og myndvinnsla frásögn o.s.frv.	a ð | l æ r a | a ð | b ú a | t i l | g a g n v i r k a | m i ð l a | k r e f s t | h e f ð b u n d i n n a r | s e m | o g | v e r k f æ r a | s e m | l æ r ð | e r u | í | g a g n v i r k u m | t í m u m | s ö g u b o r ð | h l j ó ð - | o g | m y n d v i n n s l a | f r á s ö g n | o . s . f r v . |	218880	FEMALE
1388	4647331039645527792.wav	Söngkonan Sanju Sharma hóf kvöldið og eftir það fylgdi Jai Shankar Choudhary. Kynnti einnig chhappan bhog bhajan. Söngvarinn, Raju Khandelwal, kom fram með honum.	söngkonan sanju sharma hóf kvöldið og eftir það fylgdi jai shankar choudhary kynnti einnig chhappan bhog bhajan söngvarinn raju khandelwal kom fram með honum	s ö n g k o n a n | s a n j u | s h a r m a | h ó f | k v ö l d i ð | o g | e f t i r | þ a ð | f y l g d i | j a i | s h a n k a r | c h o u d h a r y | k y n n t i | e i n n i g | c h h a p p a n | b h o g | b h a j a n | s ö n g v a r i n n | r a j u | k h a n d e l w a l | k o m | f r a m | m e ð | h o n u m |	266880	FEMALE
312	433815367110229335.wav	Parið gifti sig í Texas fyrir einu ári og ferðaðist til Buffalo til að halda upp á tilefnið með vinum og vandamönnum.	parið gifti sig í texas fyrir einu ári og ferðaðist til buffalo til að halda upp á tilefnið með vinum og vandamönnum	p a r i ð | g i f t i | s i g | í | t e x a s | f y r i r | e i n u | á r i | o g | f e r ð a ð i s t | t i l | b u f f a l o | t i l | a ð | h a l d a | u p p | á | t i l e f n i ð | m e ð | v i n u m | o g | v a n d a m ö n n u m |	130560	FEMALE
526	17481108713643409135.wav	Það gekk ekki vel hjá Ítölum í Norður-Afríku nánast frá upphafi. Innan viku frá stríðsyfirlýsingu Ítalíu 10. júní 1940 höfðu meðlimir í  11. bresku Húsarahreyfingunni lagt hald á Capuzzo-virkið í Líbíu.	það gekk ekki vel hjá ítölum í norður-afríku nánast frá upphafi innan viku frá stríðsyfirlýsingu ítalíu 10. júní 1940 höfðu meðlimir í 11. bresku húsarahreyfingunni lagt hald á capuzzo-virkið í líbíu	þ a ð | g e k k | e k k i | v e l | h j á | í t ö l u m | í | n o r ð u r - a f r í k u | n á n a s t | f r á | u p p h a f i | i n n a n | v i k u | f r á | s t r í ð s y f i r l ý s i n g u | í t a l í u | 1 0 . | j ú n í | 1 9 4 0 | h ö f ð u | m e ð l i m i r | í | 1 1 . | b r e s k u | h ú s a r a h r e y f i n g u n n i | l a g t | h a l d | á | c a p u z z o - v i r k i ð | í | l í b í u |	335040	FEMALE
811	18199120674063847935.wav	Gljúfraferð sameinar sundiðkun, klifur og dýfingar -- en krefst lítillar þjálfunar eða líkamlegs atgervis til að koma sér af stað (í samanburði við klettaklifur, köfun eða skíðaiðkun sem dæmi).	gljúfraferð sameinar sundiðkun klifur og dýfingar -- en krefst lítillar þjálfunar eða líkamlegs atgervis til að koma sér af stað í samanburði við klettaklifur köfun eða skíðaiðkun sem dæmi	g l j ú f r a f e r ð | s a m e i n a r | s u n d i ð k u n | k l i f u r | o g | d ý f i n g a r | - - | e n | k r e f s t | l í t i l l a r | þ j á l f u n a r | e ð a | l í k a m l e g s | a t g e r v i s | t i l | a ð | k o m a | s é r | a f | s t a ð | í | s a m a n b u r ð i | v i ð | k l e t t a k l i f u r | k ö f u n | e ð a | s k í ð a i ð k u n | s e m | d æ m i |	272640	FEMALE
167	17357049733925988860.wav	Njósnir og upplýsingaöflun David Headley hjálpaði til við að hrinda af stað aðgerð tíu vígamanna frá herskáum hópi Laskhar-e-Taiba frá Pakistan.	njósnir og upplýsingaöflun david headley hjálpaði til við að hrinda af stað aðgerð tíu vígamanna frá herskáum hópi laskhar-e-taiba frá pakistan	n j ó s n i r | o g | u p p l ý s i n g a ö f l u n | d a v i d | h e a d l e y | h j á l p a ð i | t i l | v i ð | a ð | h r i n d a | a f | s t a ð | a ð g e r ð | t í u | v í g a m a n n a | f r á | h e r s k á u m | h ó p i | l a s k h a r - e - t a i b a | f r á | p a k i s t a n |	162240	MALE
424	211971695028103593.wav	Eftir því sem á leið runnu mörg tökuorð úr þýsku saman við málið. Þetta var upphafið að upplýsingarstefnunni.	eftir því sem á leið runnu mörg tökuorð úr þýsku saman við málið þetta var upphafið að upplýsingarstefnunni	e f t i r | þ v í | s e m | á | l e i ð | r u n n u | m ö r g | t ö k u o r ð | ú r | þ ý s k u | s a m a n | v i ð | m á l i ð | þ e t t a | v a r | u p p h a f i ð | a ð | u p p l ý s i n g a r s t e f n u n n i |	120960	MALE
368	6481688736544314541.wav	Blóð flæðir frá hjartanu í gegnum pípur sem kallast slagæðar og flæðir aftur til hjartans í pípum sem kallast bláæðar. Minnstu pípurnar eru kallaðar háræðar.	blóð flæðir frá hjartanu í gegnum pípur sem kallast slagæðar og flæðir aftur til hjartans í pípum sem kallast bláæðar minnstu pípurnar eru kallaðar háræðar	b l ó ð | f l æ ð i r | f r á | h j a r t a n u | í | g e g n u m | p í p u r | s e m | k a l l a s t | s l a g æ ð a r | o g | f l æ ð i r | a f t u r | t i l | h j a r t a n s | í | p í p u m | s e m | k a l l a s t | b l á æ ð a r | m i n n s t u | p í p u r n a r | e r u | k a l l a ð a r | h á r æ ð a r |	191040	FEMALE
130	14966052977425057654.wav	Borgin verður sú fyrsta í suðaustur Evrópu sem heldur CowParade, stærsta opinbera listviðburð heims, í júní til ágúst á þessu ári.	borgin verður sú fyrsta í suðaustur evrópu sem heldur cowparade stærsta opinbera listviðburð heims í júní til ágúst á þessu ári	b o r g i n | v e r ð u r | s ú | f y r s t a | í | s u ð a u s t u r | e v r ó p u | s e m | h e l d u r | c o w p a r a d e | s t æ r s t a | o p i n b e r a | l i s t v i ð b u r ð | h e i m s | í | j ú n í | t i l | á g ú s t | á | þ e s s u | á r i |	179520	FEMALE
411	8983579336964427707.wav	Uppfinning teinahjóla hafði í för með sér að vagnar Assýríu urðu ekki eins þungir, ekki eins hægfara og gátu betur farið fram úr hermönnum og öðrum vögnum.	uppfinning teinahjóla hafði í för með sér að vagnar assýríu urðu ekki eins þungir ekki eins hægfara og gátu betur farið fram úr hermönnum og öðrum vögnum	u p p f i n n i n g | t e i n a h j ó l a | h a f ð i | í | f ö r | m e ð | s é r | a ð | v a g n a r | a s s ý r í u | u r ð u | e k k i | e i n s | þ u n g i r | e k k i | e i n s | h æ g f a r a | o g | g á t u | b e t u r | f a r i ð | f r a m | ú r | h e r m ö n n u m | o g | ö ð r u m | v ö g n u m |	209280	FEMALE
1452	5319544536192353849.wav	Ein helsta kenning kristinna manna er að auðæfi eigi að nota til að draga úr þjáningum og fátækt og að peningasjóðir kirkjunnar séu til staðar einkum vegna þess.	ein helsta kenning kristinna manna er að auðæfi eigi að nota til að draga úr þjáningum og fátækt og að peningasjóðir kirkjunnar séu til staðar einkum vegna þess	e i n | h e l s t a | k e n n i n g | k r i s t i n n a | m a n n a | e r | a ð | a u ð æ f i | e i g i | a ð | n o t a | t i l | a ð | d r a g a | ú r | þ j á n i n g u m | o g | f á t æ k t | o g | a ð | p e n i n g a s j ó ð i r | k i r k j u n n a r | s é u | t i l | s t a ð a r | e i n k u m | v e g n a | þ e s s |	216960	FEMALE
1266	12939044498304553148.wav	Þó mörg dýranna í garðinu séu vön því að sjá menn, eru villt dýr engu að síður villt og það má ekki gefa þeim að éta eða trufla þau.	þó mörg dýranna í garðinu séu vön því að sjá menn eru villt dýr engu að síður villt og það má ekki gefa þeim að éta eða trufla þau	þ ó | m ö r g | d ý r a n n a | í | g a r ð i n u | s é u | v ö n | þ v í | a ð | s j á | m e n n | e r u | v i l l t | d ý r | e n g u | a ð | s í ð u r | v i l l t | o g | þ a ð | m á | e k k i | g e f a | þ e i m | a ð | é t a | e ð a | t r u f l a | þ a u |	179520	FEMALE
53	15093882947175656159.wav	Fulltrúinn ákveður trygginguna, ef hún er veitt, og formfestir ákærurnar sem sá sem handtók lagði fram. Ákærurnar eru síðan færðar inn í ríkistölvukerfið þar sem málið er rakið.	fulltrúinn ákveður trygginguna ef hún er veitt og formfestir ákærurnar sem sá sem handtók lagði fram ákærurnar eru síðan færðar inn í ríkistölvukerfið þar sem málið er rakið	f u l l t r ú i n n | á k v e ð u r | t r y g g i n g u n a | e f | h ú n | e r | v e i t t | o g | f o r m f e s t i r | á k æ r u r n a r | s e m | s á | s e m | h a n d t ó k | l a g ð i | f r a m | á k æ r u r n a r | e r u | s í ð a n | f æ r ð a r | i n n | í | r í k i s t ö l v u k e r f i ð | þ a r | s e m | m á l i ð | e r | r a k i ð |	228480	FEMALE
518	10427166002480161098.wav	Hendur og fætur simpansa eru af svipaðri stærð og lengd sem sýnir að hendur eru notaðar til að bera þyngd þegar gengið er á hnúunum.	hendur og fætur simpansa eru af svipaðri stærð og lengd sem sýnir að hendur eru notaðar til að bera þyngd þegar gengið er á hnúunum	h e n d u r | o g | f æ t u r | s i m p a n s a | e r u | a f | s v i p a ð r i | s t æ r ð | o g | l e n g d | s e m | s ý n i r | a ð | h e n d u r | e r u | n o t a ð a r | t i l | a ð | b e r a | þ y n g d | þ e g a r | g e n g i ð | e r | á | h n ú u n u m |	165120	FEMALE
950	2831071384420897079.wav	Þú munt setja upp auglýsingar þar sem þú býður fram þjónustu þína, gengur um höfnina, talar við fólkið sem er að þrífa snekkjurnar sínar, reynir að hitta hásetana á barnum o.s.frv.	þú munt setja upp auglýsingar þar sem þú býður fram þjónustu þína gengur um höfnina talar við fólkið sem er að þrífa snekkjurnar sínar reynir að hitta hásetana á barnum o.s.frv	þ ú | m u n t | s e t j a | u p p | a u g l ý s i n g a r | þ a r | s e m | þ ú | b ý ð u r | f r a m | þ j ó n u s t u | þ í n a | g e n g u r | u m | h ö f n i n a | t a l a r | v i ð | f ó l k i ð | s e m | e r | a ð | þ r í f a | s n e k k j u r n a r | s í n a r | r e y n i r | a ð | h i t t a | h á s e t a n a | á | b a r n u m | o . s . f r v |	248640	FEMALE
882	16319075660424443403.wav	Einn af öflugu punktum Charlotte í Norður-Karólínu er að þar er nóg af vönduðum valkostum fyrir fjölskyldur.	einn af öflugu punktum charlotte í norður-karólínu er að þar er nóg af vönduðum valkostum fyrir fjölskyldur	e i n n | a f | ö f l u g u | p u n k t u m | c h a r l o t t e | í | n o r ð u r - k a r ó l í n u | e r | a ð | þ a r | e r | n ó g | a f | v ö n d u ð u m | v a l k o s t u m | f y r i r | f j ö l s k y l d u r |	126720	MALE
1484	1109419803027066182.wav	Að lokum, eftir þúsundir eða jafnvel milljónir ára, munu stofnarnir tveir vera orðnir svo frábrugðnir hvor öðrum að ekki verður lengur hægt að kalla þá sömu tegundina.	að lokum eftir þúsundir eða jafnvel milljónir ára munu stofnarnir tveir vera orðnir svo frábrugðnir hvor öðrum að ekki verður lengur hægt að kalla þá sömu tegundina	a ð | l o k u m | e f t i r | þ ú s u n d i r | e ð a | j a f n v e l | m i l l j ó n i r | á r a | m u n u | s t o f n a r n i r | t v e i r | v e r a | o r ð n i r | s v o | f r á b r u g ð n i r | h v o r | ö ð r u m | a ð | e k k i | v e r ð u r | l e n g u r | h æ g t | a ð | k a l l a | þ á | s ö m u | t e g u n d i n a |	184320	MALE
194	3744861505759143298.wav	Schumacher, sem lagði skóna á hilluna árið 2006 eftir að hafa unnið Formúlu 1 meistaratitilinn sjö sinnum, átti að fylla skarð Felipe Massa sem hafði orðið fyrir meiðslum.	schumacher sem lagði skóna á hilluna árið 2006 eftir að hafa unnið formúlu 1 meistaratitilinn sjö sinnum átti að fylla skarð felipe massa sem hafði orðið fyrir meiðslum	s c h u m a c h e r | s e m | l a g ð i | s k ó n a | á | h i l l u n a | á r i ð | 2 0 0 6 | e f t i r | a ð | h a f a | u n n i ð | f o r m ú l u | 1 | m e i s t a r a t i t i l i n n | s j ö | s i n n u m | á t t i | a ð | f y l l a | s k a r ð | f e l i p e | m a s s a | s e m | h a f ð i | o r ð i ð | f y r i r | m e i ð s l u m |	166080	MALE
981	12217261587943754801.wav	Heitustu eyðimerkur geta jafnvel orðið nístingskaldar að næturlagi. Ofkæling er raunveruleg ef hlýjar flíkur eru ekki fyrir hendi.	heitustu eyðimerkur geta jafnvel orðið nístingskaldar að næturlagi ofkæling er raunveruleg ef hlýjar flíkur eru ekki fyrir hendi	h e i t u s t u | e y ð i m e r k u r | g e t a | j a f n v e l | o r ð i ð | n í s t i n g s k a l d a r | a ð | n æ t u r l a g i | o f k æ l i n g | e r | r a u n v e r u l e g | e f | h l ý j a r | f l í k u r | e r u | e k k i | f y r i r | h e n d i |	154560	FEMALE
143	4994723449322671779.wav	Ákvörðun NBA-deildarinnar átti sér stða eftir að leikmaður Utah Jazz reyndist smitaður af COVID-19.	ákvörðun nba-deildarinnar átti sér stða eftir að leikmaður utah jazz reyndist smitaður af covid-19	á k v ö r ð u n | n b a - d e i l d a r i n n a r | á t t i | s é r | s t ð a | e f t i r | a ð | l e i k m a ð u r | u t a h | j a z z | r e y n d i s t | s m i t a ð u r | a f | c o v i d - 1 9 |	114240	MALE
1463	7919613322987334294.wav	Tvíundartala getur einungis haft eitt af tveimur gildum, þ.e.a.s. 0 eða 1 og talað er um slíka tölustafi sem tvíundartölustafi, eða bita á tölvumáli.	tvíundartala getur einungis haft eitt af tveimur gildum þ.e.a.s. 0 eða 1 og talað er um slíka tölustafi sem tvíundartölustafi eða bita á tölvumáli	t v í u n d a r t a l a | g e t u r | e i n u n g i s | h a f t | e i t t | a f | t v e i m u r | g i l d u m | þ . e . a . s . | 0 | e ð a | 1 | o g | t a l a ð | e r | u m | s l í k a | t ö l u s t a f i | s e m | t v í u n d a r t ö l u s t a f i | e ð a | b i t a | á | t ö l v u m á l i |	237120	FEMALE
1463	11167286614726922552.wav	Tvíundartala getur einungis haft eitt af tveimur gildum, þ.e.a.s. 0 eða 1 og talað er um slíka tölustafi sem tvíundartölustafi, eða bita á tölvumáli.	tvíundartala getur einungis haft eitt af tveimur gildum þ.e.a.s. 0 eða 1 og talað er um slíka tölustafi sem tvíundartölustafi eða bita á tölvumáli	t v í u n d a r t a l a | g e t u r | e i n u n g i s | h a f t | e i t t | a f | t v e i m u r | g i l d u m | þ . e . a . s . | 0 | e ð a | 1 | o g | t a l a ð | e r | u m | s l í k a | t ö l u s t a f i | s e m | t v í u n d a r t ö l u s t a f i | e ð a | b i t a | á | t ö l v u m á l i |	254400	FEMALE
340	12484621003105463283.wav	Hann fékk umsvifalaust læknisaðstoð við brautina og var fluttur á sjúkrahús í nágrenninu þar sem hann síðar lést.	hann fékk umsvifalaust læknisaðstoð við brautina og var fluttur á sjúkrahús í nágrenninu þar sem hann síðar lést	h a n n | f é k k | u m s v i f a l a u s t | l æ k n i s a ð s t o ð | v i ð | b r a u t i n a | o g | v a r | f l u t t u r | á | s j ú k r a h ú s | í | n á g r e n n i n u | þ a r | s e m | h a n n | s í ð a r | l é s t |	137280	FEMALE
886	985907044698348876.wav	Ekki þarf að greiða aukalega fyrir að vera með fleiri en 2 farþega. Því gæti þessi valkostur verið dýrari en nauðsyn krefur.	ekki þarf að greiða aukalega fyrir að vera með fleiri en 2 farþega því gæti þessi valkostur verið dýrari en nauðsyn krefur	e k k i | þ a r f | a ð | g r e i ð a | a u k a l e g a | f y r i r | a ð | v e r a | m e ð | f l e i r i | e n | 2 | f a r þ e g a | þ v í | g æ t i | þ e s s i | v a l k o s t u r | v e r i ð | d ý r a r i | e n | n a u ð s y n | k r e f u r |	136320	FEMALE
443	16219507001332029304.wav	Síðustu ár 18. aldar réðust Víetnamar einnig inn í Kambódíu.	síðustu ár 18. aldar réðust víetnamar einnig inn í kambódíu	s í ð u s t u | á r | 1 8 . | a l d a r | r é ð u s t | v í e t n a m a r | e i n n i g | i n n | í | k a m b ó d í u |	125760	FEMALE
1458	7469631593670847321.wav	Nota verður risastóra eldflaug sem er yfir 100 fet á hæð til að koma gervihnetti eða geimsjónauka út í geiminn.	nota verður risastóra eldflaug sem er yfir 100 fet á hæð til að koma gervihnetti eða geimsjónauka út í geiminn	n o t a | v e r ð u r | r i s a s t ó r a | e l d f l a u g | s e m | e r | y f i r | 1 0 0 | f e t | á | h æ ð | t i l | a ð | k o m a | g e r v i h n e t t i | e ð a | g e i m s j ó n a u k a | ú t | í | g e i m i n n |	224640	FEMALE
422	17944535416643172792.wav	Nokkrir þýskir munkar vildu færa Guð nær innfæddum og því fundu þeir upp eistnesku bókstafstunguna.	nokkrir þýskir munkar vildu færa guð nær innfæddum og því fundu þeir upp eistnesku bókstafstunguna	n o k k r i r | þ ý s k i r | m u n k a r | v i l d u | f æ r a | g u ð | n æ r | i n n f æ d d u m | o g | þ v í | f u n d u | þ e i r | u p p | e i s t n e s k u | b ó k s t a f s t u n g u n a |	166080	FEMALE
315	5755288582825828418.wav	Í minnispunktum sínum notaði hann orðalag sem sumum foreldrum fannst fullgróft og hann blótaði oft í tímum.	í minnispunktum sínum notaði hann orðalag sem sumum foreldrum fannst fullgróft og hann blótaði oft í tímum	í | m i n n i s p u n k t u m | s í n u m | n o t a ð i | h a n n | o r ð a l a g | s e m | s u m u m | f o r e l d r u m | f a n n s t | f u l l g r ó f t | o g | h a n n | b l ó t a ð i | o f t | í | t í m u m |	127680	FEMALE
281	3910153894736365299.wav	Skipuleggjendur mótmælanna sögðu að um 100.000 manns hefðu mætt í þýskum borgum á borð við Berlín, Köln, Hamborg og Hannover.	skipuleggjendur mótmælanna sögðu að um 100.000 manns hefðu mætt í þýskum borgum á borð við berlín köln hamborg og hannover	s k i p u l e g g j e n d u r | m ó t m æ l a n n a | s ö g ð u | a ð | u m | 1 0 0 . 0 0 0 | m a n n s | h e f ð u | m æ t t | í | þ ý s k u m | b o r g u m | á | b o r ð | v i ð | b e r l í n | k ö l n | h a m b o r g | o g | h a n n o v e r |	169920	FEMALE
